root@comp3134:~# tcpdump -i enp1s0
tcpdump: verbose output suppressed, use -v or -vv for full protocol decode
listening on enp1s0, link-type EN10MB (Ethernet), capture size 262144 bytes
20:25:38.758093 IP 155.138.140.26.vultr.com.ssh > 2.146.158.104.in-addr.arpa.53986: Flags [P.], seq 3798617461:3798617569, ack 3713425324, win 501, options [nop,nop,TS val 1835574703 ecr 487754294], length 108
20:25:38.758146 IP 155.138.140.26.vultr.com.ssh > 2.146.158.104.in-addr.arpa.53986: Flags [P.], seq 108:260, ack 1, win 501, options [nop,nop,TS val 1835574703 ecr 487754294], length 152
20:25:38.758181 IP 155.138.140.26.vultr.com.ssh > 2.146.158.104.in-addr.arpa.53986: Flags [P.], seq 260:296, ack 1, win 501, options [nop,nop,TS val 1835574703 ecr 487754294], length 36
20:25:38.758673 IP 155.138.140.26.vultr.com.ssh > 2.146.158.104.in-addr.arpa.53986: Flags [P.], seq 296:540, ack 1, win 501, options [nop,nop,TS val 1835574704 ecr 487754294], length 244
20:25:38.758712 IP 155.138.140.26.vultr.com.ssh > 2.146.158.104.in-addr.arpa.53986: Flags [P.], seq 540:796, ack 1, win 501, options [nop,nop,TS val 1835574704 ecr 487754294], length 256
20:25:38.758737 IP 155.138.140.26.vultr.com.ssh > 2.146.158.104.in-addr.arpa.53986: Flags [P.], seq 796:832, ack 1, win 501, options [nop,nop,TS val 1835574704 ecr 487754294], length 36
20:25:38.758752 IP 155.138.140.26.vultr.com.ssh > 2.146.158.104.in-addr.arpa.53986: Flags [P.], seq 832:1052, ack 1, win 501, options [nop,nop,TS val 1835574704 ecr 487754294], length 220
20:25:38.758793 IP 155.138.140.26.vultr.com.ssh > 2.146.158.104.in-addr.arpa.53986: Flags [P.], seq 1052:1344, ack 1, win 501, options [nop,nop,TS val 1835574704 ecr 487754294], length 292
20:25:38.758821 IP 155.138.140.26.vultr.com.ssh > 2.146.158.104.in-addr.arpa.53986: Flags [P.], seq 1344:1564, ack 1, win 501, options [nop,nop,TS val 1835574704 ecr 487754294], length 220
20:25:38.758846 IP 155.138.140.26.vultr.com.ssh > 2.146.158.104.in-addr.arpa.53986: Flags [P.], seq 1564:1600, ack 1, win 501, options [nop,nop,TS val 1835574704 ecr 487754294], length 36
20:25:38.758874 IP 155.138.140.26.vultr.com.ssh > 2.146.158.104.in-addr.arpa.53986: Flags [P.], seq 1600:1820, ack 1, win 501, options [nop,nop,TS val 1835574704 ecr 487754294], length 220
20:25:38.758894 IP 155.138.140.26.vultr.com.ssh > 2.146.158.104.in-addr.arpa.53986: Flags [P.], seq 1820:1856, ack 1, win 501, options [nop,nop,TS val 1835574704 ecr 487754294], length 36
20:25:38.758927 IP 155.138.140.26.vultr.com.ssh > 2.146.158.104.in-addr.arpa.53986: Flags [P.], seq 1856:2084, ack 1, win 501, options [nop,nop,TS val 1835574704 ecr 487754294], length 228
20:25:38.758947 IP 155.138.140.26.vultr.com.ssh > 2.146.158.104.in-addr.arpa.53986: Flags [P.], seq 2084:2120, ack 1, win 501, options [nop,nop,TS val 1835574704 ecr 487754294], length 36
20:25:38.758974 IP 155.138.140.26.vultr.com.ssh > 2.146.158.104.in-addr.arpa.53986: Flags [P.], seq 2120:2348, ack 1, win 501, options [nop,nop,TS val 1835574704 ecr 487754294], length 228
20:25:38.758997 IP 155.138.140.26.vultr.com.ssh > 2.146.158.104.in-addr.arpa.53986: Flags [P.], seq 2348:2384, ack 1, win 501, options [nop,nop,TS val 1835574704 ecr 487754294], length 36
20:25:38.759027 IP 155.138.140.26.vultr.com.ssh > 2.146.158.104.in-addr.arpa.53986: Flags [P.], seq 2384:2612, ack 1, win 501, options [nop,nop,TS val 1835574704 ecr 487754294], length 228
20:25:38.759052 IP 155.138.140.26.vultr.com.ssh > 2.146.158.104.in-addr.arpa.53986: Flags [P.], seq 2612:2648, ack 1, win 501, options [nop,nop,TS val 1835574704 ecr 487754294], length 36
20:25:38.759081 IP 155.138.140.26.vultr.com.ssh > 2.146.158.104.in-addr.arpa.53986: Flags [P.], seq 2648:2876, ack 1, win 501, options [nop,nop,TS val 1835574704 ecr 487754294], length 228
20:25:38.759102 IP 155.138.140.26.vultr.com.ssh > 2.146.158.104.in-addr.arpa.53986: Flags [P.], seq 2876:2912, ack 1, win 501, options [nop,nop,TS val 1835574704 ecr 487754294], length 36
20:25:38.759130 IP 155.138.140.26.vultr.com.ssh > 2.146.158.104.in-addr.arpa.53986: Flags [P.], seq 2912:3140, ack 1, win 501, options [nop,nop,TS val 1835574704 ecr 487754294], length 228
20:25:38.759151 IP 155.138.140.26.vultr.com.ssh > 2.146.158.104.in-addr.arpa.53986: Flags [P.], seq 3140:3176, ack 1, win 501, options [nop,nop,TS val 1835574704 ecr 487754294], length 36
20:25:38.759178 IP 155.138.140.26.vultr.com.ssh > 2.146.158.104.in-addr.arpa.53986: Flags [P.], seq 3176:3404, ack 1, win 501, options [nop,nop,TS val 1835574704 ecr 487754294], length 228
20:25:38.759197 IP 155.138.140.26.vultr.com.ssh > 2.146.158.104.in-addr.arpa.53986: Flags [P.], seq 3404:3440, ack 1, win 501, options [nop,nop,TS val 1835574704 ecr 487754294], length 36
20:25:38.759226 IP 155.138.140.26.vultr.com.ssh > 2.146.158.104.in-addr.arpa.53986: Flags [P.], seq 3440:3668, ack 1, win 501, options [nop,nop,TS val 1835574704 ecr 487754294], length 228
20:25:38.759247 IP 155.138.140.26.vultr.com.ssh > 2.146.158.104.in-addr.arpa.53986: Flags [P.], seq 3668:3704, ack 1, win 501, options [nop,nop,TS val 1835574704 ecr 487754294], length 36
20:25:38.759276 IP 155.138.140.26.vultr.com.ssh > 2.146.158.104.in-addr.arpa.53986: Flags [P.], seq 3704:3932, ack 1, win 501, options [nop,nop,TS val 1835574704 ecr 487754294], length 228
20:25:38.759296 IP 155.138.140.26.vultr.com.ssh > 2.146.158.104.in-addr.arpa.53986: Flags [P.], seq 3932:3968, ack 1, win 501, options [nop,nop,TS val 1835574704 ecr 487754294], length 36
20:25:38.759323 IP 155.138.140.26.vultr.com.ssh > 2.146.158.104.in-addr.arpa.53986: Flags [P.], seq 3968:4196, ack 1, win 501, options [nop,nop,TS val 1835574704 ecr 487754294], length 228
20:25:38.759343 IP 155.138.140.26.vultr.com.ssh > 2.146.158.104.in-addr.arpa.53986: Flags [P.], seq 4196:4232, ack 1, win 501, options [nop,nop,TS val 1835574704 ecr 487754294], length 36
20:25:38.759373 IP 155.138.140.26.vultr.com.ssh > 2.146.158.104.in-addr.arpa.53986: Flags [P.], seq 4232:4460, ack 1, win 501, options [nop,nop,TS val 1835574704 ecr 487754294], length 228
20:25:38.759395 IP 155.138.140.26.vultr.com.ssh > 2.146.158.104.in-addr.arpa.53986: Flags [P.], seq 4460:4496, ack 1, win 501, options [nop,nop,TS val 1835574704 ecr 487754294], length 36
20:25:38.759422 IP 155.138.140.26.vultr.com.ssh > 2.146.158.104.in-addr.arpa.53986: Flags [P.], seq 4496:4724, ack 1, win 501, options [nop,nop,TS val 1835574704 ecr 487754294], length 228
20:25:38.759446 IP 155.138.140.26.vultr.com.ssh > 2.146.158.104.in-addr.arpa.53986: Flags [P.], seq 4724:4760, ack 1, win 501, options [nop,nop,TS val 1835574704 ecr 487754294], length 36
20:25:38.759476 IP 155.138.140.26.vultr.com.ssh > 2.146.158.104.in-addr.arpa.53986: Flags [P.], seq 4760:4988, ack 1, win 501, options [nop,nop,TS val 1835574704 ecr 487754294], length 228
20:25:38.759496 IP 155.138.140.26.vultr.com.ssh > 2.146.158.104.in-addr.arpa.53986: Flags [P.], seq 4988:5024, ack 1, win 501, options [nop,nop,TS val 1835574705 ecr 487754294], length 36
20:25:38.759529 IP 155.138.140.26.vultr.com.ssh > 2.146.158.104.in-addr.arpa.53986: Flags [P.], seq 5024:5252, ack 1, win 501, options [nop,nop,TS val 1835574705 ecr 487754294], length 228
20:25:38.759550 IP 155.138.140.26.vultr.com.ssh > 2.146.158.104.in-addr.arpa.53986: Flags [P.], seq 5252:5288, ack 1, win 501, options [nop,nop,TS val 1835574705 ecr 487754294], length 36
20:25:38.759576 IP 155.138.140.26.vultr.com.ssh > 2.146.158.104.in-addr.arpa.53986: Flags [P.], seq 5288:5516, ack 1, win 501, options [nop,nop,TS val 1835574705 ecr 487754294], length 228
20:25:38.759601 IP 155.138.140.26.vultr.com.ssh > 2.146.158.104.in-addr.arpa.53986: Flags [P.], seq 5516:5552, ack 1, win 501, options [nop,nop,TS val 1835574705 ecr 487754294], length 36
20:25:38.759629 IP 155.138.140.26.vultr.com.ssh > 2.146.158.104.in-addr.arpa.53986: Flags [P.], seq 5552:5780, ack 1, win 501, options [nop,nop,TS val 1835574705 ecr 487754294], length 228
20:25:38.759647 IP 155.138.140.26.vultr.com.ssh > 2.146.158.104.in-addr.arpa.53986: Flags [P.], seq 5780:5816, ack 1, win 501, options [nop,nop,TS val 1835574705 ecr 487754294], length 36
20:25:38.759680 IP 155.138.140.26.vultr.com.ssh > 2.146.158.104.in-addr.arpa.53986: Flags [P.], seq 5816:6044, ack 1, win 501, options [nop,nop,TS val 1835574705 ecr 487754294], length 228
20:25:38.759701 IP 155.138.140.26.vultr.com.ssh > 2.146.158.104.in-addr.arpa.53986: Flags [P.], seq 6044:6080, ack 1, win 501, options [nop,nop,TS val 1835574705 ecr 487754294], length 36
20:25:38.759727 IP 155.138.140.26.vultr.com.ssh > 2.146.158.104.in-addr.arpa.53986: Flags [P.], seq 6080:6308, ack 1, win 501, options [nop,nop,TS val 1835574705 ecr 487754294], length 228
20:25:38.759752 IP 155.138.140.26.vultr.com.ssh > 2.146.158.104.in-addr.arpa.53986: Flags [P.], seq 6308:6344, ack 1, win 501, options [nop,nop,TS val 1835574705 ecr 487754294], length 36
20:25:38.759780 IP 155.138.140.26.vultr.com.ssh > 2.146.158.104.in-addr.arpa.53986: Flags [P.], seq 6344:6572, ack 1, win 501, options [nop,nop,TS val 1835574705 ecr 487754294], length 228
20:25:38.759800 IP 155.138.140.26.vultr.com.ssh > 2.146.158.104.in-addr.arpa.53986: Flags [P.], seq 6572:6608, ack 1, win 501, options [nop,nop,TS val 1835574705 ecr 487754294], length 36
20:25:38.759833 IP 155.138.140.26.vultr.com.ssh > 2.146.158.104.in-addr.arpa.53986: Flags [P.], seq 6608:6836, ack 1, win 501, options [nop,nop,TS val 1835574705 ecr 487754294], length 228
20:25:38.759853 IP 155.138.140.26.vultr.com.ssh > 2.146.158.104.in-addr.arpa.53986: Flags [P.], seq 6836:6872, ack 1, win 501, options [nop,nop,TS val 1835574705 ecr 487754294], length 36
20:25:38.759879 IP 155.138.140.26.vultr.com.ssh > 2.146.158.104.in-addr.arpa.53986: Flags [P.], seq 6872:7100, ack 1, win 501, options [nop,nop,TS val 1835574705 ecr 487754294], length 228
20:25:38.759903 IP 155.138.140.26.vultr.com.ssh > 2.146.158.104.in-addr.arpa.53986: Flags [P.], seq 7100:7136, ack 1, win 501, options [nop,nop,TS val 1835574705 ecr 487754294], length 36
20:25:38.759933 IP 155.138.140.26.vultr.com.ssh > 2.146.158.104.in-addr.arpa.53986: Flags [P.], seq 7136:7364, ack 1, win 501, options [nop,nop,TS val 1835574705 ecr 487754294], length 228
20:25:38.759952 IP 155.138.140.26.vultr.com.ssh > 2.146.158.104.in-addr.arpa.53986: Flags [P.], seq 7364:7400, ack 1, win 501, options [nop,nop,TS val 1835574705 ecr 487754294], length 36
20:25:38.759984 IP 155.138.140.26.vultr.com.ssh > 2.146.158.104.in-addr.arpa.53986: Flags [P.], seq 7400:7628, ack 1, win 501, options [nop,nop,TS val 1835574705 ecr 487754294], length 228
20:25:38.760006 IP 155.138.140.26.vultr.com.ssh > 2.146.158.104.in-addr.arpa.53986: Flags [P.], seq 7628:7664, ack 1, win 501, options [nop,nop,TS val 1835574705 ecr 487754294], length 36
20:25:38.760033 IP 155.138.140.26.vultr.com.ssh > 2.146.158.104.in-addr.arpa.53986: Flags [P.], seq 7664:7892, ack 1, win 501, options [nop,nop,TS val 1835574705 ecr 487754294], length 228
20:25:38.760057 IP 155.138.140.26.vultr.com.ssh > 2.146.158.104.in-addr.arpa.53986: Flags [P.], seq 7892:7928, ack 1, win 501, options [nop,nop,TS val 1835574705 ecr 487754294], length 36
20:25:38.760085 IP 155.138.140.26.vultr.com.ssh > 2.146.158.104.in-addr.arpa.53986: Flags [P.], seq 7928:8156, ack 1, win 501, options [nop,nop,TS val 1835574705 ecr 487754294], length 228
20:25:38.760104 IP 155.138.140.26.vultr.com.ssh > 2.146.158.104.in-addr.arpa.53986: Flags [P.], seq 8156:8192, ack 1, win 501, options [nop,nop,TS val 1835574705 ecr 487754294], length 36
20:25:38.760135 IP 155.138.140.26.vultr.com.ssh > 2.146.158.104.in-addr.arpa.53986: Flags [P.], seq 8192:8420, ack 1, win 501, options [nop,nop,TS val 1835574705 ecr 487754294], length 228
20:25:38.760157 IP 155.138.140.26.vultr.com.ssh > 2.146.158.104.in-addr.arpa.53986: Flags [P.], seq 8420:8456, ack 1, win 501, options [nop,nop,TS val 1835574705 ecr 487754294], length 36
20:25:38.760185 IP 155.138.140.26.vultr.com.ssh > 2.146.158.104.in-addr.arpa.53986: Flags [P.], seq 8456:8684, ack 1, win 501, options [nop,nop,TS val 1835574705 ecr 487754294], length 228
20:25:38.760238 IP 155.138.140.26.vultr.com.ssh > 2.146.158.104.in-addr.arpa.53986: Flags [P.], seq 8720:8948, ack 1, win 501, options [nop,nop,TS val 1835574705 ecr 487754294], length 228
20:25:38.760288 IP 155.138.140.26.vultr.com.ssh > 2.146.158.104.in-addr.arpa.53986: Flags [P.], seq 8984:9212, ack 1, win 501, options [nop,nop,TS val 1835574705 ecr 487754294], length 228
20:25:38.760337 IP 155.138.140.26.vultr.com.ssh > 2.146.158.104.in-addr.arpa.53986: Flags [P.], seq 9248:9476, ack 1, win 501, options [nop,nop,TS val 1835574705 ecr 487754294], length 228
20:25:38.760390 IP 155.138.140.26.vultr.com.ssh > 2.146.158.104.in-addr.arpa.53986: Flags [P.], seq 9512:9740, ack 1, win 501, options [nop,nop,TS val 1835574705 ecr 487754294], length 228
20:25:38.760441 IP 155.138.140.26.vultr.com.ssh > 2.146.158.104.in-addr.arpa.53986: Flags [P.], seq 9776:10004, ack 1, win 501, options [nop,nop,TS val 1835574705 ecr 487754294], length 228
20:25:38.760489 IP 155.138.140.26.vultr.com.ssh > 2.146.158.104.in-addr.arpa.53986: Flags [P.], seq 10040:10268, ack 1, win 501, options [nop,nop,TS val 1835574706 ecr 487754294], length 228
20:25:38.760534 IP 155.138.140.26.vultr.com.ssh > 2.146.158.104.in-addr.arpa.53986: Flags [P.], seq 10304:10532, ack 1, win 501, options [nop,nop,TS val 1835574706 ecr 487754294], length 228
20:25:38.760584 IP 155.138.140.26.vultr.com.ssh > 2.146.158.104.in-addr.arpa.53986: Flags [P.], seq 10568:10796, ack 1, win 501, options [nop,nop,TS val 1835574706 ecr 487754294], length 228
20:25:38.760633 IP 155.138.140.26.vultr.com.ssh > 2.146.158.104.in-addr.arpa.53986: Flags [P.], seq 10832:11060, ack 1, win 501, options [nop,nop,TS val 1835574706 ecr 487754294], length 228
20:25:38.760685 IP 155.138.140.26.vultr.com.ssh > 2.146.158.104.in-addr.arpa.53986: Flags [P.], seq 11096:11324, ack 1, win 501, options [nop,nop,TS val 1835574706 ecr 487754294], length 228
20:25:38.760736 IP 155.138.140.26.vultr.com.ssh > 2.146.158.104.in-addr.arpa.53986: Flags [P.], seq 11360:11588, ack 1, win 501, options [nop,nop,TS val 1835574706 ecr 487754294], length 228
20:25:38.760820 IP 155.138.140.26.vultr.com.ssh > 2.146.158.104.in-addr.arpa.53986: Flags [P.], seq 11624:11852, ack 1, win 501, options [nop,nop,TS val 1835574706 ecr 487754294], length 228
20:25:38.760873 IP 155.138.140.26.vultr.com.ssh > 2.146.158.104.in-addr.arpa.53986: Flags [P.], seq 11888:12116, ack 1, win 501, options [nop,nop,TS val 1835574706 ecr 487754294], length 228
20:25:38.760926 IP 155.138.140.26.vultr.com.ssh > 2.146.158.104.in-addr.arpa.53986: Flags [P.], seq 12152:12380, ack 1, win 501, options [nop,nop,TS val 1835574706 ecr 487754294], length 228
20:25:38.760974 IP 155.138.140.26.vultr.com.ssh > 2.146.158.104.in-addr.arpa.53986: Flags [P.], seq 12416:12644, ack 1, win 501, options [nop,nop,TS val 1835574706 ecr 487754294], length 228
20:25:38.761028 IP 155.138.140.26.vultr.com.ssh > 2.146.158.104.in-addr.arpa.53986: Flags [P.], seq 12680:12908, ack 1, win 501, options [nop,nop,TS val 1835574706 ecr 487754294], length 228
20:25:38.761097 IP 155.138.140.26.vultr.com.ssh > 2.146.158.104.in-addr.arpa.53986: Flags [P.], seq 12944:13172, ack 1, win 501, options [nop,nop,TS val 1835574706 ecr 487754294], length 228
20:25:38.761145 IP 155.138.140.26.vultr.com.ssh > 2.146.158.104.in-addr.arpa.53986: Flags [P.], seq 13208:13436, ack 1, win 501, options [nop,nop,TS val 1835574706 ecr 487754294], length 228
20:25:38.761194 IP 155.138.140.26.vultr.com.ssh > 2.146.158.104.in-addr.arpa.53986: Flags [P.], seq 13472:13700, ack 1, win 501, options [nop,nop,TS val 1835574706 ecr 487754294], length 228
20:25:38.761244 IP 155.138.140.26.vultr.com.ssh > 2.146.158.104.in-addr.arpa.53986: Flags [P.], seq 13736:13964, ack 1, win 501, options [nop,nop,TS val 1835574706 ecr 487754294], length 228
20:25:38.761296 IP 155.138.140.26.vultr.com.ssh > 2.146.158.104.in-addr.arpa.53986: Flags [P.], seq 14000:14228, ack 1, win 501, options [nop,nop,TS val 1835574706 ecr 487754294], length 228
20:25:38.761345 IP 155.138.140.26.vultr.com.ssh > 2.146.158.104.in-addr.arpa.53986: Flags [P.], seq 14264:14492, ack 1, win 501, options [nop,nop,TS val 1835574706 ecr 487754294], length 228
20:25:38.761394 IP 155.138.140.26.vultr.com.ssh > 2.146.158.104.in-addr.arpa.53986: Flags [P.], seq 14528:14756, ack 1, win 501, options [nop,nop,TS val 1835574706 ecr 487754294], length 228
20:25:38.761441 IP 155.138.140.26.vultr.com.ssh > 2.146.158.104.in-addr.arpa.53986: Flags [P.], seq 14792:15020, ack 1, win 501, options [nop,nop,TS val 1835574706 ecr 487754294], length 228
20:25:38.761491 IP 155.138.140.26.vultr.com.ssh > 2.146.158.104.in-addr.arpa.53986: Flags [P.], seq 15056:15284, ack 1, win 501, options [nop,nop,TS val 1835574707 ecr 487754294], length 228
20:25:38.761539 IP 155.138.140.26.vultr.com.ssh > 2.146.158.104.in-addr.arpa.53986: Flags [P.], seq 15320:15548, ack 1, win 501, options [nop,nop,TS val 1835574707 ecr 487754294], length 228
20:25:38.761591 IP 155.138.140.26.vultr.com.ssh > 2.146.158.104.in-addr.arpa.53986: Flags [P.], seq 15584:15812, ack 1, win 501, options [nop,nop,TS val 1835574707 ecr 487754294], length 228
20:25:38.761643 IP 155.138.140.26.vultr.com.ssh > 2.146.158.104.in-addr.arpa.53986: Flags [P.], seq 15848:16076, ack 1, win 501, options [nop,nop,TS val 1835574707 ecr 487754294], length 228
20:25:38.761691 IP 155.138.140.26.vultr.com.ssh > 2.146.158.104.in-addr.arpa.53986: Flags [P.], seq 16112:16340, ack 1, win 501, options [nop,nop,TS val 1835574707 ecr 487754294], length 228
20:25:38.761757 IP 155.138.140.26.vultr.com.ssh > 2.146.158.104.in-addr.arpa.53986: Flags [P.], seq 16376:16604, ack 1, win 501, options [nop,nop,TS val 1835574707 ecr 487754294], length 228
20:25:38.761810 IP 155.138.140.26.vultr.com.ssh > 2.146.158.104.in-addr.arpa.53986: Flags [P.], seq 16640:16868, ack 1, win 501, options [nop,nop,TS val 1835574707 ecr 487754294], length 228
20:25:38.761858 IP 155.138.140.26.vultr.com.ssh > 2.146.158.104.in-addr.arpa.53986: Flags [P.], seq 16904:17132, ack 1, win 501, options [nop,nop,TS val 1835574707 ecr 487754294], length 228
20:25:38.761910 IP 155.138.140.26.vultr.com.ssh > 2.146.158.104.in-addr.arpa.53986: Flags [P.], seq 17168:17396, ack 1, win 501, options [nop,nop,TS val 1835574707 ecr 487754294], length 228
20:25:38.761956 IP 155.138.140.26.vultr.com.ssh > 2.146.158.104.in-addr.arpa.53986: Flags [P.], seq 17432:17660, ack 1, win 501, options [nop,nop,TS val 1835574707 ecr 487754294], length 228
20:25:38.762003 IP 155.138.140.26.vultr.com.ssh > 2.146.158.104.in-addr.arpa.53986: Flags [P.], seq 17696:17924, ack 1, win 501, options [nop,nop,TS val 1835574707 ecr 487754294], length 228
20:25:38.762058 IP 155.138.140.26.vultr.com.ssh > 2.146.158.104.in-addr.arpa.53986: Flags [P.], seq 17960:18188, ack 1, win 501, options [nop,nop,TS val 1835574707 ecr 487754294], length 228
20:25:38.762107 IP 155.138.140.26.vultr.com.ssh > 2.146.158.104.in-addr.arpa.53986: Flags [P.], seq 18224:18452, ack 1, win 501, options [nop,nop,TS val 1835574707 ecr 487754294], length 228
20:25:38.762157 IP 155.138.140.26.vultr.com.ssh > 2.146.158.104.in-addr.arpa.53986: Flags [P.], seq 18488:18716, ack 1, win 501, options [nop,nop,TS val 1835574707 ecr 487754294], length 228
20:25:38.762210 IP 155.138.140.26.vultr.com.ssh > 2.146.158.104.in-addr.arpa.53986: Flags [P.], seq 18752:18980, ack 1, win 501, options [nop,nop,TS val 1835574707 ecr 487754294], length 228
20:25:38.762261 IP 155.138.140.26.vultr.com.ssh > 2.146.158.104.in-addr.arpa.53986: Flags [P.], seq 19016:19244, ack 1, win 501, options [nop,nop,TS val 1835574707 ecr 487754294], length 228
20:25:38.762317 IP 155.138.140.26.vultr.com.ssh > 2.146.158.104.in-addr.arpa.53986: Flags [P.], seq 19280:19508, ack 1, win 501, options [nop,nop,TS val 1835574707 ecr 487754294], length 228
20:25:38.762383 IP 155.138.140.26.vultr.com.ssh > 2.146.158.104.in-addr.arpa.53986: Flags [P.], seq 19544:19772, ack 1, win 501, options [nop,nop,TS val 1835574707 ecr 487754294], length 228
20:25:38.762441 IP 155.138.140.26.vultr.com.ssh > 2.146.158.104.in-addr.arpa.53986: Flags [P.], seq 19808:20036, ack 1, win 501, options [nop,nop,TS val 1835574707 ecr 487754294], length 228
20:25:38.762513 IP 155.138.140.26.vultr.com.ssh > 2.146.158.104.in-addr.arpa.53986: Flags [P.], seq 20072:20300, ack 1, win 501, options [nop,nop,TS val 1835574708 ecr 487754294], length 228
20:25:38.762569 IP 155.138.140.26.vultr.com.ssh > 2.146.158.104.in-addr.arpa.53986: Flags [P.], seq 20336:20564, ack 1, win 501, options [nop,nop,TS val 1835574708 ecr 487754294], length 228
20:25:38.762623 IP 155.138.140.26.vultr.com.ssh > 2.146.158.104.in-addr.arpa.53986: Flags [P.], seq 20600:20828, ack 1, win 501, options [nop,nop,TS val 1835574708 ecr 487754294], length 228
20:25:38.762670 IP 155.138.140.26.vultr.com.ssh > 2.146.158.104.in-addr.arpa.53986: Flags [P.], seq 20864:21092, ack 1, win 501, options [nop,nop,TS val 1835574708 ecr 487754294], length 228
20:25:38.762725 IP 155.138.140.26.vultr.com.ssh > 2.146.158.104.in-addr.arpa.53986: Flags [P.], seq 21128:21356, ack 1, win 501, options [nop,nop,TS val 1835574708 ecr 487754294], length 228
20:25:38.762775 IP 155.138.140.26.vultr.com.ssh > 2.146.158.104.in-addr.arpa.53986: Flags [P.], seq 21392:21620, ack 1, win 501, options [nop,nop,TS val 1835574708 ecr 487754294], length 228
20:25:38.762822 IP 155.138.140.26.vultr.com.ssh > 2.146.158.104.in-addr.arpa.53986: Flags [P.], seq 21656:21884, ack 1, win 501, options [nop,nop,TS val 1835574708 ecr 487754294], length 228
20:25:38.762867 IP 155.138.140.26.vultr.com.ssh > 2.146.158.104.in-addr.arpa.53986: Flags [P.], seq 21920:22148, ack 1, win 501, options [nop,nop,TS val 1835574708 ecr 487754294], length 228
20:25:38.762918 IP 155.138.140.26.vultr.com.ssh > 2.146.158.104.in-addr.arpa.53986: Flags [P.], seq 22184:22412, ack 1, win 501, options [nop,nop,TS val 1835574708 ecr 487754294], length 228
20:25:38.762966 IP 155.138.140.26.vultr.com.ssh > 2.146.158.104.in-addr.arpa.53986: Flags [P.], seq 22448:22676, ack 1, win 501, options [nop,nop,TS val 1835574708 ecr 487754294], length 228
20:25:38.763019 IP 155.138.140.26.vultr.com.ssh > 2.146.158.104.in-addr.arpa.53986: Flags [P.], seq 22712:22940, ack 1, win 501, options [nop,nop,TS val 1835574708 ecr 487754294], length 228
20:25:38.763071 IP 155.138.140.26.vultr.com.ssh > 2.146.158.104.in-addr.arpa.53986: Flags [P.], seq 22976:23204, ack 1, win 501, options [nop,nop,TS val 1835574708 ecr 487754294], length 228
20:25:38.763119 IP 155.138.140.26.vultr.com.ssh > 2.146.158.104.in-addr.arpa.53986: Flags [P.], seq 23240:23468, ack 1, win 501, options [nop,nop,TS val 1835574708 ecr 487754294], length 228
20:25:38.763171 IP 155.138.140.26.vultr.com.ssh > 2.146.158.104.in-addr.arpa.53986: Flags [P.], seq 23504:23732, ack 1, win 501, options [nop,nop,TS val 1835574708 ecr 487754294], length 228
20:25:38.763224 IP 155.138.140.26.vultr.com.ssh > 2.146.158.104.in-addr.arpa.53986: Flags [P.], seq 23768:23996, ack 1, win 501, options [nop,nop,TS val 1835574708 ecr 487754294], length 228
20:25:38.763269 IP 155.138.140.26.vultr.com.ssh > 2.146.158.104.in-addr.arpa.53986: Flags [P.], seq 24032:24260, ack 1, win 501, options [nop,nop,TS val 1835574708 ecr 487754294], length 228
20:25:38.763322 IP 155.138.140.26.vultr.com.ssh > 2.146.158.104.in-addr.arpa.53986: Flags [P.], seq 24296:24524, ack 1, win 501, options [nop,nop,TS val 1835574708 ecr 487754294], length 228
20:25:38.763372 IP 155.138.140.26.vultr.com.ssh > 2.146.158.104.in-addr.arpa.53986: Flags [P.], seq 24560:24788, ack 1, win 501, options [nop,nop,TS val 1835574708 ecr 487754294], length 228
20:25:38.763434 IP 155.138.140.26.vultr.com.ssh > 2.146.158.104.in-addr.arpa.53986: Flags [P.], seq 24824:25052, ack 1, win 501, options [nop,nop,TS val 1835574708 ecr 487754294], length 228
20:25:38.763488 IP 155.138.140.26.vultr.com.ssh > 2.146.158.104.in-addr.arpa.53986: Flags [P.], seq 25088:25316, ack 1, win 501, options [nop,nop,TS val 1835574709 ecr 487754294], length 228
20:25:38.763541 IP 155.138.140.26.vultr.com.ssh > 2.146.158.104.in-addr.arpa.53986: Flags [P.], seq 25352:25580, ack 1, win 501, options [nop,nop,TS val 1835574709 ecr 487754294], length 228
20:25:38.763589 IP 155.138.140.26.vultr.com.ssh > 2.146.158.104.in-addr.arpa.53986: Flags [P.], seq 25616:25844, ack 1, win 501, options [nop,nop,TS val 1835574709 ecr 487754294], length 228
20:25:38.763642 IP 155.138.140.26.vultr.com.ssh > 2.146.158.104.in-addr.arpa.53986: Flags [P.], seq 25880:26108, ack 1, win 501, options [nop,nop,TS val 1835574709 ecr 487754294], length 228
20:25:38.763693 IP 155.138.140.26.vultr.com.ssh > 2.146.158.104.in-addr.arpa.53986: Flags [P.], seq 26144:26372, ack 1, win 501, options [nop,nop,TS val 1835574709 ecr 487754294], length 228
20:25:38.763743 IP 155.138.140.26.vultr.com.ssh > 2.146.158.104.in-addr.arpa.53986: Flags [P.], seq 26408:26636, ack 1, win 501, options [nop,nop,TS val 1835574709 ecr 487754294], length 228
20:25:38.763795 IP 155.138.140.26.vultr.com.ssh > 2.146.158.104.in-addr.arpa.53986: Flags [P.], seq 26672:26900, ack 1, win 501, options [nop,nop,TS val 1835574709 ecr 487754294], length 228
20:25:38.763848 IP 155.138.140.26.vultr.com.ssh > 2.146.158.104.in-addr.arpa.53986: Flags [P.], seq 26936:27164, ack 1, win 501, options [nop,nop,TS val 1835574709 ecr 487754294], length 228
20:25:38.763894 IP 155.138.140.26.vultr.com.ssh > 2.146.158.104.in-addr.arpa.53986: Flags [P.], seq 27200:27428, ack 1, win 501, options [nop,nop,TS val 1835574709 ecr 487754294], length 228
20:25:38.763947 IP 155.138.140.26.vultr.com.ssh > 2.146.158.104.in-addr.arpa.53986: Flags [P.], seq 27464:27692, ack 1, win 501, options [nop,nop,TS val 1835574709 ecr 487754294], length 228
20:25:38.763996 IP 155.138.140.26.vultr.com.ssh > 2.146.158.104.in-addr.arpa.53986: Flags [P.], seq 27728:27956, ack 1, win 501, options [nop,nop,TS val 1835574709 ecr 487754294], length 228
20:25:38.764045 IP 155.138.140.26.vultr.com.ssh > 2.146.158.104.in-addr.arpa.53986: Flags [P.], seq 27992:28220, ack 1, win 501, options [nop,nop,TS val 1835574709 ecr 487754294], length 228
20:25:38.764098 IP 155.138.140.26.vultr.com.ssh > 2.146.158.104.in-addr.arpa.53986: Flags [P.], seq 28256:28484, ack 1, win 501, options [nop,nop,TS val 1835574709 ecr 487754294], length 228
20:25:38.764152 IP 155.138.140.26.vultr.com.ssh > 2.146.158.104.in-addr.arpa.53986: Flags [P.], seq 28520:28748, ack 1, win 501, options [nop,nop,TS val 1835574709 ecr 487754294], length 228
20:25:38.764196 IP 155.138.140.26.vultr.com.ssh > 2.146.158.104.in-addr.arpa.53986: Flags [P.], seq 28784:29012, ack 1, win 501, options [nop,nop,TS val 1835574709 ecr 487754294], length 228
20:25:38.764249 IP 155.138.140.26.vultr.com.ssh > 2.146.158.104.in-addr.arpa.53986: Flags [P.], seq 29048:29276, ack 1, win 501, options [nop,nop,TS val 1835574709 ecr 487754294], length 228
20:25:38.764302 IP 155.138.140.26.vultr.com.ssh > 2.146.158.104.in-addr.arpa.53986: Flags [P.], seq 29312:29540, ack 1, win 501, options [nop,nop,TS val 1835574709 ecr 487754294], length 228
20:25:38.764350 IP 155.138.140.26.vultr.com.ssh > 2.146.158.104.in-addr.arpa.53986: Flags [P.], seq 29576:29804, ack 1, win 501, options [nop,nop,TS val 1835574709 ecr 487754294], length 228
20:25:38.764416 IP 155.138.140.26.vultr.com.ssh > 2.146.158.104.in-addr.arpa.53986: Flags [P.], seq 29840:30068, ack 1, win 501, options [nop,nop,TS val 1835574709 ecr 487754294], length 228
20:25:38.764480 IP 155.138.140.26.vultr.com.ssh > 2.146.158.104.in-addr.arpa.53986: Flags [P.], seq 30104:30332, ack 1, win 501, options [nop,nop,TS val 1835574709 ecr 487754294], length 228
20:25:38.764529 IP 155.138.140.26.vultr.com.ssh > 2.146.158.104.in-addr.arpa.53986: Flags [P.], seq 30368:30596, ack 1, win 501, options [nop,nop,TS val 1835574710 ecr 487754294], length 228
20:25:38.764582 IP 155.138.140.26.vultr.com.ssh > 2.146.158.104.in-addr.arpa.53986: Flags [P.], seq 30632:30860, ack 1, win 501, options [nop,nop,TS val 1835574710 ecr 487754294], length 228
20:25:38.764632 IP 155.138.140.26.vultr.com.ssh > 2.146.158.104.in-addr.arpa.53986: Flags [P.], seq 30896:31124, ack 1, win 501, options [nop,nop,TS val 1835574710 ecr 487754294], length 228
20:25:38.764680 IP 155.138.140.26.vultr.com.ssh > 2.146.158.104.in-addr.arpa.53986: Flags [P.], seq 31160:31388, ack 1, win 501, options [nop,nop,TS val 1835574710 ecr 487754294], length 228
20:25:38.764733 IP 155.138.140.26.vultr.com.ssh > 2.146.158.104.in-addr.arpa.53986: Flags [P.], seq 31424:31652, ack 1, win 501, options [nop,nop,TS val 1835574710 ecr 487754294], length 228
20:25:38.764801 IP 155.138.140.26.vultr.com.ssh > 2.146.158.104.in-addr.arpa.53986: Flags [P.], seq 31688:31916, ack 1, win 501, options [nop,nop,TS val 1835574710 ecr 487754294], length 228
20:25:38.764849 IP 155.138.140.26.vultr.com.ssh > 2.146.158.104.in-addr.arpa.53986: Flags [P.], seq 31952:32180, ack 1, win 501, options [nop,nop,TS val 1835574710 ecr 487754294], length 228
20:25:38.764903 IP 155.138.140.26.vultr.com.ssh > 2.146.158.104.in-addr.arpa.53986: Flags [P.], seq 32216:32444, ack 1, win 501, options [nop,nop,TS val 1835574710 ecr 487754294], length 228
20:25:38.764938 IP 155.138.140.26.vultr.com.ssh > 2.146.158.104.in-addr.arpa.53986: Flags [P.], seq 32444:32672, ack 1, win 501, options [nop,nop,TS val 1835574710 ecr 487754294], length 228
20:25:38.764988 IP 155.138.140.26.vultr.com.ssh > 2.146.158.104.in-addr.arpa.53986: Flags [P.], seq 32672:33476, ack 1, win 501, options [nop,nop,TS val 1835574710 ecr 487754294], length 804
20:25:38.765040 IP 155.138.140.26.vultr.com.ssh > 2.146.158.104.in-addr.arpa.53986: Flags [P.], seq 33476:34472, ack 1, win 501, options [nop,nop,TS val 1835574710 ecr 487754294], length 996
20:25:38.765148 IP 155.138.140.26.vultr.com.ssh > 2.146.158.104.in-addr.arpa.53986: Flags [P.], seq 34472:35084, ack 1, win 501, options [nop,nop,TS val 1835574710 ecr 487754294], length 612
20:25:38.765190 IP 155.138.140.26.vultr.com.ssh > 2.146.158.104.in-addr.arpa.53986: Flags [P.], seq 35084:35312, ack 1, win 501, options [nop,nop,TS val 1835574710 ecr 487754294], length 228
20:25:38.765235 IP 155.138.140.26.vultr.com.ssh > 2.146.158.104.in-addr.arpa.53986: Flags [P.], seq 35312:36116, ack 1, win 501, options [nop,nop,TS val 1835574710 ecr 487754294], length 804
20:25:38.765279 IP 155.138.140.26.vultr.com.ssh > 2.146.158.104.in-addr.arpa.53986: Flags [P.], seq 36116:36920, ack 1, win 501, options [nop,nop,TS val 1835574710 ecr 487754294], length 804
20:25:38.765320 IP 155.138.140.26.vultr.com.ssh > 2.146.158.104.in-addr.arpa.53986: Flags [P.], seq 36920:37532, ack 1, win 501, options [nop,nop,TS val 1835574710 ecr 487754294], length 612
20:25:38.765370 IP 155.138.140.26.vultr.com.ssh > 2.146.158.104.in-addr.arpa.53986: Flags [P.], seq 37532:38336, ack 1, win 501, options [nop,nop,TS val 1835574710 ecr 487754294], length 804
20:25:38.765415 IP 155.138.140.26.vultr.com.ssh > 2.146.158.104.in-addr.arpa.53986: Flags [P.], seq 38336:39140, ack 1, win 501, options [nop,nop,TS val 1835574710 ecr 487754294], length 804
20:25:38.765467 IP 155.138.140.26.vultr.com.ssh > 2.146.158.104.in-addr.arpa.53986: Flags [P.], seq 39140:39752, ack 1, win 501, options [nop,nop,TS val 1835574710 ecr 487754294], length 612
20:25:38.765520 IP 155.138.140.26.vultr.com.ssh > 2.146.158.104.in-addr.arpa.53986: Flags [P.], seq 39752:40556, ack 1, win 501, options [nop,nop,TS val 1835574711 ecr 487754294], length 804
20:25:38.765571 IP 155.138.140.26.vultr.com.ssh > 2.146.158.104.in-addr.arpa.53986: Flags [P.], seq 40556:41168, ack 1, win 501, options [nop,nop,TS val 1835574711 ecr 487754294], length 612
20:25:38.765604 IP 155.138.140.26.vultr.com.ssh > 2.146.158.104.in-addr.arpa.53986: Flags [P.], seq 41168:41396, ack 1, win 501, options [nop,nop,TS val 1835574711 ecr 487754294], length 228
20:25:38.765640 IP 155.138.140.26.vultr.com.ssh > 2.146.158.104.in-addr.arpa.53986: Flags [P.], seq 41396:41624, ack 1, win 501, options [nop,nop,TS val 1835574711 ecr 487754294], length 228
20:25:38.765675 IP 155.138.140.26.vultr.com.ssh > 2.146.158.104.in-addr.arpa.53986: Flags [P.], seq 41624:41852, ack 1, win 501, options [nop,nop,TS val 1835574711 ecr 487754294], length 228
20:25:38.765706 IP 155.138.140.26.vultr.com.ssh > 2.146.158.104.in-addr.arpa.53986: Flags [P.], seq 41852:42080, ack 1, win 501, options [nop,nop,TS val 1835574711 ecr 487754294], length 228
20:25:38.765738 IP 155.138.140.26.vultr.com.ssh > 2.146.158.104.in-addr.arpa.53986: Flags [P.], seq 42080:42308, ack 1, win 501, options [nop,nop,TS val 1835574711 ecr 487754294], length 228
20:25:38.765771 IP 155.138.140.26.vultr.com.ssh > 2.146.158.104.in-addr.arpa.53986: Flags [P.], seq 42308:42536, ack 1, win 501, options [nop,nop,TS val 1835574711 ecr 487754294], length 228
20:25:38.765803 IP 155.138.140.26.vultr.com.ssh > 2.146.158.104.in-addr.arpa.53986: Flags [P.], seq 42536:42764, ack 1, win 501, options [nop,nop,TS val 1835574711 ecr 487754294], length 228
20:25:38.765834 IP 155.138.140.26.vultr.com.ssh > 2.146.158.104.in-addr.arpa.53986: Flags [P.], seq 42764:42992, ack 1, win 501, options [nop,nop,TS val 1835574711 ecr 487754294], length 228
20:25:38.765872 IP 155.138.140.26.vultr.com.ssh > 2.146.158.104.in-addr.arpa.53986: Flags [P.], seq 42992:43220, ack 1, win 501, options [nop,nop,TS val 1835574711 ecr 487754294], length 228
20:25:38.765904 IP 155.138.140.26.vultr.com.ssh > 2.146.158.104.in-addr.arpa.53986: Flags [P.], seq 43220:43448, ack 1, win 501, options [nop,nop,TS val 1835574711 ecr 487754294], length 228
20:25:38.765944 IP 155.138.140.26.vultr.com.ssh > 2.146.158.104.in-addr.arpa.53986: Flags [P.], seq 43448:43676, ack 1, win 501, options [nop,nop,TS val 1835574711 ecr 487754294], length 228
20:25:38.765975 IP 155.138.140.26.vultr.com.ssh > 2.146.158.104.in-addr.arpa.53986: Flags [P.], seq 43676:43904, ack 1, win 501, options [nop,nop,TS val 1835574711 ecr 487754294], length 228
20:25:38.766006 IP 155.138.140.26.vultr.com.ssh > 2.146.158.104.in-addr.arpa.53986: Flags [P.], seq 43904:44132, ack 1, win 501, options [nop,nop,TS val 1835574711 ecr 487754294], length 228
20:25:38.766044 IP 155.138.140.26.vultr.com.ssh > 2.146.158.104.in-addr.arpa.53986: Flags [P.], seq 44132:44360, ack 1, win 501, options [nop,nop,TS val 1835574711 ecr 487754294], length 228
20:25:38.766078 IP 155.138.140.26.vultr.com.ssh > 2.146.158.104.in-addr.arpa.53986: Flags [P.], seq 44360:44588, ack 1, win 501, options [nop,nop,TS val 1835574711 ecr 487754294], length 228
20:25:38.766109 IP 155.138.140.26.vultr.com.ssh > 2.146.158.104.in-addr.arpa.53986: Flags [P.], seq 44588:44816, ack 1, win 501, options [nop,nop,TS val 1835574711 ecr 487754294], length 228
20:25:38.766145 IP 155.138.140.26.vultr.com.ssh > 2.146.158.104.in-addr.arpa.53986: Flags [P.], seq 44816:45044, ack 1, win 501, options [nop,nop,TS val 1835574711 ecr 487754294], length 228
20:25:38.766178 IP 155.138.140.26.vultr.com.ssh > 2.146.158.104.in-addr.arpa.53986: Flags [P.], seq 45044:45272, ack 1, win 501, options [nop,nop,TS val 1835574711 ecr 487754294], length 228
20:25:38.766216 IP 155.138.140.26.vultr.com.ssh > 2.146.158.104.in-addr.arpa.53986: Flags [P.], seq 45272:45500, ack 1, win 501, options [nop,nop,TS val 1835574711 ecr 487754294], length 228
20:25:38.766252 IP 155.138.140.26.vultr.com.ssh > 2.146.158.104.in-addr.arpa.53986: Flags [P.], seq 45500:45728, ack 1, win 501, options [nop,nop,TS val 1835574711 ecr 487754294], length 228
20:25:38.766284 IP 155.138.140.26.vultr.com.ssh > 2.146.158.104.in-addr.arpa.53986: Flags [P.], seq 45728:45956, ack 1, win 501, options [nop,nop,TS val 1835574711 ecr 487754294], length 228
20:25:38.766316 IP 155.138.140.26.vultr.com.ssh > 2.146.158.104.in-addr.arpa.53986: Flags [P.], seq 45956:46184, ack 1, win 501, options [nop,nop,TS val 1835574711 ecr 487754294], length 228
20:25:38.766347 IP 155.138.140.26.vultr.com.ssh > 2.146.158.104.in-addr.arpa.53986: Flags [P.], seq 46184:46412, ack 1, win 501, options [nop,nop,TS val 1835574711 ecr 487754294], length 228
20:25:38.766385 IP 155.138.140.26.vultr.com.ssh > 2.146.158.104.in-addr.arpa.53986: Flags [P.], seq 46412:46640, ack 1, win 501, options [nop,nop,TS val 1835574711 ecr 487754294], length 228
20:25:38.766419 IP 155.138.140.26.vultr.com.ssh > 2.146.158.104.in-addr.arpa.53986: Flags [P.], seq 46640:46868, ack 1, win 501, options [nop,nop,TS val 1835574711 ecr 487754294], length 228
20:25:38.766469 IP 155.138.140.26.vultr.com.ssh > 2.146.158.104.in-addr.arpa.53986: Flags [P.], seq 46868:47096, ack 1, win 501, options [nop,nop,TS val 1835574711 ecr 487754294], length 228
20:25:38.766511 IP 155.138.140.26.vultr.com.ssh > 2.146.158.104.in-addr.arpa.53986: Flags [P.], seq 47096:47324, ack 1, win 501, options [nop,nop,TS val 1835574712 ecr 487754294], length 228
20:25:38.766544 IP 155.138.140.26.vultr.com.ssh > 2.146.158.104.in-addr.arpa.53986: Flags [P.], seq 47324:47552, ack 1, win 501, options [nop,nop,TS val 1835574712 ecr 487754294], length 228
20:25:38.766581 IP 155.138.140.26.vultr.com.ssh > 2.146.158.104.in-addr.arpa.53986: Flags [P.], seq 47552:47780, ack 1, win 501, options [nop,nop,TS val 1835574712 ecr 487754294], length 228
20:25:38.766616 IP 155.138.140.26.vultr.com.ssh > 2.146.158.104.in-addr.arpa.53986: Flags [P.], seq 47780:48008, ack 1, win 501, options [nop,nop,TS val 1835574712 ecr 487754294], length 228
20:25:38.766648 IP 155.138.140.26.vultr.com.ssh > 2.146.158.104.in-addr.arpa.53986: Flags [P.], seq 48008:48236, ack 1, win 501, options [nop,nop,TS val 1835574712 ecr 487754294], length 228
20:25:38.766684 IP 155.138.140.26.vultr.com.ssh > 2.146.158.104.in-addr.arpa.53986: Flags [P.], seq 48236:48464, ack 1, win 501, options [nop,nop,TS val 1835574712 ecr 487754294], length 228
20:25:38.766719 IP 155.138.140.26.vultr.com.ssh > 2.146.158.104.in-addr.arpa.53986: Flags [P.], seq 48464:48692, ack 1, win 501, options [nop,nop,TS val 1835574712 ecr 487754294], length 228
20:25:38.766754 IP 155.138.140.26.vultr.com.ssh > 2.146.158.104.in-addr.arpa.53986: Flags [P.], seq 48692:48920, ack 1, win 501, options [nop,nop,TS val 1835574712 ecr 487754294], length 228
20:25:38.766790 IP 155.138.140.26.vultr.com.ssh > 2.146.158.104.in-addr.arpa.53986: Flags [P.], seq 48920:49148, ack 1, win 501, options [nop,nop,TS val 1835574712 ecr 487754294], length 228
20:25:38.766822 IP 155.138.140.26.vultr.com.ssh > 2.146.158.104.in-addr.arpa.53986: Flags [P.], seq 49148:49376, ack 1, win 501, options [nop,nop,TS val 1835574712 ecr 487754294], length 228
20:25:38.766859 IP 155.138.140.26.vultr.com.ssh > 2.146.158.104.in-addr.arpa.53986: Flags [P.], seq 49376:49604, ack 1, win 501, options [nop,nop,TS val 1835574712 ecr 487754294], length 228
20:25:38.766892 IP 155.138.140.26.vultr.com.ssh > 2.146.158.104.in-addr.arpa.53986: Flags [P.], seq 49604:49832, ack 1, win 501, options [nop,nop,TS val 1835574712 ecr 487754294], length 228
20:25:38.766924 IP 155.138.140.26.vultr.com.ssh > 2.146.158.104.in-addr.arpa.53986: Flags [P.], seq 49832:50060, ack 1, win 501, options [nop,nop,TS val 1835574712 ecr 487754294], length 228
20:25:38.766961 IP 155.138.140.26.vultr.com.ssh > 2.146.158.104.in-addr.arpa.53986: Flags [P.], seq 50060:50288, ack 1, win 501, options [nop,nop,TS val 1835574712 ecr 487754294], length 228
20:25:38.766992 IP 155.138.140.26.vultr.com.ssh > 2.146.158.104.in-addr.arpa.53986: Flags [P.], seq 50288:50516, ack 1, win 501, options [nop,nop,TS val 1835574712 ecr 487754294], length 228
20:25:38.767023 IP 155.138.140.26.vultr.com.ssh > 2.146.158.104.in-addr.arpa.53986: Flags [P.], seq 50516:50744, ack 1, win 501, options [nop,nop,TS val 1835574712 ecr 487754294], length 228
20:25:38.767060 IP 155.138.140.26.vultr.com.ssh > 2.146.158.104.in-addr.arpa.53986: Flags [P.], seq 50744:50972, ack 1, win 501, options [nop,nop,TS val 1835574712 ecr 487754294], length 228
