root@comp3134:~# tcpdump -A -i enp1s0
tcpdump: verbose output suppressed, use -v or -vv for full protocol decode
listening on enp1s0, link-type EN10MB (Ethernet), capture size 262144 bytes
20:27:33.993155 IP 155.138.140.26.vultr.com.ssh > 2.146.158.104.in-addr.arpa.53986: Flags [P.], seq 3799869125:3799869233, ack 3713430736, win 501, options [nop,nop,TS val 1835689938 ecr 487869526], length 108
E.....@.@..Y....h........}f..Vt....."......
mjg...LV.P!W...vZX.R.8.i....o..........a,;.8........Tqr...z..?..@S..!.....o.#....x........}..OI..3.C.tu....b>6..-..p
20:27:33.993406 IP 155.138.140.26.vultr.com.ssh > 2.146.158.104.in-addr.arpa.53986: Flags [P.], seq 108:144, ack 1, win 501, options [nop,nop,TS val 1835689938 ecr 487869526], length 36
E..X..@.@.......h........}g1.Vt....."......
mjg...LV..Y3Ph..........|...+..u*.Y...To."..
20:27:33.993438 IP 155.138.140.26.vultr.com.ssh > 2.146.158.104.in-addr.arpa.53986: Flags [P.], seq 144:260, ack 1, win 501, options [nop,nop,TS val 1835689938 ecr 487869526], length 116
E.....@.@..O....h........}gU.Vt....."......
mjg...LV4....k. ....?....X.0|..s.|cH.....5G..G>P..5H...3..-.... ..........t.Cr..
...,z.
..
*.id.n..cn$..".4..Q...7.J....w..h
20:27:33.993462 IP 155.138.140.26.vultr.com.ssh > 2.146.158.104.in-addr.arpa.53986: Flags [P.], seq 260:296, ack 1, win 501, options [nop,nop,TS val 1835689938 ecr 487869526], length 36
E..X..@.@.......h........}g..Vt....."......
mjg...LVBn....g....><..:...B..*.h...w.......
20:27:33.994068 IP 155.138.140.26.vultr.com.ssh > 2.146.158.104.in-addr.arpa.53986: Flags [P.], seq 296:540, ack 1, win 501, options [nop,nop,TS val 1835689939 ecr 487869526], length 244
E..(..@.@.......h........}g..Vt.....#`.....
mjg...LV....h...8...U|......
..i:.C6Er~.."...&5.).z.u.2.x..he..k.9..`%z..2....p V...=...*:.......-..!..3....L"l	w.P...=T...L..px.O"[.	].hu.%QU.n4..A .....F......Ca..t..2:...lP..+.o.mh..k....2...K....~...T....O.....6....K%X.]4.....).......7..>:..l...>4.
20:27:33.994098 IP 155.138.140.26.vultr.com.ssh > 2.146.158.104.in-addr.arpa.53986: Flags [P.], seq 540:576, ack 1, win 501, options [nop,nop,TS val 1835689939 ecr 487869526], length 36
E..X..@.@.......h........}h..Vt....."......
mjg...LV...+.e.f.57.>\3.yH.a..7P....G(.?`Q(b
20:27:33.994124 IP 155.138.140.26.vultr.com.ssh > 2.146.158.104.in-addr.arpa.53986: Flags [P.], seq 576:660, ack 1, win 501, options [nop,nop,TS val 1835689939 ecr 487869526], length 84
E.....@.@..k....h........}i..Vt....."......
mjg...LVxzf...a4i...c.?i..&c$.....F........w&..L._V.~3.....}...+.}...Wq....A.P#.E.b...C.wRX.
20:27:33.994149 IP 155.138.140.26.vultr.com.ssh > 2.146.158.104.in-addr.arpa.53986: Flags [P.], seq 660:696, ack 1, win 501, options [nop,nop,TS val 1835689939 ecr 487869526], length 36
E..X..@.@.......h........}iY.Vt....."......
mjg...LVo.[...E. v$...p".]. .k......mN.Uz.#?
20:27:33.994177 IP 155.138.140.26.vultr.com.ssh > 2.146.158.104.in-addr.arpa.53986: Flags [P.], seq 696:852, ack 1, win 501, options [nop,nop,TS val 1835689939 ecr 487869526], length 156
E.....@.@..!....h........}i}.Vt.....#......
mjg...LVE$.C...B....le.6..&.t........yOJV..m`.C.h^...j(.....C....4$.X.a.f.*......)U.fw.....D[....m)A{),&.e#.d.'.....>.|,L.k(>?..x..*.N...81........6...)q..Ra-.M....
20:27:33.994195 IP 155.138.140.26.vultr.com.ssh > 2.146.158.104.in-addr.arpa.53986: Flags [P.], seq 852:888, ack 1, win 501, options [nop,nop,TS val 1835689939 ecr 487869526], length 36
E..X..@.@.......h........}j..Vt....."......
mjg...LV._1.}..G.D A....*........\..g8...w..
20:27:33.994230 IP 155.138.140.26.vultr.com.ssh > 2.146.158.104.in-addr.arpa.53986: Flags [P.], seq 888:1108, ack 1, win 501, options [nop,nop,TS val 1835689939 ecr 487869526], length 220
E.....@.@.......h........}j=.Vt.....#H.....
mjg...LV|e..]A6.5..k....hf..s.@.S.......g.7..K..[J...ix...2....E....7P..u_L-|..}..W....e.....$..>..,.?t...#.g..2B.S.y.29y..u..27.3....n...-...C.?.C2...!z..T.8$.c..HI.l.9}DAi.....E...#z....GD.H.B....w2.~Cy.+....).Y..>"...^..9i.9.
20:27:33.994250 IP 155.138.140.26.vultr.com.ssh > 2.146.158.104.in-addr.arpa.53986: Flags [P.], seq 1108:1144, ack 1, win 501, options [nop,nop,TS val 1835689939 ecr 487869526], length 36
E..X..@.@.......h........}k..Vt....."......
mjg...LV.v.i...W.;.T^I.{+BK......(W.l-..%. .
20:27:33.994275 IP 155.138.140.26.vultr.com.ssh > 2.146.158.104.in-addr.arpa.53986: Flags [P.], seq 1144:1228, ack 1, win 501, options [nop,nop,TS val 1835689939 ecr 487869526], length 84
E.....@.@..e....h........}k=.Vt....."......
mjg...LV........:..NSh......t..j.qG...0.xC..x....B.>_.K...4O..T.c^.b.~P.-.x..`.Q`...1U..*.Rx
20:27:33.994298 IP 155.138.140.26.vultr.com.ssh > 2.146.158.104.in-addr.arpa.53986: Flags [P.], seq 1228:1264, ack 1, win 501, options [nop,nop,TS val 1835689939 ecr 487869526], length 36
E..X..@.@.......h........}k..Vt....."......
mjg...LV.=P........h..../..}...]Y$;...KJd...
20:27:33.994323 IP 155.138.140.26.vultr.com.ssh > 2.146.158.104.in-addr.arpa.53986: Flags [P.], seq 1264:1348, ack 1, win 501, options [nop,nop,TS val 1835689939 ecr 487869526], length 84
E.....@.@..c....h........}k..Vt....."......
mjg...LVaTu.+...`..=...SJo..n.....r...%q.*....q].Y)..=_p.8.S..WK...Q...kS......G"!..9......&
20:27:33.994342 IP 155.138.140.26.vultr.com.ssh > 2.146.158.104.in-addr.arpa.53986: Flags [P.], seq 1348:1384, ack 1, win 501, options [nop,nop,TS val 1835689939 ecr 487869526], length 36
E..X..@.@.......h........}l	.Vt....."......
mjg...LVc..4....m(.'@-ohi;a
E..BdMu../..x4..
20:27:33.994375 IP 155.138.140.26.vultr.com.ssh > 2.146.158.104.in-addr.arpa.53986: Flags [P.], seq 1384:1604, ack 1, win 501, options [nop,nop,TS val 1835689939 ecr 487869526], length 220
E.....@.@.......h........}l-.Vt.....#H.....
mjg...LVj....e.M....._............N..E......t.....N../cI..W....*.[xD.0A.O.....29.e.FZ.a.'..>....DT..n..'M+.....iB."C.o../.......4...G...H....@.NR..S.......9?.V1?].):YQ1.I.....k..
........j.M...x..s-...y..b..!........Z.....`.....
20:27:33.994394 IP 155.138.140.26.vultr.com.ssh > 2.146.158.104.in-addr.arpa.53986: Flags [P.], seq 1604:1640, ack 1, win 501, options [nop,nop,TS val 1835689939 ecr 487869526], length 36
E..X..@.@.......h........}m	.Vt....."......
mjg...LVP.^...X.$A.
..y.....%[<....Y...F..~.
20:27:33.994416 IP 155.138.140.26.vultr.com.ssh > 2.146.158.104.in-addr.arpa.53986: Flags [P.], seq 1640:1724, ack 1, win 501, options [nop,nop,TS val 1835689939 ecr 487869526], length 84
E.....@.@.._....h........}m-.Vt....."......
mjg...LV$..&..	..>.......0..(.m-..8.7.3.]-5c.R....lo]..:..i...pe.XJt2.].m....o.1....fKT.n..K
20:27:33.994448 IP 155.138.140.26.vultr.com.ssh > 2.146.158.104.in-addr.arpa.53986: Flags [P.], seq 1724:1760, ack 1, win 501, options [nop,nop,TS val 1835689939 ecr 487869526], length 36
E..X..@.@.......h........}m..Vt....."......
mjg...LV.).p.-.......H......d..z;...6..Q. zH
20:27:33.994492 IP 155.138.140.26.vultr.com.ssh > 2.146.158.104.in-addr.arpa.53986: Flags [P.], seq 1760:1876, ack 1, win 501, options [nop,nop,TS val 1835689940 ecr 487869526], length 116
E.....@.@..=....h........}m..Vt....."......
mjg...LV#.9o...>...!.>.<.H.o..6|...S.{.P.=..... 	....::p...
..W
......2b.F..L.`2..;r.B.G.)c~V....6.U'v...'V#..=r.G.h*.@...'.
20:27:33.994526 IP 155.138.140.26.vultr.com.ssh > 2.146.158.104.in-addr.arpa.53986: Flags [P.], seq 1876:1912, ack 1, win 501, options [nop,nop,TS val 1835689940 ecr 487869526], length 36
E..X..@.@.......h........}n..Vt....."......
mjg...LV..c.y.........X.V3=...@	.......`.@I1
20:27:33.994571 IP 155.138.140.26.vultr.com.ssh > 2.146.158.104.in-addr.arpa.53986: Flags [P.], seq 1912:1956, ack 1, win 501, options [nop,nop,TS val 1835689940 ecr 487869526], length 44
E..`..@.@.......h........}n=.Vt....."......
mjg...LVb...E.!...h1s.l|,...E.."]...zqp...o-...5....
20:27:33.994598 IP 155.138.140.26.vultr.com.ssh > 2.146.158.104.in-addr.arpa.53986: Flags [P.], seq 1956:1992, ack 1, win 501, options [nop,nop,TS val 1835689940 ecr 487869526], length 36
E..X..@.@.......h........}ni.Vt....."......
mjg...LV....#..../.;V2..g-|..I........~...-`
20:27:33.994620 IP 155.138.140.26.vultr.com.ssh > 2.146.158.104.in-addr.arpa.53986: Flags [P.], seq 1992:2028, ack 1, win 501, options [nop,nop,TS val 1835689940 ecr 487869526], length 36
E..X..@.@.......h........}n..Vt....."......
mjg...LV...W.......LU.gf..l...{.....I.......
20:27:33.994640 IP 155.138.140.26.vultr.com.ssh > 2.146.158.104.in-addr.arpa.53986: Flags [P.], seq 2028:2064, ack 1, win 501, options [nop,nop,TS val 1835689940 ecr 487869526], length 36
E..X..@.@.......h........}n..Vt....."......
mjg...LV.......`.....@a..4...5.G..n.wr.x.3^$
20:27:33.994669 IP 155.138.140.26.vultr.com.ssh > 2.146.158.104.in-addr.arpa.53986: Flags [P.], seq 2064:2132, ack 1, win 501, options [nop,nop,TS val 1835689940 ecr 487869526], length 68
E..x..@.@..g....h........}n..Vt....."......
mjg...LV%og..t;-...^
!n.xm..E!....jH.....3......}....*h..m...Y..-0..9.....Qf
20:27:33.994689 IP 155.138.140.26.vultr.com.ssh > 2.146.158.104.in-addr.arpa.53986: Flags [P.], seq 2132:2168, ack 1, win 501, options [nop,nop,TS val 1835689940 ecr 487869526], length 36
E..X..@.@.......h........}o..Vt....."......
mjg...LV..e.S...MqO+U.4..h....R..g...&.e.W..
20:27:33.994722 IP 155.138.140.26.vultr.com.ssh > 2.146.158.104.in-addr.arpa.53986: Flags [P.], seq 2168:2388, ack 1, win 501, options [nop,nop,TS val 1835689940 ecr 487869526], length 220
E.....@.@.......h........}o=.Vt.....#H.....
mjg...LVA......?W..d...9p...I...h..a.Y..y3.K...:..0:....j...u.y
.y..ky.V..8.].s.EJ(...v.Lv..	_.`..7.....+s..{.Z...h.B.....
..SZ.,bG...E....$x..2.Kp.......G....s.....X0..F.Q8Lk^...K.h.g.YQ.8..o.|.G.......=..q4....s..L4..j...d..'.
20:27:33.994742 IP 155.138.140.26.vultr.com.ssh > 2.146.158.104.in-addr.arpa.53986: Flags [P.], seq 2388:2424, ack 1, win 501, options [nop,nop,TS val 1835689940 ecr 487869526], length 36
E..X..@.@.......h........}p..Vt....."......
mjg...LV....C.C..g.....)s.]$pkp......,?%e.A|
20:27:33.994765 IP 155.138.140.26.vultr.com.ssh > 2.146.158.104.in-addr.arpa.53986: Flags [P.], seq 2424:2508, ack 1, win 501, options [nop,nop,TS val 1835689940 ecr 487869526], length 84
E.....@.@..S....h........}p=.Vt....."......
mjg...LV.........H.1.../].&\1o.....'s.&..n@.._.j.b...@.).........).[e	....."........\}...O3?
20:27:33.994789 IP 155.138.140.26.vultr.com.ssh > 2.146.158.104.in-addr.arpa.53986: Flags [P.], seq 2508:2544, ack 1, win 501, options [nop,nop,TS val 1835689940 ecr 487869526], length 36
E..X..@.@.......h........}p..Vt....."......
mjg...LVv.'..Qm<..`Q..x...?...... .
	`.R.L\(
20:27:33.994814 IP 155.138.140.26.vultr.com.ssh > 2.146.158.104.in-addr.arpa.53986: Flags [P.], seq 2544:2628, ack 1, win 501, options [nop,nop,TS val 1835689940 ecr 487869526], length 84
E.....@.@..Q....h........}p..Vt....."......
mjg...LV."v.L.L...cLpPV.(...D......D..'..._.W./......v.....u..\........l..B...F....A..fGF..=
20:27:33.994834 IP 155.138.140.26.vultr.com.ssh > 2.146.158.104.in-addr.arpa.53986: Flags [P.], seq 2628:2664, ack 1, win 501, options [nop,nop,TS val 1835689940 ecr 487869526], length 36
E..X..@.@.......h........}q	.Vt....."......
mjg...LV.sa.\.`... .W..@Y.z...%|ZyO..i...f..
20:27:33.994866 IP 155.138.140.26.vultr.com.ssh > 2.146.158.104.in-addr.arpa.53986: Flags [P.], seq 2664:2884, ack 1, win 501, options [nop,nop,TS val 1835689940 ecr 487869526], length 220
E.....@.@.......h........}q-.Vt.....#H.....
mjg...LV.*VZm.\@z...e
....z..m.@..}...&..-.........|u.....5.
."........FO.v.l'4...YK....\R.V.M..Us...[.
..j...P..b!?..3...h.'.A..I...d(v.[..Q. ..a.Mx.....[....:.}..}]....4.p.[...`E.......q.[..`2..u.].cb......d..~...C.2.....j<.o.
20:27:33.994884 IP 155.138.140.26.vultr.com.ssh > 2.146.158.104.in-addr.arpa.53986: Flags [P.], seq 2884:2920, ack 1, win 501, options [nop,nop,TS val 1835689940 ecr 487869526], length 36
E..X..@.@..~....h........}r	.Vt....."......
mjg...LV.=.	....0_w.A...e.R;..Y..#.Q.Z
-..4.
20:27:33.995138 IP 155.138.140.26.vultr.com.ssh > 2.146.158.104.in-addr.arpa.53986: Flags [P.], seq 3584:3804, ack 1, win 501, options [nop,nop,TS val 1835689940 ecr 487869526], length 220
E.....@.@.......h........}t..Vt.....#H.....
mjg...LV...3..%].|C..
.-..V..L.........Bq.g.a.;=...........tQU..Y...0h...../|O.V.M...;!;....W.a........!.}..E6........@......J.....4.J.....E.....Hk.......~...p..ZP...}......S.....k.o,bx.B.{...3.".`...G...2.1B....!.)).^....N..vJ	
20:27:33.995319 IP 155.138.140.26.vultr.com.ssh > 2.146.158.104.in-addr.arpa.53986: Flags [P.], seq 4080:4300, ack 1, win 501, options [nop,nop,TS val 1835689940 ecr 487869526], length 220
E.....@.@.......h........}v..Vt.....#H.....
mjg...LV.9.....t/...Q..._...FF. .n...AL....(.Qy.!s..`.*+.eS%...j.b...&.W.Gk
F.....~.[... .....U)M2..F~...{z.v..z8..'..S.C...>J....[	..]...O......c.a...A.....1....m.......N....m.S..X.z.......{..5`...pz3....=.....O.s........H..K.|
20:27:33.995464 IP 155.138.140.26.vultr.com.ssh > 2.146.158.104.in-addr.arpa.53986: Flags [P.], seq 4624:4844, ack 1, win 501, options [nop,nop,TS val 1835689940 ecr 487869526], length 220
E.....@.@.......h........}x..Vt.....#H.....
mjg...LV.....0.....].a..@...m....%.......Kr."&..q/^$.R...../..Y.x.`...u...n).D.....&Z...)`...@s<v._f0......5.....W........V|.....KfoaYv8.jC:hF..:...J...%>..^.......u@..=..-f..i..wdW#....xCb6.;..e@..j...TyiaR.}..%..C....[.Al...9.
20:27:33.995608 IP 155.138.140.26.vultr.com.ssh > 2.146.158.104.in-addr.arpa.53986: Flags [P.], seq 5120:5340, ack 1, win 501, options [nop,nop,TS val 1835689941 ecr 487869526], length 220
E.....@.@.......h........}z..Vt.....#H.....
mjg...LV..?.9..(.j..I1.r..u.....j.K.7Nr..z.U<..?..........~.LJ.0{1......w...".X..A@.M.bc._e..u...?.e.He...V...9.}.
>K........z....r...r.jtq.!.I.zo..b.g%E...g........u.......0.Oj..*a..;I.Jx...p.W.\.N...N4b.wy.cO...!_T.n.t<..l...V
20:27:33.995758 IP 155.138.140.26.vultr.com.ssh > 2.146.158.104.in-addr.arpa.53986: Flags [P.], seq 5736:5956, ack 1, win 501, options [nop,nop,TS val 1835689941 ecr 487869526], length 220
E.....@.@.......h........}}-.Vt.....#H.....
mjg...LV....Q....dR.......(zHr...d)\o..>.*.b.....=\...pB.Y.B,..3.6..n..:..KVpzB2F..^]....Iint..	M.^H2....:J...M.....wC.~..qQ/F6..F4.?..D.M..GP....w..
....O......E........../.U...Ve..5...yqi...L9'......+...M..[.oX.....#....|..+..
20:27:33.995903 IP 155.138.140.26.vultr.com.ssh > 2.146.158.104.in-addr.arpa.53986: Flags [P.], seq 6232:6460, ack 1, win 501, options [nop,nop,TS val 1835689941 ecr 487869526], length 228
E.....@.@.......h........}...Vt.....#P.....
mjg...LV;$.l..khv.....U.c..8..VXk.#ph....'k.	.wOH..tvyJ..=......:>.......f....^..e....'...T.8........HT.U.......Of....k....[.....I.\.....0F.0....X.....q&........}...t....m..I...@.....7.CZt....,.d......J.v}..^..R,..b.......'3..B.l.%Jm.8}
20:27:33.996054 IP 155.138.140.26.vultr.com.ssh > 2.146.158.104.in-addr.arpa.53986: Flags [P.], seq 6920:7148, ack 1, win 501, options [nop,nop,TS val 1835689941 ecr 487869526], length 228
E.....@.@.......h........}...Vt.....#P.....
mjg...LV.....yp.B ...*..iujJ..F._q..(.....d............Y....i@..........e.f.".x...........S..}.7V1..&.P.....fE.*G..n..v...+...)gP}..0....FW...\IU..<=........pfo..ak.6m.)..hV.. ?o........QrA....._....O.1...#..w.Z~...X.k....5....6H6..`.A.
20:27:33.996196 IP 155.138.140.26.vultr.com.ssh > 2.146.158.104.in-addr.arpa.53986: Flags [P.], seq 7424:7652, ack 1, win 501, options [nop,nop,TS val 1835689941 ecr 487869526], length 228
E.....@.@.......h........}...Vt.....#P.....
mjg...LV......4...}v.T.}...	/....O.$.u...........V....d....P.Qx...+8.n.....t.I.....S..[q.2..!.U......z2.>....0..`......%....+81tI..M.jL.x.2.i.......S..J....X.5.Z.Cxg....K..:..N.....*..Z.#........f....^..swW;.........u?Jm	...I.~..5<.i.+.
20:27:33.996349 IP 155.138.140.26.vultr.com.ssh > 2.146.158.104.in-addr.arpa.53986: Flags [P.], seq 7976:8204, ack 1, win 501, options [nop,nop,TS val 1835689941 ecr 487869526], length 228
E.....@.@.......h........}...Vt.....#P.....
mjg...LV5.{..........C..|>...K*%..f.|.#.X..9..@=.4.OB!WB....&v.$`.-...=...!..s!."....pw...&.^....w.....i6.....Dm....v...........'2~...l[".H5...7.u.c....;dTr..5<}G...[.)...B:..uaG.f..g...$h+U..y.I...L..)7.Y...r..v..a*.{+'..z.
dgj.....rC.
20:27:33.996491 IP 155.138.140.26.vultr.com.ssh > 2.146.158.104.in-addr.arpa.53986: Flags [P.], seq 8480:8708, ack 1, win 501, options [nop,nop,TS val 1835689942 ecr 487869526], length 228
E.....@.@..~....h........}...Vt.....#P.....
mjg...LVd.%CuM r+N...6{.d.7u......-.O..a....SH+....4%\.7.d..cb.wh.X.#q)....f(.	<...z....En%.r....6..a.80.?t.5.<.?..6dH..fS.Q...}..pI....zW.5D.N.i...O....S.../..*...<.........-....\.....n..........PY.......d.(..|...s..G.x0."cS._.!.....xG
20:27:33.996645 IP 155.138.140.26.vultr.com.ssh > 2.146.158.104.in-addr.arpa.53986: Flags [P.], seq 9032:9260, ack 1, win 501, options [nop,nop,TS val 1835689942 ecr 487869526], length 228
E.....@.@..x....h........}...Vt.....#P.....
mjg...LVe.O.a.5]P.Y........x{.J.&...n...q...S.....-<.x
k.k....z..U&.b..P.......z.-.'.. ..EB2QX..%D.k	W.tZ.OW.!t...2..:..Vb.Z[....u...~aU.%.......?..&...a(y..[)$m...;...L.....d.....k.........@`...Dx.@....&!.R....g.`-..-......g.3.....>.l?
20:27:33.996893 IP 155.138.140.26.vultr.com.ssh > 2.146.158.104.in-addr.arpa.53986: Flags [P.], seq 9680:9908, ack 1, win 501, options [nop,nop,TS val 1835689942 ecr 487869526], length 228
E.....@.@..n....h........}...Vt.....#P.....
mjg...LV.....S....L$....OrfP.....D0@....9.#.:...0.>..x.....b...1...b.L........y...:]{.w..&u......6M.\.ns..s....B..:..w%A.H.............#...~..&<.G.%C.P.6
j.........^<...B.9$...<N.7.@-.Z~e}....*'...:.X+......F......5.^.D.{...n.s.t .<3.q.
20:27:33.997109 IP 155.138.140.26.vultr.com.ssh > 2.146.158.104.in-addr.arpa.53986: Flags [P.], seq 10432:10660, ack 1, win 501, options [nop,nop,TS val 1835689942 ecr 487869526], length 228
E....$@.@..f....h........}...Vt.....#P.....
mjg...LV.y.....T..S.v.72K..K8..E........g.o....M.`9.K2.O.7..y.|7I..Vn.d.lF.. .."...(....1...D#.!...c......$._.F>D*.o}.i.v*.
(A.Vn.V$5...|.]P.......e
.......v...}z....zJ.Z..X	 \b	.W.../e..K....->S.-...r4.....I."...!.....;............3PON
20:27:33.997396 IP 155.138.140.26.vultr.com.ssh > 2.146.158.104.in-addr.arpa.53986: Flags [P.], seq 11080:11308, ack 1, win 501, options [nop,nop,TS val 1835689942 ecr 487869526], length 228
E.....@.@..\....h........}...Vt.....#P.....
mjg...LVR...0p...x.).D............@8M87.mB....ER+..\.....
...iE.d..6..Ii ..sL.|5...t....{....S....p.z.Q#-..o..i...<.u(.Q?...B...a.~...`oX|....<?....	S.....Z<[.,\8(...Xo...dy3...<;>.q...$..,M=...i.b...E....f$0e{...N..lmYM.jtj........j...
20:27:33.997620 IP 155.138.140.26.vultr.com.ssh > 2.146.158.104.in-addr.arpa.53986: Flags [P.], seq 11704:11932, ack 1, win 501, options [nop,nop,TS val 1835689943 ecr 487869526], length 228
E....6@.@..T....h........}.}.Vt.....#P.....
mjg...LV<......$.|........@'.a....m......^.Q.....vI......^T...c..m...C...M....-S.M..:9
.....35Ebs<....A.fO.......BG...;...c...UL...z.{._My..."..O..........5i.....7..I..0q.=...V.....r<.......K.c...\.c.-..T+.Qw..k..,.h4:y...3.2.wxr3
7..S.
20:27:33.997769 IP 155.138.140.26.vultr.com.ssh > 2.146.158.104.in-addr.arpa.53986: Flags [P.], seq 12208:12436, ack 1, win 501, options [nop,nop,TS val 1835689943 ecr 487869526], length 228
E....<@.@..N....h........}.u.Vt.....#P.....
mjg...LV..B...o.R.5K....y(?h.<.$.o[...N.....aW.o..3...CM...x......=+..".......R.\.|.a7.#.........4.\./>.T'C.K-f.]5..AP^.....f?..}>....F.p.\..nV.c.%.....o...l..5.z.c.-;.g.s.w.`n...p....."...~7.H1..S.....0\..x..y.>..f...s..........6k4.`.9
20:27:33.998039 IP 155.138.140.26.vultr.com.ssh > 2.146.158.104.in-addr.arpa.53986: Flags [P.], seq 13008:13236, ack 1, win 501, options [nop,nop,TS val 1835689943 ecr 487869526], length 228
E....H@.@..B....h........}...Vt.....#P.....
mjg...LV!s<c.Ma...?b....".......<.....8Y.`5g.NA.....o.8...Yh..Q	.yh.R.t2.....X.c	...=..[....q.$.a.T...O......*....9O...#6..X.@...0...(eHvY.......%$...Go$..
L....@!_%.7.A.mLz.T....tb\....Z.......{....K....{.......QQS........0......ql...d
20:27:33.998221 IP 155.138.140.26.vultr.com.ssh > 2.146.158.104.in-addr.arpa.53986: Flags [P.], seq 13584:13812, ack 1, win 501, options [nop,nop,TS val 1835689943 ecr 487869526], length 228
E....P@.@..:....h........}...Vt.....#P.....
mjg...LV..pr..'.E...]&qn...2..~._...ob...........f.......BEG........*.C..-...Y.U.]80K.......A_.....*.. ..1..l.<...@)..CY...M!!..kz.9NHF@...h.b2g....c..d$h~R+.5?..i...4%..r..&.`.v..].a;.J...).Q...
L.?.......'......!.-rv...v..~.%....D..3.
20:27:33.998369 IP 155.138.140.26.vultr.com.ssh > 2.146.158.104.in-addr.arpa.53986: Flags [P.], seq 14096:14324, ack 1, win 501, options [nop,nop,TS val 1835689943 ecr 487869526], length 228
E....V@.@..4....h........}...Vt.....#P.....
mjg...LV`.s....,...0G.n).zb.v...`...._.`...~....Yw.E\.d....o$....P.P..\.e.P.H:.B..y.S..8.m.xh.....5...T..Dj.L'B.[FF..f$	......L cuQM..P...G.u~J../......U....{.0@{...z%}U..8.....8N..J.C..R9...4J.s....8..........Ou....v...A2.,s3i...nj&o..
20:27:33.998528 IP 155.138.140.26.vultr.com.ssh > 2.146.158.104.in-addr.arpa.53986: Flags [P.], seq 14600:14828, ack 1, win 501, options [nop,nop,TS val 1835689944 ecr 487869526], length 228
E....\@.@.......h........}...Vt.....#P.....
mjg...LVK...n.D. ..T..l.n{..N...6........x.tx..e.A.;W...7.q1..2......d...k`$q..>....n.8|.P.....K.Wg..z.........K7..>@...yd.9............q..2.8S.jS|.(z..&..@.c`...TK0...k..pq.y*...$
;......Ma.Tj...8M._....q*."5..e..y[..A...C4.K.Q...2M...
20:27:33.998737 IP 155.138.140.26.vultr.com.ssh > 2.146.158.104.in-addr.arpa.53986: Flags [P.], seq 15104:15332, ack 1, win 501, options [nop,nop,TS val 1835689944 ecr 487869526], length 228
E....b@.@..(....h........}...Vt.....#P.....
mjg...LV.k)....a.iBI...j...%.Z...i..0...N5...1>.......&.>........t.#>......~.....N.. ...(.i.H.~..........v4.-..M5y9....P.+......J..S.r+`.U..r
`......d..T.6G..+q'..vd.
F.x....6...S'..{V..A..Y....'-N..|c.....eh. .(.abJ.....O....C.f.K.....
20:27:33.998876 IP 155.138.140.26.vultr.com.ssh > 2.146.158.104.in-addr.arpa.53986: Flags [P.], seq 15608:15836, ack 1, win 501, options [nop,nop,TS val 1835689944 ecr 487869526], length 228
E....h@.@.."....h........}...Vt.....#P.....
mjg...LV....3c.O.y^..Zts.G...jd~.P......#v.;3........7..E..C....r.q..{..'/.V......P......m.....*L......\^..
?..i.O......~.^P.4,.}...$..:.^f...)}m.:.d	L..(
......|.C..EW...=[m.w..Pa...}..N..]E.j....X>...5.x .(.........'..n=..Wd....Q}.{..
20:27:33.999068 IP 155.138.140.26.vultr.com.ssh > 2.146.158.104.in-addr.arpa.53986: Flags [P.], seq 16216:16444, ack 1, win 501, options [nop,nop,TS val 1835689944 ecr 487869526], length 228
E....p@.@.......h........}...Vt.....#P.....
mjg...LVe..~....Nf..h....X^.=.........~..?..b.6.6....\...cD...([.)...$..l..<."..\......H^...........\..q%.<....
c......p...bJ....'.<CU.0.C.<N"......$. ..r|r..1...|.g....I.......+.....,.=..m..)....\....`..|......*v.@Rk..........J.2-...A.
20:27:33.999216 IP 155.138.140.26.vultr.com.ssh > 2.146.158.104.in-addr.arpa.53986: Flags [P.], seq 16720:16948, ack 1, win 501, options [nop,nop,TS val 1835689944 ecr 487869526], length 228
E....v@.@.......h........}...Vt.....#P.....
mjg...LV..c...~...!..:'.m.. ....P.....r`.)..4uP...u..t..Ob..tp.j.$..8#.................n\x.&C4.v.....7...gG......W...dg....7.S.I..R.......[x...r.V..=..QO..i....|r...	..:..Kx>/.]y
......OS`.-...e.....9z.Rp.W).O..L.}....t..X.0C,1.RdY=....
20:27:33.999494 IP 155.138.140.26.vultr.com.ssh > 2.146.158.104.in-addr.arpa.53986: Flags [P.], seq 17624:17852, ack 1, win 501, options [nop,nop,TS val 1835689945 ecr 487869526], length 228
E.....@.@.......h........}...Vt.....#P.....
mjg...LV....f?R....S.O...=FV).x.K0.C1.92<=.........Z....	....~..xeF....n.M.N..+.UL7w....,......1	..x..7......$0..Hzt..E.k.=~..	...s...#..d....'.......I#.f..%......e...ZN..d.v......;.....y.*.I....C^...;Yn..Q.."...o."Z....H.yJ..........k.
20:27:33.999619 IP 155.138.140.26.vultr.com.ssh > 2.146.158.104.in-addr.arpa.53986: Flags [P.], seq 18092:18320, ack 1, win 501, options [nop,nop,TS val 1835689945 ecr 487869526], length 228
E.....@.@.......h........}.q.Vt.....#P.....
mjg...LV.%.{..^...~q.+.V.9T/.@-..i|....>/.,.....i&7n^.U@..ar.p4	..J.`..j...+..K..>L...&...3...Z.Z...V.E].......b...aA8.=C....[....'^...@.4w.:(.;.G....lbShzB...k..h.Ub..$.6.e3.R.gz....."...........@..zOFIt+9...2.].
..%	_........if.nk....
20:27:33.999701 IP 155.138.140.26.vultr.com.ssh > 2.146.158.104.in-addr.arpa.53986: Flags [P.], seq 18476:18808, ack 1, win 501, options [nop,nop,TS val 1835689945 ecr 487869526], length 332
E.....@.@.......h........}...Vt.....#......
mjg...LVK;.n!.:....r5.2..'Kr.F.."o.@.......... ..5..;F..5.3..F......&uE....1/.w.y....N.:....<Y..j+.|{........Xz0..Vi%.......L.......... 0....17.5....2.....R.K.,y.Wm.!...J.a..-...I.C....S.".'.gC.oc..^z......L5... ..z.........=..b.~.[........}6......h,.r..H.%.....e......Q..w....$m.....R.d....+.....[;DU...f.....(E..L...#0..E\:&M..T..5Dc.$7.>
20:27:33.999750 IP 155.138.140.26.vultr.com.ssh > 2.146.158.104.in-addr.arpa.53986: Flags [P.], seq 18808:19372, ack 1, win 501, options [nop,nop,TS val 1835689945 ecr 487869526], length 564
E..h..@.@.......h........}.=.Vt.....$......
mjg...LV..M.........:.$..Z..Sx..E..n...M...?.....*...w\}.......?....7..qh.o....S...0^?...g...]......3....8.I..5<6...}.E4.ilw.FTx./....5..%.U.....C"X.(]i*B..]..1....%....S._..m..0...d+.X.Y....,...;.......X.a...2.K....)....<yg#M5n...O]. .
...>.R...../!\..#6[.E..YX..
.T.1.7..)hfT.0q.Nas...0	..D.F.).u AK.........'m... R..y.3....t.....D<1=2<5.....N.{
.g'..N.-......,pR.&.>......a.3...{.:...mJ.Jm.3[1.lr!...>1./.pw...R.{......#..y.;....-xK.....b.g....k....F..&.v..M.............E....=/%N.].Q..W.<!!P	.......C..3....pK...z/...-...=.U.s...{...M.X.cb.....[.$.w...<..8Ni..,...#".8
20:27:33.999817 IP 155.138.140.26.vultr.com.ssh > 2.146.158.104.in-addr.arpa.53986: Flags [P.], seq 19372:19688, ack 1, win 501, options [nop,nop,TS val 1835689945 ecr 487869526], length 316
E..p..@.@.......h........}.q.Vt.....#......
mjg...LV..n.p._<....l. ?$....c...v./#.W^?.E..QN......9j..]_.on..N.	..m.......STT.-..q..0...Q.q ....E@..D.
.<..#.D>p..:.
........X...(c...X....2f.Y<.S...h.......:.........f..qp...9......a
FV......,jWEQ.d.l/w.... .@.....,......ZV.]..r.h0.......;.Kfb...X68#.\..\....5E.Cj...I.2..j....g$.O=
Dg.1.{...rZ-....>Ut......._.....@....
20:27:33.999894 IP 155.138.140.26.vultr.com.ssh > 2.146.158.104.in-addr.arpa.53986: Flags [P.], seq 19688:20004, ack 1, win 501, options [nop,nop,TS val 1835689945 ecr 487869526], length 316
E..p..@.@.......h........}...Vt.....#......
mjg...LV....A.u]DUC......f...'. $..Dj.WQ`.._R.n.gW..]...P.{..Yw.	..5.<Z......S~.)w.Q...\.....:...l....7Sr>......f.KL..5r8..e..sY.....M..;..g.0'.....y.e......-@.q....7Q.} .tn....{]Cw.....=..K.f..8.B...2..K[7+....b.....S?.L.....7#.....8/l...........x.s......ZS^s)...c.D.MM.....F./..T....vUNo.2.. ./.........0,.`..:..,..I.-.f..
20:27:33.999954 IP 155.138.140.26.vultr.com.ssh > 2.146.158.104.in-addr.arpa.53986: Flags [P.], seq 20004:20512, ack 1, win 501, options [nop,nop,TS val 1835689945 ecr 487869526], length 508
E..0..@.@.......h........}...Vt.....$h.....
mjg...LV8.....Tf.A....i..J..+.j-^...@|2.H...W....ZV.....qR..........m...t...d.....,..`...Q?..V....O...!0./	..D.M....l5.=.b...7K...@.AP2.|..q..,.v.mu.[.vGKzLZN....WSk.+...Vg$....vJO.O..).d.J].L..Rk......P.=.n(Ke...|....EC.[..Ug1...v...I..>....J....s..sq...$/..:]..j(..H............D\..V<....T0_....(.N. ............W..YF.......-.a7...[=........._.K.H#..	...^.....'..U...2.!.\.........n..P.d.....,..`G..K<6.._...(2u).4,.+P.j..^.]....z=&.....h..g...u..RM..1#.B..Y...{...?.k..........hEY...|.f.	z.m..p..i...a.....|.D...a
20:27:34.000003 IP 155.138.140.26.vultr.com.ssh > 2.146.158.104.in-addr.arpa.53986: Flags [P.], seq 20512:21012, ack 1, win 501, options [nop,nop,TS val 1835689945 ecr 487869526], length 500
E..(..@.@.......h........}...Vt.....$`.....
mjg...LV`s.(JB..UZ.....V.Z... . ..M.&......MrK.........Z.........R...Z..).7......`$ek
.).o.Gd.....=!........SlE(	.#.5.....od.	...J.....A.s............^g....q.c.s..4_".[.{..`j...........au..c&...Z..X..I.a..5},f.FC...E~....I#&.2.B
Uzq..\....|JK.h.$x...d&...S.Y.o.W./....a...sT...b.9vY..YD...4....2.O6.&...+.}x.....9.....})....Z.C....../^.Z....#.;.i...368.r.AqX.J]o..>.H!. ./c~..........|q..s..B...~u..f......Ly!^dY.!m.s.|.....A..I.4%...DZ<...TU5...Kr...4.5.4.?....6.	..U.S..}5r....6(......*..@.F....:..J.7N...#
20:27:34.000044 IP 155.138.140.26.vultr.com.ssh > 2.146.158.104.in-addr.arpa.53986: Flags [P.], seq 21012:21232, ack 1, win 501, options [nop,nop,TS val 1835689945 ecr 487869526], length 220
E.....@.@.......h........}...Vt.....#H.....
mjg...LV.o....L&.....%...........y@..XY..T`.w..`.C.c......:.Ck...%3.ng.6`...;kib.ts~e...1.........k..Oh..wVR...]..f:..e......y....'....{.me.........J......)/..h".X..........kD.q.\.K.#.a.C.f...].'....?...Y....T&)"...m...4..[..E..
20:27:34.000106 IP 155.138.140.26.vultr.com.ssh > 2.146.158.104.in-addr.arpa.53986: Flags [P.], seq 21232:21828, ack 1, win 501, options [nop,nop,TS val 1835689945 ecr 487869526], length 596
E.....@.@.......h........}...Vt.....$......
mjg...LVH.....[8........M..?..%....!.|.u<.....&=...A.c..G..F!...c........X.$rz....t.K.....f..zH...0..	.8.._.L...8.D.f.R....1..
......V.R.@T..t.5...	c-......M..,.<....H>....,SG.d%h.u>........H<..uf.`6H...$OU...F.
3;.......?.E..%.nl.hw...BF..QN.j...."...@..m.8P..d...J....g..d.zb%.....,.MN..0.r...........D.,Mx........k...p#.q..8-. F..q...."..-..2R45^..T
4..u.%-:.....e...d..%................j.lS....._......V~.S.mA.@_....=.s.=.G..x6....>.....M~.!.......-...y.E...8q|B]pf.......Ju..{...c.G<.......cu..	.l...."\N...>	.. b..34\....x.N.b..v.l...8V.I.D%.....A.o.<<.....(xh+...)..eK..$...u.....KXZ{..#...2.Lc...
20:27:34.000167 IP 155.138.140.26.vultr.com.ssh > 2.146.158.104.in-addr.arpa.53986: Flags [P.], seq 21828:22104, ack 1, win 501, options [nop,nop,TS val 1835689945 ecr 487869526], length 276
E..H..@.@.......h........}.	.Vt.....#......
mjg...LV......l..........-...0....4.P0..l....RQ...K....H......
..................uN0...)..c...5.p.'...........JvH....B/i.p..f8{....[-.....C..7...".Y<.)./J.|-7.(..4...
U..R..6.3....+..Y..	`.......w4.......hj;~....B..=.LG...+..=.8.[.0..(=W.....8.....O.v....t.......L.6.l-...LBD..Q.e|...
20:27:34.000236 IP 155.138.140.26.vultr.com.ssh > 2.146.158.104.in-addr.arpa.53986: Flags [P.], seq 22104:22564, ack 1, win 501, options [nop,nop,TS val 1835689945 ecr 487869526], length 460
E.....@.@.......h........}...Vt.....$8.....
mjg...LV......I.m.E4..."J.....7.17k.{.;...oh.j`.......Ekj.....if.v>s......#...D.....#...{...n..........]&.......R7B).;..]Y3.G.V.........q....v.:A..=..d..@........X"..{.pU.PP.D_..U./...0..No...k..$....9..
..}ny..2Hn%.6$..j....k..o..........c..V...XGgK.....N..../..Ni.P..=....~.Ot.!u..o...$z..2....E......._..V
.{4.'.-..D:.....6R.....:o&.J...9...l...y.'....&%.$`c.y.	.b..[.1.t}j.'<..C.{cu...{.fu....y.B-.........G."D.OY...2.......gJ\.......-|. .Tm.....v.P%..1..b......~.
20:27:34.000367 IP 155.138.140.26.vultr.com.ssh > 2.146.158.104.in-addr.arpa.53986: Flags [P.], seq 22744:23148, ack 1, win 501, options [nop,nop,TS val 1835689945 ecr 487869526], length 404
E.....@.@..F....h........}...Vt.....$......
mjg...LV.T....... ..*.|...A...v.+..e.T..9"\.OR....x..o!.!..'.....{i..P&..Bg..i-.J.|......3X..L...D...&7.=?.Q.;...Z+....7.A.{..riy..E.d../I..0..~._.X.....VH.\5..6e....V...?@M....+C...cw.37.....E. 5..l...{..i....v.?Jg&aL...mRX...jK..S.'.].7.....z\..I`......h.:J.BHU."w_%.o#...0...u8.7h.j....Ji....R+....m.I}...t\....",r*A.[.m..;r.+.(r..*m..;j.......F...m....~.....a..L!-#8..
.i.n`(......U47..g.F.J.-.N.$wV........9
20:27:34.000437 IP 155.138.140.26.vultr.com.ssh > 2.146.158.104.in-addr.arpa.53986: Flags [P.], seq 23148:23656, ack 1, win 501, options [nop,nop,TS val 1835689945 ecr 487869526], length 508
E..0..@.@.......h........}.1.Vt.....$h.....
mjg...LV.n.6...2..;=qj;...................72=gM.V?.....z........?.=.t|.I.....]%.....$t.....%.SZT.h%....c..mp.....#..|
X
..(..[.....!J.....<b...._...X.O*.s~`.....n...Z..L.....].....I.pH.>....c.$.g.st#.(y..A......k.........V.e.P.z_.PlT.>.l.j....ea...{9.-A....\.|..?.X.,..q7.7.........W..w,...:.7..:^..89J.._...*......x....wY.m.Y_>#.e..r.....|/..y......$*y...kV......!%q.....^.q.^...5?..Pq..d/....s..o.~...J.5>.,....uEA@.Lx..M..P......'&E..bq..@..tZ-..2-..S..z..E.....)i".	.ZU2E~c.Sq.4......C`.~.	]......{`.;G.Yo...I7l/
20:27:34.000558 IP 155.138.140.26.vultr.com.ssh > 2.146.158.104.in-addr.arpa.53986: Flags [P.], seq 23932:24232, ack 1, win 501, options [nop,nop,TS val 1835689946 ecr 487869526], length 300
E..`..@.@.......h........}.A.Vt.....#......
mjg...LV.?D.~.6wa..4.:.)yJ...wF.0k.{...U..j.O-.J*^..S...%....k[#s.lYT.w.k..I..2...w....n.mg....	..Z_..#..0H..X.......7 .H..g...=..K...........'d.I~r.;.sl.("....aR.W4.........*#1.....T...6jS..p......e...({.N...............$'..$N..(..v7:s....8....!.D.c.u..Q^.c.s..P.6L....u..3.....8.%.....nID..#.j.9.........OT
20:27:34.000645 IP 155.138.140.26.vultr.com.ssh > 2.146.158.104.in-addr.arpa.53986: Flags [P.], seq 24232:24940, ack 1, win 501, options [nop,nop,TS val 1835689946 ecr 487869526], length 708
E.....@.@.......h........}.m.Vt.....%0.....
mjg...LV..n..V3.Z...L$#.n.%2.6.X..n ....zyb. 5HmZ..R..yp.=....gh.$.'..b.E+@......=..r....x..'{..u.3.N[.v.3..3.]/c.r.....7...6..7.5.|.X|\.O......<.Y.....C."^.r..Hc....	..."ef.|.q2.....W..1.`E}.....s..%...+5>.@.;T.?.........R.H.A.`...H......5.+o.s.C.0.].8.Sd..........H...L{.....k[5.3.&..*J.bb...g.Wg..R....lN>	..'.H)m.<....m.!.,R~...)S...Q.......
.|E.......W#.Ivr..'.W...0.t..2...6M54..........3......D......H8.4....._.R.N.../..q	.v.].6Y.>.pW+..z.....sK.q../..]..6L.K....|q4..vE..?..w.{......;.s6..|..E...3..C...P...\..#...y>.r.q.....1...a..e.[T. ..Sq,.$y$...[..o8Z-......j8...'....2Y....imU...7....5!....O_.	.w#...,....mb........C69...lp..;....w."...hK.pF.i.6!\..f.b..v*.z...p|..B..s...1.^b	...1.u.g1.>a.....@.[6...9
20:27:34.000713 IP 155.138.140.26.vultr.com.ssh > 2.146.158.104.in-addr.arpa.53986: Flags [P.], seq 24940:25224, ack 1, win 501, options [nop,nop,TS val 1835689946 ecr 487869526], length 284
E..P..@.@.......h........}.1.Vt.....#......
mjg...LV......\....M.... .o..M.F.2..)1<..%..W.=.....5..U..(Rn.V.<.!}g..u.Qy-\..;....6F-`.L..Z..mc.U2e...`..'....C.^...v.Ht..H1.......G...hex.q...>...D T~.....9..*..(...|5"....Q1cc......o..2
)...'..n.j...-..V..5(H.v.z.) g.7....#`Z.8~61...bB....L.?.OzE.Ek...M.8.F.../.o.....
.].x..y@..dZ.....>.
20:27:34.000775 IP 155.138.140.26.vultr.com.ssh > 2.146.158.104.in-addr.arpa.53986: Flags [P.], seq 25224:25692, ack 1, win 501, options [nop,nop,TS val 1835689946 ecr 487869526], length 468
E.....@.@.......h........}.M.Vt.....$@.....
mjg...LV..P.*Bn;..P.."..%ZCJ..l""/....6.m...#t...m..N5.[.:@v!.........:x..5..'...}z"..J..Dr.F
...)~.nA..D...P\..]C.wMa...,k.]o...z.....,2'.C...D.,n...l....u...z..MVs.....l.....p...._O....I".%%e...\........5....~.(....U...T...E..w.. ...
...0.	./[....2..._.R.LX....}..)...{8.+.%.,t..)ew...,...;... Fv.T..N......=...i..f..`.X.$>..eq5...M...S........r.......<......V~.*...G.Q.F.(4..Y.wv.~o."=...V.2`.9,@..:....4&....>`u...9TO(mB..h...Q...`.......3.....E..._T
.X.._y_8.z.(...JVx.k.
20:27:34.000829 IP 155.138.140.26.vultr.com.ssh > 2.146.158.104.in-addr.arpa.53986: Flags [P.], seq 25692:26200, ack 1, win 501, options [nop,nop,TS val 1835689946 ecr 487869526], length 508
E..0..@.@.......h........}.!.Vt.....$h.....
mjg...LV..VT..bnM..K.:.W.Bh..%.3...."p........1@.y....e>f..~.5...$........j...	>oi.K_..v.@..n
...2.V0....O..`a9k.,".1......R+....&x..|.........+...N`.G........6.<*.oO#..4M..[.;.h_G....	-.1...|....y.O..G.,..	.$.i*.W..eUE..'.U..~N...:.....[G'^;...O......8........N.\?...|<.<.o.yg..:.e..B....o.,.._S.A....FD....B\.....yz..J..o..`@..u..P.1....2=.g.p...A.!....].J....Z..*...O.o...]......ABy.O.q.4d.0.X.........(....;.e.Fj......$..n....Q..n..Cy.
.....B.Fv..T...B..y%...A..>*..P(....	Pi..c...xYy....9FVQ.&.#...H...p)x@v..J.
20:27:34.000921 IP 155.138.140.26.vultr.com.ssh > 2.146.158.104.in-addr.arpa.53986: Flags [P.], seq 26524:26976, ack 1, win 501, options [nop,nop,TS val 1835689946 ecr 487869526], length 452
E.....@.@.......h........}.a.Vt.....$0.....
mjg...LV<..g...._...]..|......V......s(.....X.U.Z...9...~.Y........k......3........F...N#......3..g..........|.
.8...2..e..X.....*`j...!m	5......=..o...x>.h+...h..[..@P..F...........|.C..8.....;.._Kzu...'!...a.pu.....2...".W...:.oo.k>.^.M=k].. .}Dr.7..+z..,;.Si4,....%....%+.F..Z.B].:n.?.T.O;..g~h.t......R..#Y`..jg8...).'.xC.gOu.-..yj...lo.m...l...c.#...I.w.GIk.G./.15..._)}N....K.e.....,oE..Xt..`l._6...p.q=6Y.......V.>..DI..B"....@._..{M..?"..;a.>D.h..&%..\
20:27:34.000960 IP 155.138.140.26.vultr.com.ssh > 2.146.158.104.in-addr.arpa.53986: Flags [P.], seq 26976:27268, ack 1, win 501, options [nop,nop,TS val 1835689946 ecr 487869526], length 292
E..X..@.@.......h........}.%.Vt.....#......
mjg...LV5.L[$,...01ej.......A4;6w..PU......)u3..O$58.	.....d.J1.H..5. .#...*..G....,........-.`..F.c...Q...$:..%.r..b.0.s...DV~k..-...pr0.5%....a.Ma..>F|}...&(.......uw...Zy.....<.u.C.1..9T.H...;.4&.qj.B^`.e.?t.YU..l...!..T..	..B....=..W(......+...........b2..]z..t.......X.#SP_.p.w...*4Hs...xv....".
20:27:34.001176 IP 155.138.140.26.vultr.com.ssh > 2.146.158.104.in-addr.arpa.53986: Flags [P.], seq 27504:27868, ack 1, win 501, options [nop,nop,TS val 1835689946 ecr 487869526], length 364
E.....@.@..b....h........}.5.Vt.....#......
mjg...LV.`f..."..-q....:.....g...&....'.Z......x<....xV..9....<|.TQ.v..EMl\.,...J.
F.y...~.......I.[^..:>.~XM....A..GNev.... ...x......NoV(.....g.........}.i...I.u3...!...."U1hC...P....O.f..v-
w..R5.<`.....|...Y. $A........'.*.A...uk.?....k...i^.<.qX. ...UUr.R.y..@....v.hd...w....^*...i'...r..&....u8D..:.w'..?...@.sl.q....B..3.d7.....ns../..r.M..G...".=.Z6......Rrh...B.
20:27:34.001277 IP 155.138.140.26.vultr.com.ssh > 2.146.158.104.in-addr.arpa.53986: Flags [P.], seq 28136:28420, ack 1, win 501, options [nop,nop,TS val 1835689946 ecr 487869526], length 284
E..P..@.@.......h........}...Vt.....#......
mjg...LV....>.T...wC.."$.r....7{q...(yq....~..a.'*S......U...d..DLH...9]..o.-P.
....lD........	%.d.r.}.c...X..4...^..e...G.s0PW.#.-...l$H...S...B#.....gbE..1..a;....u......ke..O.... }.....z.b..	2......../fc.......N....j.i.P...].......a..=...p...^..e.....=X.1..cy...6Y..Asy...#......S..+v..h..
20:27:34.001336 IP 155.138.140.26.vultr.com.ssh > 2.146.158.104.in-addr.arpa.53986: Flags [P.], seq 28420:28888, ack 1, win 501, options [nop,nop,TS val 1835689946 ecr 487869526], length 468
E.....@.@.......h........}...Vt.....$@.....
mjg...LV.	.....W...UlP.5y....T..a......_$...8~i....P......f....<@......A.%Sh......)...o.<.C..MF...
..D..m|......_d...e6..c......f:....Q....?.46...'I?L7.....H..-.Y..FMi..............2uW..J..~.i.-.7\..I....cA...2-....
K.P....Mc..t...jB'FY>C.gI..K.Q.....j.L...A.I....0..&.W.p...o70a$...9y.aXO!.o...ux.c.....
.............W ..{A ...r6......G..l...A.F...FZ:.6...k.)!.Y..Em.68c...|...6..P..L..TK.a-..H.l.....3.Y.3L..?...\.j..`.6:\..Y.^S..C.....0.....|G..9o.I!.......(.d.+.>.w0..q.E#
20:27:34.001405 IP 155.138.140.26.vultr.com.ssh > 2.146.158.104.in-addr.arpa.53986: Flags [P.], seq 28888:29404, ack 1, win 501, options [nop,nop,TS val 1835689946 ecr 487869526], length 516
E..8..@.@.......h........}...Vt.....$p.....
mjg...LV....U	....Om?..m.Ll....56..8Y.@At....i.......A....!...6.]gG....zrE..2..NR..y.) ..V6...07.RQ}...v.z"e........=.=....<.b+(..T...E..........$......7.?.....R.l6G...P...8...5d.SDl...b...].(...W9>....a+._Xe...I0.....Wn..;m?...q..........$L.....\.
..n..N.H..`.m..4..ZA......]?S.&.Z..
..Y.n...G.-...k.4....R!..'aul.......g.1L+.....z..xw...9...d...T69...J..G.c.F.=....I`..5..Xid.........z{....:...
.0... @OGD..m..4`H.k.r.....6.bq....._..x..?_O..."+<...........pv..z.9...}..-....,"3^...P4t...5.
..Gi.l...i.._..B..!.C......|...
20:27:34.001518 IP 155.138.140.26.vultr.com.ssh > 2.146.158.104.in-addr.arpa.53986: Flags [P.], seq 29680:29996, ack 1, win 501, options [nop,nop,TS val 1835689947 ecr 487869526], length 316
E..p..@.@.......h........}...Vt.....#......
mjg...LV-%..K.......;^.2......... ..2.k...4.....=...-.B.......)..y.....m$.........WC..m..*..5...d..;.......*$..<.M..	..bq.j...z.b...G..#!.PB%p%..?..h....;RH...$..v.[..*!...rV.8.q...w|.wf..n..:.G*..e....
..*.=/mu.V..!H....L.....	.2.........&.K.$...v..4:..!4..VEFj|_....W..;.[.R..........bm..!h...8<.&=@....YY.".
.3..c...v....
