root@comp3134:~# tcpdump -n -i enp1s0
tcpdump: verbose output suppressed, use -v or -vv for full protocol decode
listening on enp1s0, link-type EN10MB (Ethernet), capture size 262144 bytes
20:31:00.362805 IP 155.138.140.26.22 > 104.158.146.2.53986: Flags [P.], seq 3803732309:3803732417, ack 3713441932, win 501, options [nop,nop,TS val 1835896308 ecr 488075894], length 108
20:31:00.362850 IP 155.138.140.26.22 > 104.158.146.2.53986: Flags [P.], seq 108:144, ack 1, win 501, options [nop,nop,TS val 1835896308 ecr 488075894], length 36
20:31:00.362887 IP 155.138.140.26.22 > 104.158.146.2.53986: Flags [P.], seq 144:260, ack 1, win 501, options [nop,nop,TS val 1835896308 ecr 488075894], length 116
20:31:00.362915 IP 155.138.140.26.22 > 104.158.146.2.53986: Flags [P.], seq 260:296, ack 1, win 501, options [nop,nop,TS val 1835896308 ecr 488075894], length 36
20:31:00.362999 IP 155.138.140.26.22 > 104.158.146.2.53986: Flags [P.], seq 296:516, ack 1, win 501, options [nop,nop,TS val 1835896308 ecr 488075894], length 220
20:31:00.363025 IP 155.138.140.26.22 > 104.158.146.2.53986: Flags [P.], seq 516:552, ack 1, win 501, options [nop,nop,TS val 1835896308 ecr 488075894], length 36
20:31:00.363064 IP 155.138.140.26.22 > 104.158.146.2.53986: Flags [P.], seq 552:748, ack 1, win 501, options [nop,nop,TS val 1835896308 ecr 488075894], length 196
20:31:00.363098 IP 155.138.140.26.22 > 104.158.146.2.53986: Flags [P.], seq 748:784, ack 1, win 501, options [nop,nop,TS val 1835896308 ecr 488075894], length 36
20:31:00.363130 IP 155.138.140.26.22 > 104.158.146.2.53986: Flags [P.], seq 784:980, ack 1, win 501, options [nop,nop,TS val 1835896308 ecr 488075894], length 196
20:31:00.363160 IP 155.138.140.26.22 > 104.158.146.2.53986: Flags [P.], seq 980:1016, ack 1, win 501, options [nop,nop,TS val 1835896308 ecr 488075894], length 36
20:31:00.363189 IP 155.138.140.26.22 > 104.158.146.2.53986: Flags [P.], seq 1016:1212, ack 1, win 501, options [nop,nop,TS val 1835896308 ecr 488075894], length 196
20:31:00.363224 IP 155.138.140.26.22 > 104.158.146.2.53986: Flags [P.], seq 1212:1444, ack 1, win 501, options [nop,nop,TS val 1835896308 ecr 488075894], length 232
20:31:00.363242 IP 155.138.140.26.22 > 104.158.146.2.53986: Flags [P.], seq 1444:1480, ack 1, win 501, options [nop,nop,TS val 1835896308 ecr 488075894], length 36
20:31:00.363276 IP 155.138.140.26.22 > 104.158.146.2.53986: Flags [P.], seq 1480:1676, ack 1, win 501, options [nop,nop,TS val 1835896308 ecr 488075894], length 196
20:31:00.363301 IP 155.138.140.26.22 > 104.158.146.2.53986: Flags [P.], seq 1676:1712, ack 1, win 501, options [nop,nop,TS val 1835896308 ecr 488075894], length 36
20:31:00.363329 IP 155.138.140.26.22 > 104.158.146.2.53986: Flags [P.], seq 1712:1908, ack 1, win 501, options [nop,nop,TS val 1835896308 ecr 488075894], length 196
20:31:00.363352 IP 155.138.140.26.22 > 104.158.146.2.53986: Flags [P.], seq 1908:1944, ack 1, win 501, options [nop,nop,TS val 1835896308 ecr 488075894], length 36
20:31:00.363384 IP 155.138.140.26.22 > 104.158.146.2.53986: Flags [P.], seq 1944:2140, ack 1, win 501, options [nop,nop,TS val 1835896308 ecr 488075894], length 196
20:31:00.363415 IP 155.138.140.26.22 > 104.158.146.2.53986: Flags [P.], seq 2140:2176, ack 1, win 501, options [nop,nop,TS val 1835896308 ecr 488075894], length 36
20:31:00.363462 IP 155.138.140.26.22 > 104.158.146.2.53986: Flags [P.], seq 2176:2372, ack 1, win 501, options [nop,nop,TS val 1835896308 ecr 488075894], length 196
20:31:00.363495 IP 155.138.140.26.22 > 104.158.146.2.53986: Flags [P.], seq 2372:2408, ack 1, win 501, options [nop,nop,TS val 1835896309 ecr 488075894], length 36
20:31:00.363539 IP 155.138.140.26.22 > 104.158.146.2.53986: Flags [P.], seq 2408:2604, ack 1, win 501, options [nop,nop,TS val 1835896309 ecr 488075894], length 196
20:31:00.363563 IP 155.138.140.26.22 > 104.158.146.2.53986: Flags [P.], seq 2604:2640, ack 1, win 501, options [nop,nop,TS val 1835896309 ecr 488075894], length 36
20:31:00.363603 IP 155.138.140.26.22 > 104.158.146.2.53986: Flags [P.], seq 2640:2844, ack 1, win 501, options [nop,nop,TS val 1835896309 ecr 488075894], length 204
20:31:00.363631 IP 155.138.140.26.22 > 104.158.146.2.53986: Flags [P.], seq 2844:2880, ack 1, win 501, options [nop,nop,TS val 1835896309 ecr 488075894], length 36
20:31:00.363660 IP 155.138.140.26.22 > 104.158.146.2.53986: Flags [P.], seq 2880:3084, ack 1, win 501, options [nop,nop,TS val 1835896309 ecr 488075894], length 204
20:31:00.363682 IP 155.138.140.26.22 > 104.158.146.2.53986: Flags [P.], seq 3084:3120, ack 1, win 501, options [nop,nop,TS val 1835896309 ecr 488075894], length 36
20:31:00.363713 IP 155.138.140.26.22 > 104.158.146.2.53986: Flags [P.], seq 3120:3324, ack 1, win 501, options [nop,nop,TS val 1835896309 ecr 488075894], length 204
20:31:00.363741 IP 155.138.140.26.22 > 104.158.146.2.53986: Flags [P.], seq 3324:3360, ack 1, win 501, options [nop,nop,TS val 1835896309 ecr 488075894], length 36
20:31:00.363777 IP 155.138.140.26.22 > 104.158.146.2.53986: Flags [P.], seq 3360:3564, ack 1, win 501, options [nop,nop,TS val 1835896309 ecr 488075894], length 204
20:31:00.363802 IP 155.138.140.26.22 > 104.158.146.2.53986: Flags [P.], seq 3564:3600, ack 1, win 501, options [nop,nop,TS val 1835896309 ecr 488075894], length 36
20:31:00.363833 IP 155.138.140.26.22 > 104.158.146.2.53986: Flags [P.], seq 3600:3804, ack 1, win 501, options [nop,nop,TS val 1835896309 ecr 488075894], length 204
20:31:00.363854 IP 155.138.140.26.22 > 104.158.146.2.53986: Flags [P.], seq 3804:3840, ack 1, win 501, options [nop,nop,TS val 1835896309 ecr 488075894], length 36
20:31:00.363880 IP 155.138.140.26.22 > 104.158.146.2.53986: Flags [P.], seq 3840:4044, ack 1, win 501, options [nop,nop,TS val 1835896309 ecr 488075894], length 204
20:31:00.363900 IP 155.138.140.26.22 > 104.158.146.2.53986: Flags [P.], seq 4044:4080, ack 1, win 501, options [nop,nop,TS val 1835896309 ecr 488075894], length 36
20:31:00.363931 IP 155.138.140.26.22 > 104.158.146.2.53986: Flags [P.], seq 4080:4284, ack 1, win 501, options [nop,nop,TS val 1835896309 ecr 488075894], length 204
20:31:00.363951 IP 155.138.140.26.22 > 104.158.146.2.53986: Flags [P.], seq 4284:4320, ack 1, win 501, options [nop,nop,TS val 1835896309 ecr 488075894], length 36
20:31:00.363980 IP 155.138.140.26.22 > 104.158.146.2.53986: Flags [P.], seq 4320:4524, ack 1, win 501, options [nop,nop,TS val 1835896309 ecr 488075894], length 204
20:31:00.364004 IP 155.138.140.26.22 > 104.158.146.2.53986: Flags [P.], seq 4524:4560, ack 1, win 501, options [nop,nop,TS val 1835896309 ecr 488075894], length 36
20:31:00.364032 IP 155.138.140.26.22 > 104.158.146.2.53986: Flags [P.], seq 4560:4764, ack 1, win 501, options [nop,nop,TS val 1835896309 ecr 488075894], length 204
20:31:00.364054 IP 155.138.140.26.22 > 104.158.146.2.53986: Flags [P.], seq 4764:4800, ack 1, win 501, options [nop,nop,TS val 1835896309 ecr 488075894], length 36
20:31:00.364086 IP 155.138.140.26.22 > 104.158.146.2.53986: Flags [P.], seq 4800:5004, ack 1, win 501, options [nop,nop,TS val 1835896309 ecr 488075894], length 204
20:31:00.364105 IP 155.138.140.26.22 > 104.158.146.2.53986: Flags [P.], seq 5004:5040, ack 1, win 501, options [nop,nop,TS val 1835896309 ecr 488075894], length 36
20:31:00.364134 IP 155.138.140.26.22 > 104.158.146.2.53986: Flags [P.], seq 5040:5244, ack 1, win 501, options [nop,nop,TS val 1835896309 ecr 488075894], length 204
20:31:00.364160 IP 155.138.140.26.22 > 104.158.146.2.53986: Flags [P.], seq 5244:5280, ack 1, win 501, options [nop,nop,TS val 1835896309 ecr 488075894], length 36
20:31:00.364195 IP 155.138.140.26.22 > 104.158.146.2.53986: Flags [P.], seq 5280:5484, ack 1, win 501, options [nop,nop,TS val 1835896309 ecr 488075894], length 204
20:31:00.364223 IP 155.138.140.26.22 > 104.158.146.2.53986: Flags [P.], seq 5484:5520, ack 1, win 501, options [nop,nop,TS val 1835896309 ecr 488075894], length 36
20:31:00.364269 IP 155.138.140.26.22 > 104.158.146.2.53986: Flags [P.], seq 5520:5724, ack 1, win 501, options [nop,nop,TS val 1835896309 ecr 488075894], length 204
20:31:00.364297 IP 155.138.140.26.22 > 104.158.146.2.53986: Flags [P.], seq 5724:5760, ack 1, win 501, options [nop,nop,TS val 1835896309 ecr 488075894], length 36
20:31:00.364330 IP 155.138.140.26.22 > 104.158.146.2.53986: Flags [P.], seq 5760:5964, ack 1, win 501, options [nop,nop,TS val 1835896309 ecr 488075894], length 204
20:31:00.364361 IP 155.138.140.26.22 > 104.158.146.2.53986: Flags [P.], seq 5964:6000, ack 1, win 501, options [nop,nop,TS val 1835896309 ecr 488075894], length 36
20:31:00.364398 IP 155.138.140.26.22 > 104.158.146.2.53986: Flags [P.], seq 6000:6204, ack 1, win 501, options [nop,nop,TS val 1835896309 ecr 488075894], length 204
20:31:00.364425 IP 155.138.140.26.22 > 104.158.146.2.53986: Flags [P.], seq 6204:6240, ack 1, win 501, options [nop,nop,TS val 1835896309 ecr 488075894], length 36
20:31:00.364468 IP 155.138.140.26.22 > 104.158.146.2.53986: Flags [P.], seq 6240:6444, ack 1, win 501, options [nop,nop,TS val 1835896309 ecr 488075894], length 204
20:31:00.364495 IP 155.138.140.26.22 > 104.158.146.2.53986: Flags [P.], seq 6444:6480, ack 1, win 501, options [nop,nop,TS val 1835896310 ecr 488075894], length 36
20:31:00.364529 IP 155.138.140.26.22 > 104.158.146.2.53986: Flags [P.], seq 6480:6684, ack 1, win 501, options [nop,nop,TS val 1835896310 ecr 488075894], length 204
20:31:00.364561 IP 155.138.140.26.22 > 104.158.146.2.53986: Flags [P.], seq 6684:6720, ack 1, win 501, options [nop,nop,TS val 1835896310 ecr 488075894], length 36
20:31:00.364600 IP 155.138.140.26.22 > 104.158.146.2.53986: Flags [P.], seq 6720:6924, ack 1, win 501, options [nop,nop,TS val 1835896310 ecr 488075894], length 204
20:31:00.364631 IP 155.138.140.26.22 > 104.158.146.2.53986: Flags [P.], seq 6924:6960, ack 1, win 501, options [nop,nop,TS val 1835896310 ecr 488075894], length 36
20:31:00.364669 IP 155.138.140.26.22 > 104.158.146.2.53986: Flags [P.], seq 6960:7164, ack 1, win 501, options [nop,nop,TS val 1835896310 ecr 488075894], length 204
20:31:00.364733 IP 155.138.140.26.22 > 104.158.146.2.53986: Flags [P.], seq 7200:7404, ack 1, win 501, options [nop,nop,TS val 1835896310 ecr 488075894], length 204
20:31:00.364834 IP 155.138.140.26.22 > 104.158.146.2.53986: Flags [P.], seq 7440:7644, ack 1, win 501, options [nop,nop,TS val 1835896310 ecr 488075894], length 204
20:31:00.364896 IP 155.138.140.26.22 > 104.158.146.2.53986: Flags [P.], seq 7680:7884, ack 1, win 501, options [nop,nop,TS val 1835896310 ecr 488075894], length 204
20:31:00.364971 IP 155.138.140.26.22 > 104.158.146.2.53986: Flags [P.], seq 7920:8124, ack 1, win 501, options [nop,nop,TS val 1835896310 ecr 488075894], length 204
20:31:00.365047 IP 155.138.140.26.22 > 104.158.146.2.53986: Flags [P.], seq 8160:8364, ack 1, win 501, options [nop,nop,TS val 1835896310 ecr 488075894], length 204
20:31:00.365140 IP 155.138.140.26.22 > 104.158.146.2.53986: Flags [P.], seq 8400:8604, ack 1, win 501, options [nop,nop,TS val 1835896310 ecr 488075894], length 204
20:31:00.365213 IP 155.138.140.26.22 > 104.158.146.2.53986: Flags [P.], seq 8640:8844, ack 1, win 501, options [nop,nop,TS val 1835896310 ecr 488075894], length 204
20:31:00.365292 IP 155.138.140.26.22 > 104.158.146.2.53986: Flags [P.], seq 8880:9084, ack 1, win 501, options [nop,nop,TS val 1835896310 ecr 488075894], length 204
20:31:00.365364 IP 155.138.140.26.22 > 104.158.146.2.53986: Flags [P.], seq 9120:9324, ack 1, win 501, options [nop,nop,TS val 1835896310 ecr 488075894], length 204
20:31:00.365443 IP 155.138.140.26.22 > 104.158.146.2.53986: Flags [P.], seq 9360:9564, ack 1, win 501, options [nop,nop,TS val 1835896310 ecr 488075894], length 204
20:31:00.365510 IP 155.138.140.26.22 > 104.158.146.2.53986: Flags [P.], seq 9600:9804, ack 1, win 501, options [nop,nop,TS val 1835896311 ecr 488075894], length 204
20:31:00.365565 IP 155.138.140.26.22 > 104.158.146.2.53986: Flags [P.], seq 9840:10044, ack 1, win 501, options [nop,nop,TS val 1835896311 ecr 488075894], length 204
20:31:00.365614 IP 155.138.140.26.22 > 104.158.146.2.53986: Flags [P.], seq 10080:10284, ack 1, win 501, options [nop,nop,TS val 1835896311 ecr 488075894], length 204
20:31:00.365669 IP 155.138.140.26.22 > 104.158.146.2.53986: Flags [P.], seq 10320:10524, ack 1, win 501, options [nop,nop,TS val 1835896311 ecr 488075894], length 204
20:31:00.365732 IP 155.138.140.26.22 > 104.158.146.2.53986: Flags [P.], seq 10560:10764, ack 1, win 501, options [nop,nop,TS val 1835896311 ecr 488075894], length 204
20:31:00.365768 IP 155.138.140.26.22 > 104.158.146.2.53986: Flags [P.], seq 10764:10800, ack 1, win 501, options [nop,nop,TS val 1835896311 ecr 488075894], length 36
20:31:00.365869 IP 155.138.140.26.22 > 104.158.146.2.53986: Flags [P.], seq 11040:11244, ack 1, win 501, options [nop,nop,TS val 1835896311 ecr 488075894], length 204
20:31:00.365931 IP 155.138.140.26.22 > 104.158.146.2.53986: Flags [P.], seq 11280:11484, ack 1, win 501, options [nop,nop,TS val 1835896311 ecr 488075894], length 204
20:31:00.366005 IP 155.138.140.26.22 > 104.158.146.2.53986: Flags [P.], seq 11520:11724, ack 1, win 501, options [nop,nop,TS val 1835896311 ecr 488075894], length 204
20:31:00.366079 IP 155.138.140.26.22 > 104.158.146.2.53986: Flags [P.], seq 11760:11964, ack 1, win 501, options [nop,nop,TS val 1835896311 ecr 488075894], length 204
20:31:00.366150 IP 155.138.140.26.22 > 104.158.146.2.53986: Flags [P.], seq 12000:12204, ack 1, win 501, options [nop,nop,TS val 1835896311 ecr 488075894], length 204
20:31:00.366215 IP 155.138.140.26.22 > 104.158.146.2.53986: Flags [P.], seq 12240:12444, ack 1, win 501, options [nop,nop,TS val 1835896311 ecr 488075894], length 204
20:31:00.366277 IP 155.138.140.26.22 > 104.158.146.2.53986: Flags [P.], seq 12480:12684, ack 1, win 501, options [nop,nop,TS val 1835896311 ecr 488075894], length 204
20:31:00.366348 IP 155.138.140.26.22 > 104.158.146.2.53986: Flags [P.], seq 12720:12924, ack 1, win 501, options [nop,nop,TS val 1835896311 ecr 488075894], length 204
20:31:00.366420 IP 155.138.140.26.22 > 104.158.146.2.53986: Flags [P.], seq 12960:13164, ack 1, win 501, options [nop,nop,TS val 1835896311 ecr 488075894], length 204
20:31:00.366480 IP 155.138.140.26.22 > 104.158.146.2.53986: Flags [P.], seq 13200:13404, ack 1, win 501, options [nop,nop,TS val 1835896311 ecr 488075894], length 204
20:31:00.366534 IP 155.138.140.26.22 > 104.158.146.2.53986: Flags [P.], seq 13440:13644, ack 1, win 501, options [nop,nop,TS val 1835896312 ecr 488075894], length 204
20:31:00.366602 IP 155.138.140.26.22 > 104.158.146.2.53986: Flags [P.], seq 13680:13884, ack 1, win 501, options [nop,nop,TS val 1835896312 ecr 488075894], length 204
20:31:00.366670 IP 155.138.140.26.22 > 104.158.146.2.53986: Flags [P.], seq 13920:14124, ack 1, win 501, options [nop,nop,TS val 1835896312 ecr 488075894], length 204
20:31:00.366714 IP 155.138.140.26.22 > 104.158.146.2.53986: Flags [P.], seq 14124:14328, ack 1, win 501, options [nop,nop,TS val 1835896312 ecr 488075894], length 204
20:31:00.366766 IP 155.138.140.26.22 > 104.158.146.2.53986: Flags [P.], seq 14328:14700, ack 1, win 501, options [nop,nop,TS val 1835896312 ecr 488075894], length 372
20:31:00.366820 IP 155.138.140.26.22 > 104.158.146.2.53986: Flags [P.], seq 14700:15232, ack 1, win 501, options [nop,nop,TS val 1835896312 ecr 488075894], length 532
20:31:00.366879 IP 155.138.140.26.22 > 104.158.146.2.53986: Flags [P.], seq 15232:15764, ack 1, win 501, options [nop,nop,TS val 1835896312 ecr 488075894], length 532
20:31:00.366931 IP 155.138.140.26.22 > 104.158.146.2.53986: Flags [P.], seq 15764:16464, ack 1, win 501, options [nop,nop,TS val 1835896312 ecr 488075894], length 700
20:31:00.366988 IP 155.138.140.26.22 > 104.158.146.2.53986: Flags [P.], seq 16464:16836, ack 1, win 501, options [nop,nop,TS val 1835896312 ecr 488075894], length 372
20:31:00.367053 IP 155.138.140.26.22 > 104.158.146.2.53986: Flags [P.], seq 16836:17376, ack 1, win 501, options [nop,nop,TS val 1835896312 ecr 488075894], length 540
20:31:00.367111 IP 155.138.140.26.22 > 104.158.146.2.53986: Flags [P.], seq 17376:17916, ack 1, win 501, options [nop,nop,TS val 1835896312 ecr 488075894], length 540
20:31:00.367163 IP 155.138.140.26.22 > 104.158.146.2.53986: Flags [P.], seq 17916:18456, ack 1, win 501, options [nop,nop,TS val 1835896312 ecr 488075894], length 540
20:31:00.367217 IP 155.138.140.26.22 > 104.158.146.2.53986: Flags [P.], seq 18456:18996, ack 1, win 501, options [nop,nop,TS val 1835896312 ecr 488075894], length 540
20:31:00.367279 IP 155.138.140.26.22 > 104.158.146.2.53986: Flags [P.], seq 18996:19536, ack 1, win 501, options [nop,nop,TS val 1835896312 ecr 488075894], length 540
20:31:00.367345 IP 155.138.140.26.22 > 104.158.146.2.53986: Flags [P.], seq 19536:20076, ack 1, win 501, options [nop,nop,TS val 1835896312 ecr 488075894], length 540
20:31:00.367422 IP 155.138.140.26.22 > 104.158.146.2.53986: Flags [P.], seq 20076:20784, ack 1, win 501, options [nop,nop,TS val 1835896312 ecr 488075894], length 708
20:31:00.367488 IP 155.138.140.26.22 > 104.158.146.2.53986: Flags [P.], seq 20784:21492, ack 1, win 501, options [nop,nop,TS val 1835896313 ecr 488075894], length 708
20:31:00.367545 IP 155.138.140.26.22 > 104.158.146.2.53986: Flags [P.], seq 21492:22032, ack 1, win 501, options [nop,nop,TS val 1835896313 ecr 488075894], length 540
20:31:00.367602 IP 155.138.140.26.22 > 104.158.146.2.53986: Flags [P.], seq 22032:22404, ack 1, win 501, options [nop,nop,TS val 1835896313 ecr 488075894], length 372
20:31:00.367664 IP 155.138.140.26.22 > 104.158.146.2.53986: Flags [P.], seq 22404:22608, ack 1, win 501, options [nop,nop,TS val 1835896313 ecr 488075894], length 204
20:31:00.367706 IP 155.138.140.26.22 > 104.158.146.2.53986: Flags [P.], seq 22608:22812, ack 1, win 501, options [nop,nop,TS val 1835896313 ecr 488075894], length 204
20:31:00.367770 IP 155.138.140.26.22 > 104.158.146.2.53986: Flags [P.], seq 22812:23016, ack 1, win 501, options [nop,nop,TS val 1835896313 ecr 488075894], length 204
20:31:00.367824 IP 155.138.140.26.22 > 104.158.146.2.53986: Flags [P.], seq 23016:23220, ack 1, win 501, options [nop,nop,TS val 1835896313 ecr 488075894], length 204
20:31:00.367877 IP 155.138.140.26.22 > 104.158.146.2.53986: Flags [P.], seq 23220:23424, ack 1, win 501, options [nop,nop,TS val 1835896313 ecr 488075894], length 204
20:31:00.367919 IP 155.138.140.26.22 > 104.158.146.2.53986: Flags [P.], seq 23424:23628, ack 1, win 501, options [nop,nop,TS val 1835896313 ecr 488075894], length 204
20:31:00.367970 IP 155.138.140.26.22 > 104.158.146.2.53986: Flags [P.], seq 23628:23832, ack 1, win 501, options [nop,nop,TS val 1835896313 ecr 488075894], length 204
20:31:00.368017 IP 155.138.140.26.22 > 104.158.146.2.53986: Flags [P.], seq 23832:24036, ack 1, win 501, options [nop,nop,TS val 1835896313 ecr 488075894], length 204
20:31:00.368065 IP 155.138.140.26.22 > 104.158.146.2.53986: Flags [P.], seq 24036:24240, ack 1, win 501, options [nop,nop,TS val 1835896313 ecr 488075894], length 204
20:31:00.368112 IP 155.138.140.26.22 > 104.158.146.2.53986: Flags [P.], seq 24240:24444, ack 1, win 501, options [nop,nop,TS val 1835896313 ecr 488075894], length 204
20:31:00.368152 IP 155.138.140.26.22 > 104.158.146.2.53986: Flags [P.], seq 24444:24648, ack 1, win 501, options [nop,nop,TS val 1835896313 ecr 488075894], length 204
20:31:00.368198 IP 155.138.140.26.22 > 104.158.146.2.53986: Flags [P.], seq 24648:24852, ack 1, win 501, options [nop,nop,TS val 1835896313 ecr 488075894], length 204
20:31:00.368272 IP 155.138.140.26.22 > 104.158.146.2.53986: Flags [P.], seq 24852:25056, ack 1, win 501, options [nop,nop,TS val 1835896313 ecr 488075894], length 204
20:31:00.368337 IP 155.138.140.26.22 > 104.158.146.2.53986: Flags [P.], seq 25056:25260, ack 1, win 501, options [nop,nop,TS val 1835896313 ecr 488075894], length 204
20:31:00.368380 IP 155.138.140.26.22 > 104.158.146.2.53986: Flags [P.], seq 25260:25464, ack 1, win 501, options [nop,nop,TS val 1835896313 ecr 488075894], length 204
20:31:00.368434 IP 155.138.140.26.22 > 104.158.146.2.53986: Flags [P.], seq 25464:25668, ack 1, win 501, options [nop,nop,TS val 1835896313 ecr 488075894], length 204
20:31:00.368485 IP 155.138.140.26.22 > 104.158.146.2.53986: Flags [P.], seq 25668:25872, ack 1, win 501, options [nop,nop,TS val 1835896313 ecr 488075894], length 204
20:31:00.368538 IP 155.138.140.26.22 > 104.158.146.2.53986: Flags [P.], seq 25872:26076, ack 1, win 501, options [nop,nop,TS val 1835896314 ecr 488075894], length 204
20:31:00.368583 IP 155.138.140.26.22 > 104.158.146.2.53986: Flags [P.], seq 26076:26280, ack 1, win 501, options [nop,nop,TS val 1835896314 ecr 488075894], length 204
20:31:00.368627 IP 155.138.140.26.22 > 104.158.146.2.53986: Flags [P.], seq 26280:26484, ack 1, win 501, options [nop,nop,TS val 1835896314 ecr 488075894], length 204
20:31:00.368669 IP 155.138.140.26.22 > 104.158.146.2.53986: Flags [P.], seq 26484:26688, ack 1, win 501, options [nop,nop,TS val 1835896314 ecr 488075894], length 204
20:31:00.368707 IP 155.138.140.26.22 > 104.158.146.2.53986: Flags [P.], seq 26688:26892, ack 1, win 501, options [nop,nop,TS val 1835896314 ecr 488075894], length 204
20:31:00.368745 IP 155.138.140.26.22 > 104.158.146.2.53986: Flags [P.], seq 26892:27096, ack 1, win 501, options [nop,nop,TS val 1835896314 ecr 488075894], length 204
20:31:00.368835 IP 155.138.140.26.22 > 104.158.146.2.53986: Flags [P.], seq 27096:27300, ack 1, win 501, options [nop,nop,TS val 1835896314 ecr 488075894], length 204
20:31:00.368898 IP 155.138.140.26.22 > 104.158.146.2.53986: Flags [P.], seq 27300:27504, ack 1, win 501, options [nop,nop,TS val 1835896314 ecr 488075894], length 204
20:31:00.368950 IP 155.138.140.26.22 > 104.158.146.2.53986: Flags [P.], seq 27504:27708, ack 1, win 501, options [nop,nop,TS val 1835896314 ecr 488075894], length 204
20:31:00.368996 IP 155.138.140.26.22 > 104.158.146.2.53986: Flags [P.], seq 27708:27912, ack 1, win 501, options [nop,nop,TS val 1835896314 ecr 488075894], length 204
20:31:00.369030 IP 155.138.140.26.22 > 104.158.146.2.53986: Flags [P.], seq 27912:28116, ack 1, win 501, options [nop,nop,TS val 1835896314 ecr 488075894], length 204
20:31:00.369063 IP 155.138.140.26.22 > 104.158.146.2.53986: Flags [P.], seq 28116:28320, ack 1, win 501, options [nop,nop,TS val 1835896314 ecr 488075894], length 204
20:31:00.369213 IP 155.138.140.26.22 > 104.158.146.2.53986: Flags [P.], seq 28320:28524, ack 1, win 501, options [nop,nop,TS val 1835896314 ecr 488075894], length 204
20:31:00.369267 IP 155.138.140.26.22 > 104.158.146.2.53986: Flags [P.], seq 28524:28728, ack 1, win 501, options [nop,nop,TS val 1835896314 ecr 488075894], length 204
20:31:00.369313 IP 155.138.140.26.22 > 104.158.146.2.53986: Flags [P.], seq 28728:28932, ack 1, win 501, options [nop,nop,TS val 1835896314 ecr 488075894], length 204
20:31:00.369366 IP 155.138.140.26.22 > 104.158.146.2.53986: Flags [P.], seq 28932:29136, ack 1, win 501, options [nop,nop,TS val 1835896314 ecr 488075894], length 204
20:31:00.369414 IP 155.138.140.26.22 > 104.158.146.2.53986: Flags [P.], seq 29136:29340, ack 1, win 501, options [nop,nop,TS val 1835896314 ecr 488075894], length 204
20:31:00.369457 IP 155.138.140.26.22 > 104.158.146.2.53986: Flags [P.], seq 29340:29544, ack 1, win 501, options [nop,nop,TS val 1835896314 ecr 488075894], length 204
20:31:00.369506 IP 155.138.140.26.22 > 104.158.146.2.53986: Flags [P.], seq 29544:29748, ack 1, win 501, options [nop,nop,TS val 1835896315 ecr 488075894], length 204
20:31:00.369559 IP 155.138.140.26.22 > 104.158.146.2.53986: Flags [P.], seq 29748:29952, ack 1, win 501, options [nop,nop,TS val 1835896315 ecr 488075894], length 204
20:31:00.369606 IP 155.138.140.26.22 > 104.158.146.2.53986: Flags [P.], seq 29952:30156, ack 1, win 501, options [nop,nop,TS val 1835896315 ecr 488075894], length 204
20:31:00.369656 IP 155.138.140.26.22 > 104.158.146.2.53986: Flags [P.], seq 30156:30360, ack 1, win 501, options [nop,nop,TS val 1835896315 ecr 488075894], length 204
20:31:00.369706 IP 155.138.140.26.22 > 104.158.146.2.53986: Flags [P.], seq 30360:30564, ack 1, win 501, options [nop,nop,TS val 1835896315 ecr 488075894], length 204
20:31:00.369756 IP 155.138.140.26.22 > 104.158.146.2.53986: Flags [P.], seq 30564:30768, ack 1, win 501, options [nop,nop,TS val 1835896315 ecr 488075894], length 204
20:31:00.369807 IP 155.138.140.26.22 > 104.158.146.2.53986: Flags [P.], seq 30768:30972, ack 1, win 501, options [nop,nop,TS val 1835896315 ecr 488075894], length 204
20:31:00.369853 IP 155.138.140.26.22 > 104.158.146.2.53986: Flags [P.], seq 30972:31176, ack 1, win 501, options [nop,nop,TS val 1835896315 ecr 488075894], length 204
20:31:00.369904 IP 155.138.140.26.22 > 104.158.146.2.53986: Flags [P.], seq 31176:31380, ack 1, win 501, options [nop,nop,TS val 1835896315 ecr 488075894], length 204
20:31:00.369952 IP 155.138.140.26.22 > 104.158.146.2.53986: Flags [P.], seq 31380:31584, ack 1, win 501, options [nop,nop,TS val 1835896315 ecr 488075894], length 204
20:31:00.369998 IP 155.138.140.26.22 > 104.158.146.2.53986: Flags [P.], seq 31584:31788, ack 1, win 501, options [nop,nop,TS val 1835896315 ecr 488075894], length 204
20:31:00.370045 IP 155.138.140.26.22 > 104.158.146.2.53986: Flags [P.], seq 31788:31992, ack 1, win 501, options [nop,nop,TS val 1835896315 ecr 488075894], length 204
20:31:00.370097 IP 155.138.140.26.22 > 104.158.146.2.53986: Flags [P.], seq 31992:32196, ack 1, win 501, options [nop,nop,TS val 1835896315 ecr 488075894], length 204
20:31:00.370143 IP 155.138.140.26.22 > 104.158.146.2.53986: Flags [P.], seq 32196:32400, ack 1, win 501, options [nop,nop,TS val 1835896315 ecr 488075894], length 204
20:31:00.370179 IP 155.138.140.26.22 > 104.158.146.2.53986: Flags [P.], seq 32400:32604, ack 1, win 501, options [nop,nop,TS val 1835896315 ecr 488075894], length 204
20:31:00.370220 IP 155.138.140.26.22 > 104.158.146.2.53986: Flags [P.], seq 32604:32808, ack 1, win 501, options [nop,nop,TS val 1835896315 ecr 488075894], length 204
20:31:00.370271 IP 155.138.140.26.22 > 104.158.146.2.53986: Flags [P.], seq 32808:33012, ack 1, win 501, options [nop,nop,TS val 1835896315 ecr 488075894], length 204
20:31:00.370317 IP 155.138.140.26.22 > 104.158.146.2.53986: Flags [P.], seq 33012:33216, ack 1, win 501, options [nop,nop,TS val 1835896315 ecr 488075894], length 204
20:31:00.370363 IP 155.138.140.26.22 > 104.158.146.2.53986: Flags [P.], seq 33216:33420, ack 1, win 501, options [nop,nop,TS val 1835896315 ecr 488075894], length 204
20:31:00.370402 IP 155.138.140.26.22 > 104.158.146.2.53986: Flags [P.], seq 33420:33624, ack 1, win 501, options [nop,nop,TS val 1835896315 ecr 488075894], length 204
20:31:00.370438 IP 155.138.140.26.22 > 104.158.146.2.53986: Flags [P.], seq 33624:33828, ack 1, win 501, options [nop,nop,TS val 1835896315 ecr 488075894], length 204
20:31:00.370486 IP 155.138.140.26.22 > 104.158.146.2.53986: Flags [P.], seq 33828:34032, ack 1, win 501, options [nop,nop,TS val 1835896315 ecr 488075894], length 204
20:31:00.370535 IP 155.138.140.26.22 > 104.158.146.2.53986: Flags [P.], seq 34032:34236, ack 1, win 501, options [nop,nop,TS val 1835896316 ecr 488075894], length 204
20:31:00.370580 IP 155.138.140.26.22 > 104.158.146.2.53986: Flags [P.], seq 34236:34440, ack 1, win 501, options [nop,nop,TS val 1835896316 ecr 488075894], length 204
20:31:00.370628 IP 155.138.140.26.22 > 104.158.146.2.53986: Flags [P.], seq 34440:34644, ack 1, win 501, options [nop,nop,TS val 1835896316 ecr 488075894], length 204
20:31:00.370671 IP 155.138.140.26.22 > 104.158.146.2.53986: Flags [P.], seq 34644:34848, ack 1, win 501, options [nop,nop,TS val 1835896316 ecr 488075894], length 204
20:31:00.370719 IP 155.138.140.26.22 > 104.158.146.2.53986: Flags [P.], seq 34848:35052, ack 1, win 501, options [nop,nop,TS val 1835896316 ecr 488075894], length 204
20:31:00.370769 IP 155.138.140.26.22 > 104.158.146.2.53986: Flags [P.], seq 35052:35256, ack 1, win 501, options [nop,nop,TS val 1835896316 ecr 488075894], length 204
20:31:00.370814 IP 155.138.140.26.22 > 104.158.146.2.53986: Flags [P.], seq 35256:35460, ack 1, win 501, options [nop,nop,TS val 1835896316 ecr 488075894], length 204
20:31:00.370854 IP 155.138.140.26.22 > 104.158.146.2.53986: Flags [P.], seq 35460:35664, ack 1, win 501, options [nop,nop,TS val 1835896316 ecr 488075894], length 204
20:31:00.370896 IP 155.138.140.26.22 > 104.158.146.2.53986: Flags [P.], seq 35664:35868, ack 1, win 501, options [nop,nop,TS val 1835896316 ecr 488075894], length 204
20:31:00.370941 IP 155.138.140.26.22 > 104.158.146.2.53986: Flags [P.], seq 35868:36072, ack 1, win 501, options [nop,nop,TS val 1835896316 ecr 488075894], length 204
20:31:00.370985 IP 155.138.140.26.22 > 104.158.146.2.53986: Flags [P.], seq 36072:36276, ack 1, win 501, options [nop,nop,TS val 1835896316 ecr 488075894], length 204
20:31:00.371030 IP 155.138.140.26.22 > 104.158.146.2.53986: Flags [P.], seq 36276:36480, ack 1, win 501, options [nop,nop,TS val 1835896316 ecr 488075894], length 204
20:31:00.371069 IP 155.138.140.26.22 > 104.158.146.2.53986: Flags [P.], seq 36480:36684, ack 1, win 501, options [nop,nop,TS val 1835896316 ecr 488075894], length 204
20:31:00.371107 IP 155.138.140.26.22 > 104.158.146.2.53986: Flags [P.], seq 36684:36888, ack 1, win 501, options [nop,nop,TS val 1835896316 ecr 488075894], length 204
20:31:00.371145 IP 155.138.140.26.22 > 104.158.146.2.53986: Flags [P.], seq 36888:37092, ack 1, win 501, options [nop,nop,TS val 1835896316 ecr 488075894], length 204
20:31:00.371192 IP 155.138.140.26.22 > 104.158.146.2.53986: Flags [P.], seq 37092:37296, ack 1, win 501, options [nop,nop,TS val 1835896316 ecr 488075894], length 204
20:31:00.371240 IP 155.138.140.26.22 > 104.158.146.2.53986: Flags [P.], seq 37296:37500, ack 1, win 501, options [nop,nop,TS val 1835896316 ecr 488075894], length 204
20:31:00.371285 IP 155.138.140.26.22 > 104.158.146.2.53986: Flags [P.], seq 37500:37704, ack 1, win 501, options [nop,nop,TS val 1835896316 ecr 488075894], length 204
20:31:00.371333 IP 155.138.140.26.22 > 104.158.146.2.53986: Flags [P.], seq 37704:37908, ack 1, win 501, options [nop,nop,TS val 1835896316 ecr 488075894], length 204
20:31:00.371375 IP 155.138.140.26.22 > 104.158.146.2.53986: Flags [P.], seq 37908:38112, ack 1, win 501, options [nop,nop,TS val 1835896316 ecr 488075894], length 204
20:31:00.371413 IP 155.138.140.26.22 > 104.158.146.2.53986: Flags [P.], seq 38112:38316, ack 1, win 501, options [nop,nop,TS val 1835896316 ecr 488075894], length 204
20:31:00.371451 IP 155.138.140.26.22 > 104.158.146.2.53986: Flags [P.], seq 38316:38520, ack 1, win 501, options [nop,nop,TS val 1835896316 ecr 488075894], length 204
20:31:00.371488 IP 155.138.140.26.22 > 104.158.146.2.53986: Flags [P.], seq 38520:38724, ack 1, win 501, options [nop,nop,TS val 1835896317 ecr 488075894], length 204
20:31:00.371534 IP 155.138.140.26.22 > 104.158.146.2.53986: Flags [P.], seq 38724:38928, ack 1, win 501, options [nop,nop,TS val 1835896317 ecr 488075894], length 204
20:31:00.371584 IP 155.138.140.26.22 > 104.158.146.2.53986: Flags [P.], seq 38928:39132, ack 1, win 501, options [nop,nop,TS val 1835896317 ecr 488075894], length 204
20:31:00.371630 IP 155.138.140.26.22 > 104.158.146.2.53986: Flags [P.], seq 39132:39336, ack 1, win 501, options [nop,nop,TS val 1835896317 ecr 488075894], length 204
20:31:00.371671 IP 155.138.140.26.22 > 104.158.146.2.53986: Flags [P.], seq 39336:39540, ack 1, win 501, options [nop,nop,TS val 1835896317 ecr 488075894], length 204
20:31:00.371709 IP 155.138.140.26.22 > 104.158.146.2.53986: Flags [P.], seq 39540:39744, ack 1, win 501, options [nop,nop,TS val 1835896317 ecr 488075894], length 204
20:31:00.371757 IP 155.138.140.26.22 > 104.158.146.2.53986: Flags [P.], seq 39744:39948, ack 1, win 501, options [nop,nop,TS val 1835896317 ecr 488075894], length 204
20:31:00.371810 IP 155.138.140.26.22 > 104.158.146.2.53986: Flags [P.], seq 39948:40152, ack 1, win 501, options [nop,nop,TS val 1835896317 ecr 488075894], length 204
20:31:00.371855 IP 155.138.140.26.22 > 104.158.146.2.53986: Flags [P.], seq 40152:40356, ack 1, win 501, options [nop,nop,TS val 1835896317 ecr 488075894], length 204
20:31:00.371907 IP 155.138.140.26.22 > 104.158.146.2.53986: Flags [P.], seq 40356:40560, ack 1, win 501, options [nop,nop,TS val 1835896317 ecr 488075894], length 204
20:31:00.371948 IP 155.138.140.26.22 > 104.158.146.2.53986: Flags [P.], seq 40560:40764, ack 1, win 501, options [nop,nop,TS val 1835896317 ecr 488075894], length 204
20:31:00.371986 IP 155.138.140.26.22 > 104.158.146.2.53986: Flags [P.], seq 40764:40968, ack 1, win 501, options [nop,nop,TS val 1835896317 ecr 488075894], length 204
20:31:00.372037 IP 155.138.140.26.22 > 104.158.146.2.53986: Flags [P.], seq 40968:41172, ack 1, win 501, options [nop,nop,TS val 1835896317 ecr 488075894], length 204
20:31:00.372088 IP 155.138.140.26.22 > 104.158.146.2.53986: Flags [P.], seq 41172:41376, ack 1, win 501, options [nop,nop,TS val 1835896317 ecr 488075894], length 204
20:31:00.372134 IP 155.138.140.26.22 > 104.158.146.2.53986: Flags [P.], seq 41376:41580, ack 1, win 501, options [nop,nop,TS val 1835896317 ecr 488075894], length 204
20:31:00.372179 IP 155.138.140.26.22 > 104.158.146.2.53986: Flags [P.], seq 41580:41784, ack 1, win 501, options [nop,nop,TS val 1835896317 ecr 488075894], length 204
20:31:00.372218 IP 155.138.140.26.22 > 104.158.146.2.53986: Flags [P.], seq 41784:41988, ack 1, win 501, options [nop,nop,TS val 1835896317 ecr 488075894], length 204
20:31:00.372268 IP 155.138.140.26.22 > 104.158.146.2.53986: Flags [P.], seq 41988:42192, ack 1, win 501, options [nop,nop,TS val 1835896317 ecr 488075894], length 204
20:31:00.372318 IP 155.138.140.26.22 > 104.158.146.2.53986: Flags [P.], seq 42192:42396, ack 1, win 501, options [nop,nop,TS val 1835896317 ecr 488075894], length 204
20:31:00.372364 IP 155.138.140.26.22 > 104.158.146.2.53986: Flags [P.], seq 42396:42600, ack 1, win 501, options [nop,nop,TS val 1835896317 ecr 488075894], length 204
20:31:00.372409 IP 155.138.140.26.22 > 104.158.146.2.53986: Flags [P.], seq 42600:42804, ack 1, win 501, options [nop,nop,TS val 1835896317 ecr 488075894], length 204
20:31:00.372455 IP 155.138.140.26.22 > 104.158.146.2.53986: Flags [P.], seq 42804:43008, ack 1, win 501, options [nop,nop,TS val 1835896317 ecr 488075894], length 204
20:31:00.372502 IP 155.138.140.26.22 > 104.158.146.2.53986: Flags [P.], seq 43008:43212, ack 1, win 501, options [nop,nop,TS val 1835896318 ecr 488075894], length 204
20:31:00.372547 IP 155.138.140.26.22 > 104.158.146.2.53986: Flags [P.], seq 43212:43416, ack 1, win 501, options [nop,nop,TS val 1835896318 ecr 488075894], length 204
20:31:00.372592 IP 155.138.140.26.22 > 104.158.146.2.53986: Flags [P.], seq 43416:43620, ack 1, win 501, options [nop,nop,TS val 1835896318 ecr 488075894], length 204
20:31:00.372644 IP 155.138.140.26.22 > 104.158.146.2.53986: Flags [P.], seq 43620:43824, ack 1, win 501, options [nop,nop,TS val 1835896318 ecr 488075894], length 204
20:31:00.372690 IP 155.138.140.26.22 > 104.158.146.2.53986: Flags [P.], seq 43824:44028, ack 1, win 501, options [nop,nop,TS val 1835896318 ecr 488075894], length 204
20:31:00.372741 IP 155.138.140.26.22 > 104.158.146.2.53986: Flags [P.], seq 44028:44232, ack 1, win 501, options [nop,nop,TS val 1835896318 ecr 488075894], length 204
20:31:00.372841 IP 155.138.140.26.22 > 104.158.146.2.53986: Flags [P.], seq 44232:44436, ack 1, win 501, options [nop,nop,TS val 1835896318 ecr 488075894], length 204
20:31:00.372895 IP 155.138.140.26.22 > 104.158.146.2.53986: Flags [P.], seq 44436:44640, ack 1, win 501, options [nop,nop,TS val 1835896318 ecr 488075894], length 204
20:31:00.372944 IP 155.138.140.26.22 > 104.158.146.2.53986: Flags [P.], seq 44640:44844, ack 1, win 501, options [nop,nop,TS val 1835896318 ecr 488075894], length 204
20:31:00.372990 IP 155.138.140.26.22 > 104.158.146.2.53986: Flags [P.], seq 44844:45048, ack 1, win 501, options [nop,nop,TS val 1835896318 ecr 488075894], length 204
20:31:00.373041 IP 155.138.140.26.22 > 104.158.146.2.53986: Flags [P.], seq 45048:45252, ack 1, win 501, options [nop,nop,TS val 1835896318 ecr 488075894], length 204
20:31:00.373102 IP 155.138.140.26.22 > 104.158.146.2.53986: Flags [P.], seq 45252:45456, ack 1, win 501, options [nop,nop,TS val 1835896318 ecr 488075894], length 204
20:31:00.373148 IP 155.138.140.26.22 > 104.158.146.2.53986: Flags [P.], seq 45456:45660, ack 1, win 501, options [nop,nop,TS val 1835896318 ecr 488075894], length 204
20:31:00.373200 IP 155.138.140.26.22 > 104.158.146.2.53986: Flags [P.], seq 45660:45864, ack 1, win 501, options [nop,nop,TS val 1835896318 ecr 488075894], length 204
20:31:00.373248 IP 155.138.140.26.22 > 104.158.146.2.53986: Flags [P.], seq 45864:46068, ack 1, win 501, options [nop,nop,TS val 1835896318 ecr 488075894], length 204
20:31:00.373318 IP 155.138.140.26.22 > 104.158.146.2.53986: Flags [P.], seq 46068:46272, ack 1, win 501, options [nop,nop,TS val 1835896318 ecr 488075894], length 204
20:31:00.373371 IP 155.138.140.26.22 > 104.158.146.2.53986: Flags [P.], seq 46272:46476, ack 1, win 501, options [nop,nop,TS val 1835896318 ecr 488075894], length 204
20:31:00.373417 IP 155.138.140.26.22 > 104.158.146.2.53986: Flags [P.], seq 46476:46680, ack 1, win 501, options [nop,nop,TS val 1835896318 ecr 488075894], length 204
20:31:00.373468 IP 155.138.140.26.22 > 104.158.146.2.53986: Flags [P.], seq 46680:46884, ack 1, win 501, options [nop,nop,TS val 1835896318 ecr 488075894], length 204
20:31:00.373555 IP 155.138.140.26.22 > 104.158.146.2.53986: Flags [P.], seq 46884:47088, ack 1, win 501, options [nop,nop,TS val 1835896319 ecr 488075894], length 204
20:31:00.373621 IP 155.138.140.26.22 > 104.158.146.2.53986: Flags [P.], seq 47088:47292, ack 1, win 501, options [nop,nop,TS val 1835896319 ecr 488075894], length 204
20:31:00.373668 IP 155.138.140.26.22 > 104.158.146.2.53986: Flags [P.], seq 47292:47496, ack 1, win 501, options [nop,nop,TS val 1835896319 ecr 488075894], length 204
20:31:00.373711 IP 155.138.140.26.22 > 104.158.146.2.53986: Flags [P.], seq 47496:47700, ack 1, win 501, options [nop,nop,TS val 1835896319 ecr 488075894], length 204
20:31:00.373760 IP 155.138.140.26.22 > 104.158.146.2.53986: Flags [P.], seq 47700:47904, ack 1, win 501, options [nop,nop,TS val 1835896319 ecr 488075894], length 204
20:31:00.373808 IP 155.138.140.26.22 > 104.158.146.2.53986: Flags [P.], seq 47904:48108, ack 1, win 501, options [nop,nop,TS val 1835896319 ecr 488075894], length 204
20:31:00.373851 IP 155.138.140.26.22 > 104.158.146.2.53986: Flags [P.], seq 48108:48312, ack 1, win 501, options [nop,nop,TS val 1835896319 ecr 488075894], length 204
20:31:00.373898 IP 155.138.140.26.22 > 104.158.146.2.53986: Flags [P.], seq 48312:48516, ack 1, win 501, options [nop,nop,TS val 1835896319 ecr 488075894], length 204
20:31:00.373946 IP 155.138.140.26.22 > 104.158.146.2.53986: Flags [P.], seq 48516:48720, ack 1, win 501, options [nop,nop,TS val 1835896319 ecr 488075894], length 204
20:31:00.373990 IP 155.138.140.26.22 > 104.158.146.2.53986: Flags [P.], seq 48720:48924, ack 1, win 501, options [nop,nop,TS val 1835896319 ecr 488075894], length 204
20:31:00.374029 IP 155.138.140.26.22 > 104.158.146.2.53986: Flags [P.], seq 48924:49128, ack 1, win 501, options [nop,nop,TS val 1835896319 ecr 488075894], length 204
20:31:00.374067 IP 155.138.140.26.22 > 104.158.146.2.53986: Flags [P.], seq 49128:49332, ack 1, win 501, options [nop,nop,TS val 1835896319 ecr 488075894], length 204
20:31:00.374106 IP 155.138.140.26.22 > 104.158.146.2.53986: Flags [P.], seq 49332:49536, ack 1, win 501, options [nop,nop,TS val 1835896319 ecr 488075894], length 204
20:31:00.374147 IP 155.138.140.26.22 > 104.158.146.2.53986: Flags [P.], seq 49536:49740, ack 1, win 501, options [nop,nop,TS val 1835896319 ecr 488075894], length 204
