root@comp3134:~# tcpdump -i enp1s0 port 22
tcpdump: verbose output suppressed, use -v or -vv for full protocol decode
listening on enp1s0, link-type EN10MB (Ethernet), capture size 262144 bytes
20:32:44.323111 IP 155.138.140.26.vultr.com.ssh > 2.146.158.104.in-addr.arpa.53986: Flags [P.], seq 3818974409:3818974517, ack 3713454276, win 501, options [nop,nop,TS val 1836000268 ecr 488179854], length 108
20:32:44.323154 IP 155.138.140.26.vultr.com.ssh > 2.146.158.104.in-addr.arpa.53986: Flags [P.], seq 108:260, ack 1, win 501, options [nop,nop,TS val 1836000268 ecr 488179854], length 152
20:32:44.323185 IP 155.138.140.26.vultr.com.ssh > 2.146.158.104.in-addr.arpa.53986: Flags [P.], seq 260:296, ack 1, win 501, options [nop,nop,TS val 1836000268 ecr 488179854], length 36
20:32:44.323693 IP 155.138.140.26.vultr.com.ssh > 2.146.158.104.in-addr.arpa.53986: Flags [P.], seq 296:540, ack 1, win 501, options [nop,nop,TS val 1836000269 ecr 488179854], length 244
20:32:44.323722 IP 155.138.140.26.vultr.com.ssh > 2.146.158.104.in-addr.arpa.53986: Flags [P.], seq 540:576, ack 1, win 501, options [nop,nop,TS val 1836000269 ecr 488179854], length 36
20:32:44.323752 IP 155.138.140.26.vultr.com.ssh > 2.146.158.104.in-addr.arpa.53986: Flags [P.], seq 576:796, ack 1, win 501, options [nop,nop,TS val 1836000269 ecr 488179854], length 220
20:32:44.323791 IP 155.138.140.26.vultr.com.ssh > 2.146.158.104.in-addr.arpa.53986: Flags [P.], seq 796:1052, ack 1, win 501, options [nop,nop,TS val 1836000269 ecr 488179854], length 256
20:32:44.323811 IP 155.138.140.26.vultr.com.ssh > 2.146.158.104.in-addr.arpa.53986: Flags [P.], seq 1052:1088, ack 1, win 501, options [nop,nop,TS val 1836000269 ecr 488179854], length 36
20:32:44.323834 IP 155.138.140.26.vultr.com.ssh > 2.146.158.104.in-addr.arpa.53986: Flags [P.], seq 1088:1308, ack 1, win 501, options [nop,nop,TS val 1836000269 ecr 488179854], length 220
20:32:44.323879 IP 155.138.140.26.vultr.com.ssh > 2.146.158.104.in-addr.arpa.53986: Flags [P.], seq 1308:1600, ack 1, win 501, options [nop,nop,TS val 1836000269 ecr 488179854], length 292
20:32:44.323901 IP 155.138.140.26.vultr.com.ssh > 2.146.158.104.in-addr.arpa.53986: Flags [P.], seq 1600:1820, ack 1, win 501, options [nop,nop,TS val 1836000269 ecr 488179854], length 220
20:32:44.323926 IP 155.138.140.26.vultr.com.ssh > 2.146.158.104.in-addr.arpa.53986: Flags [P.], seq 1820:1856, ack 1, win 501, options [nop,nop,TS val 1836000269 ecr 488179854], length 36
20:32:44.323955 IP 155.138.140.26.vultr.com.ssh > 2.146.158.104.in-addr.arpa.53986: Flags [P.], seq 1856:2084, ack 1, win 501, options [nop,nop,TS val 1836000269 ecr 488179854], length 228
20:32:44.323975 IP 155.138.140.26.vultr.com.ssh > 2.146.158.104.in-addr.arpa.53986: Flags [P.], seq 2084:2120, ack 1, win 501, options [nop,nop,TS val 1836000269 ecr 488179854], length 36
20:32:44.324008 IP 155.138.140.26.vultr.com.ssh > 2.146.158.104.in-addr.arpa.53986: Flags [P.], seq 2120:2348, ack 1, win 501, options [nop,nop,TS val 1836000269 ecr 488179854], length 228
20:32:44.324030 IP 155.138.140.26.vultr.com.ssh > 2.146.158.104.in-addr.arpa.53986: Flags [P.], seq 2348:2384, ack 1, win 501, options [nop,nop,TS val 1836000269 ecr 488179854], length 36
20:32:44.324057 IP 155.138.140.26.vultr.com.ssh > 2.146.158.104.in-addr.arpa.53986: Flags [P.], seq 2384:2612, ack 1, win 501, options [nop,nop,TS val 1836000269 ecr 488179854], length 228
20:32:44.324081 IP 155.138.140.26.vultr.com.ssh > 2.146.158.104.in-addr.arpa.53986: Flags [P.], seq 2612:2648, ack 1, win 501, options [nop,nop,TS val 1836000269 ecr 488179854], length 36
20:32:44.324112 IP 155.138.140.26.vultr.com.ssh > 2.146.158.104.in-addr.arpa.53986: Flags [P.], seq 2648:2876, ack 1, win 501, options [nop,nop,TS val 1836000269 ecr 488179854], length 228
20:32:44.324133 IP 155.138.140.26.vultr.com.ssh > 2.146.158.104.in-addr.arpa.53986: Flags [P.], seq 2876:2912, ack 1, win 501, options [nop,nop,TS val 1836000269 ecr 488179854], length 36
20:32:44.324164 IP 155.138.140.26.vultr.com.ssh > 2.146.158.104.in-addr.arpa.53986: Flags [P.], seq 2912:3140, ack 1, win 501, options [nop,nop,TS val 1836000269 ecr 488179854], length 228
20:32:44.324185 IP 155.138.140.26.vultr.com.ssh > 2.146.158.104.in-addr.arpa.53986: Flags [P.], seq 3140:3176, ack 1, win 501, options [nop,nop,TS val 1836000269 ecr 488179854], length 36
20:32:44.324213 IP 155.138.140.26.vultr.com.ssh > 2.146.158.104.in-addr.arpa.53986: Flags [P.], seq 3176:3404, ack 1, win 501, options [nop,nop,TS val 1836000269 ecr 488179854], length 228
20:32:44.324238 IP 155.138.140.26.vultr.com.ssh > 2.146.158.104.in-addr.arpa.53986: Flags [P.], seq 3404:3440, ack 1, win 501, options [nop,nop,TS val 1836000269 ecr 488179854], length 36
20:32:44.324269 IP 155.138.140.26.vultr.com.ssh > 2.146.158.104.in-addr.arpa.53986: Flags [P.], seq 3440:3668, ack 1, win 501, options [nop,nop,TS val 1836000269 ecr 488179854], length 228
20:32:44.324289 IP 155.138.140.26.vultr.com.ssh > 2.146.158.104.in-addr.arpa.53986: Flags [P.], seq 3668:3704, ack 1, win 501, options [nop,nop,TS val 1836000269 ecr 488179854], length 36
20:32:44.324320 IP 155.138.140.26.vultr.com.ssh > 2.146.158.104.in-addr.arpa.53986: Flags [P.], seq 3704:3932, ack 1, win 501, options [nop,nop,TS val 1836000269 ecr 488179854], length 228
20:32:44.324341 IP 155.138.140.26.vultr.com.ssh > 2.146.158.104.in-addr.arpa.53986: Flags [P.], seq 3932:3968, ack 1, win 501, options [nop,nop,TS val 1836000269 ecr 488179854], length 36
20:32:44.324368 IP 155.138.140.26.vultr.com.ssh > 2.146.158.104.in-addr.arpa.53986: Flags [P.], seq 3968:4196, ack 1, win 501, options [nop,nop,TS val 1836000269 ecr 488179854], length 228
20:32:44.324404 IP 155.138.140.26.vultr.com.ssh > 2.146.158.104.in-addr.arpa.53986: Flags [P.], seq 4196:4232, ack 1, win 501, options [nop,nop,TS val 1836000269 ecr 488179854], length 36
20:32:44.324417 IP 155.138.140.26.vultr.com.ssh > 2.146.158.104.in-addr.arpa.53986: Flags [P.], seq 4232:4460, ack 1, win 501, options [nop,nop,TS val 1836000269 ecr 488179854], length 228
20:32:44.324435 IP 155.138.140.26.vultr.com.ssh > 2.146.158.104.in-addr.arpa.53986: Flags [P.], seq 4460:4496, ack 1, win 501, options [nop,nop,TS val 1836000269 ecr 488179854], length 36
20:32:44.324463 IP 155.138.140.26.vultr.com.ssh > 2.146.158.104.in-addr.arpa.53986: Flags [P.], seq 4496:4724, ack 1, win 501, options [nop,nop,TS val 1836000269 ecr 488179854], length 228
20:32:44.324485 IP 155.138.140.26.vultr.com.ssh > 2.146.158.104.in-addr.arpa.53986: Flags [P.], seq 4724:4760, ack 1, win 501, options [nop,nop,TS val 1836000269 ecr 488179854], length 36
20:32:44.324516 IP 155.138.140.26.vultr.com.ssh > 2.146.158.104.in-addr.arpa.53986: Flags [P.], seq 4760:4988, ack 1, win 501, options [nop,nop,TS val 1836000270 ecr 488179854], length 228
20:32:44.324538 IP 155.138.140.26.vultr.com.ssh > 2.146.158.104.in-addr.arpa.53986: Flags [P.], seq 4988:5024, ack 1, win 501, options [nop,nop,TS val 1836000270 ecr 488179854], length 36
20:32:44.324570 IP 155.138.140.26.vultr.com.ssh > 2.146.158.104.in-addr.arpa.53986: Flags [P.], seq 5024:5252, ack 1, win 501, options [nop,nop,TS val 1836000270 ecr 488179854], length 228
20:32:44.324588 IP 155.138.140.26.vultr.com.ssh > 2.146.158.104.in-addr.arpa.53986: Flags [P.], seq 5252:5288, ack 1, win 501, options [nop,nop,TS val 1836000270 ecr 488179854], length 36
20:32:44.324617 IP 155.138.140.26.vultr.com.ssh > 2.146.158.104.in-addr.arpa.53986: Flags [P.], seq 5288:5516, ack 1, win 501, options [nop,nop,TS val 1836000270 ecr 488179854], length 228
20:32:44.324639 IP 155.138.140.26.vultr.com.ssh > 2.146.158.104.in-addr.arpa.53986: Flags [P.], seq 5516:5552, ack 1, win 501, options [nop,nop,TS val 1836000270 ecr 488179854], length 36
20:32:44.324667 IP 155.138.140.26.vultr.com.ssh > 2.146.158.104.in-addr.arpa.53986: Flags [P.], seq 5552:5780, ack 1, win 501, options [nop,nop,TS val 1836000270 ecr 488179854], length 228
20:32:44.324693 IP 155.138.140.26.vultr.com.ssh > 2.146.158.104.in-addr.arpa.53986: Flags [P.], seq 5780:5816, ack 1, win 501, options [nop,nop,TS val 1836000270 ecr 488179854], length 36
20:32:44.324722 IP 155.138.140.26.vultr.com.ssh > 2.146.158.104.in-addr.arpa.53986: Flags [P.], seq 5816:6044, ack 1, win 501, options [nop,nop,TS val 1836000270 ecr 488179854], length 228
20:32:44.324744 IP 155.138.140.26.vultr.com.ssh > 2.146.158.104.in-addr.arpa.53986: Flags [P.], seq 6044:6080, ack 1, win 501, options [nop,nop,TS val 1836000270 ecr 488179854], length 36
20:32:44.324790 IP 155.138.140.26.vultr.com.ssh > 2.146.158.104.in-addr.arpa.53986: Flags [P.], seq 6080:6308, ack 1, win 501, options [nop,nop,TS val 1836000270 ecr 488179854], length 228
20:32:44.324816 IP 155.138.140.26.vultr.com.ssh > 2.146.158.104.in-addr.arpa.53986: Flags [P.], seq 6308:6344, ack 1, win 501, options [nop,nop,TS val 1836000270 ecr 488179854], length 36
20:32:44.324847 IP 155.138.140.26.vultr.com.ssh > 2.146.158.104.in-addr.arpa.53986: Flags [P.], seq 6344:6572, ack 1, win 501, options [nop,nop,TS val 1836000270 ecr 488179854], length 228
20:32:44.324868 IP 155.138.140.26.vultr.com.ssh > 2.146.158.104.in-addr.arpa.53986: Flags [P.], seq 6572:6608, ack 1, win 501, options [nop,nop,TS val 1836000270 ecr 488179854], length 36
20:32:44.324901 IP 155.138.140.26.vultr.com.ssh > 2.146.158.104.in-addr.arpa.53986: Flags [P.], seq 6608:6836, ack 1, win 501, options [nop,nop,TS val 1836000270 ecr 488179854], length 228
20:32:44.324921 IP 155.138.140.26.vultr.com.ssh > 2.146.158.104.in-addr.arpa.53986: Flags [P.], seq 6836:6872, ack 1, win 501, options [nop,nop,TS val 1836000270 ecr 488179854], length 36
20:32:44.324952 IP 155.138.140.26.vultr.com.ssh > 2.146.158.104.in-addr.arpa.53986: Flags [P.], seq 6872:7100, ack 1, win 501, options [nop,nop,TS val 1836000270 ecr 488179854], length 228
20:32:44.324972 IP 155.138.140.26.vultr.com.ssh > 2.146.158.104.in-addr.arpa.53986: Flags [P.], seq 7100:7136, ack 1, win 501, options [nop,nop,TS val 1836000270 ecr 488179854], length 36
20:32:44.325001 IP 155.138.140.26.vultr.com.ssh > 2.146.158.104.in-addr.arpa.53986: Flags [P.], seq 7136:7364, ack 1, win 501, options [nop,nop,TS val 1836000270 ecr 488179854], length 228
20:32:44.325025 IP 155.138.140.26.vultr.com.ssh > 2.146.158.104.in-addr.arpa.53986: Flags [P.], seq 7364:7400, ack 1, win 501, options [nop,nop,TS val 1836000270 ecr 488179854], length 36
20:32:44.325053 IP 155.138.140.26.vultr.com.ssh > 2.146.158.104.in-addr.arpa.53986: Flags [P.], seq 7400:7628, ack 1, win 501, options [nop,nop,TS val 1836000270 ecr 488179854], length 228
20:32:44.325093 IP 155.138.140.26.vultr.com.ssh > 2.146.158.104.in-addr.arpa.53986: Flags [P.], seq 7628:7664, ack 1, win 501, options [nop,nop,TS val 1836000270 ecr 488179854], length 36
20:32:44.325125 IP 155.138.140.26.vultr.com.ssh > 2.146.158.104.in-addr.arpa.53986: Flags [P.], seq 7664:7892, ack 1, win 501, options [nop,nop,TS val 1836000270 ecr 488179854], length 228
20:32:44.325144 IP 155.138.140.26.vultr.com.ssh > 2.146.158.104.in-addr.arpa.53986: Flags [P.], seq 7892:7928, ack 1, win 501, options [nop,nop,TS val 1836000270 ecr 488179854], length 36
20:32:44.325178 IP 155.138.140.26.vultr.com.ssh > 2.146.158.104.in-addr.arpa.53986: Flags [P.], seq 7928:8156, ack 1, win 501, options [nop,nop,TS val 1836000270 ecr 488179854], length 228
20:32:44.325197 IP 155.138.140.26.vultr.com.ssh > 2.146.158.104.in-addr.arpa.53986: Flags [P.], seq 8156:8192, ack 1, win 501, options [nop,nop,TS val 1836000270 ecr 488179854], length 36
20:32:44.325223 IP 155.138.140.26.vultr.com.ssh > 2.146.158.104.in-addr.arpa.53986: Flags [P.], seq 8192:8420, ack 1, win 501, options [nop,nop,TS val 1836000270 ecr 488179854], length 228
20:32:44.325248 IP 155.138.140.26.vultr.com.ssh > 2.146.158.104.in-addr.arpa.53986: Flags [P.], seq 8420:8456, ack 1, win 501, options [nop,nop,TS val 1836000270 ecr 488179854], length 36
20:32:44.325277 IP 155.138.140.26.vultr.com.ssh > 2.146.158.104.in-addr.arpa.53986: Flags [P.], seq 8456:8684, ack 1, win 501, options [nop,nop,TS val 1836000270 ecr 488179854], length 228
20:32:44.325330 IP 155.138.140.26.vultr.com.ssh > 2.146.158.104.in-addr.arpa.53986: Flags [P.], seq 8720:8948, ack 1, win 501, options [nop,nop,TS val 1836000270 ecr 488179854], length 228
20:32:44.325378 IP 155.138.140.26.vultr.com.ssh > 2.146.158.104.in-addr.arpa.53986: Flags [P.], seq 8984:9212, ack 1, win 501, options [nop,nop,TS val 1836000270 ecr 488179854], length 228
20:32:44.325429 IP 155.138.140.26.vultr.com.ssh > 2.146.158.104.in-addr.arpa.53986: Flags [P.], seq 9248:9476, ack 1, win 501, options [nop,nop,TS val 1836000270 ecr 488179854], length 228
20:32:44.325481 IP 155.138.140.26.vultr.com.ssh > 2.146.158.104.in-addr.arpa.53986: Flags [P.], seq 9512:9740, ack 1, win 501, options [nop,nop,TS val 1836000270 ecr 488179854], length 228
20:32:44.325534 IP 155.138.140.26.vultr.com.ssh > 2.146.158.104.in-addr.arpa.53986: Flags [P.], seq 9776:10004, ack 1, win 501, options [nop,nop,TS val 1836000271 ecr 488179854], length 228
20:32:44.325585 IP 155.138.140.26.vultr.com.ssh > 2.146.158.104.in-addr.arpa.53986: Flags [P.], seq 10040:10268, ack 1, win 501, options [nop,nop,TS val 1836000271 ecr 488179854], length 228
20:32:44.325632 IP 155.138.140.26.vultr.com.ssh > 2.146.158.104.in-addr.arpa.53986: Flags [P.], seq 10304:10532, ack 1, win 501, options [nop,nop,TS val 1836000271 ecr 488179854], length 228
20:32:44.325684 IP 155.138.140.26.vultr.com.ssh > 2.146.158.104.in-addr.arpa.53986: Flags [P.], seq 10568:10796, ack 1, win 501, options [nop,nop,TS val 1836000271 ecr 488179854], length 228
20:32:44.325735 IP 155.138.140.26.vultr.com.ssh > 2.146.158.104.in-addr.arpa.53986: Flags [P.], seq 10832:11060, ack 1, win 501, options [nop,nop,TS val 1836000271 ecr 488179854], length 228
20:32:44.325784 IP 155.138.140.26.vultr.com.ssh > 2.146.158.104.in-addr.arpa.53986: Flags [P.], seq 11096:11324, ack 1, win 501, options [nop,nop,TS val 1836000271 ecr 488179854], length 228
20:32:44.325840 IP 155.138.140.26.vultr.com.ssh > 2.146.158.104.in-addr.arpa.53986: Flags [P.], seq 11360:11588, ack 1, win 501, options [nop,nop,TS val 1836000271 ecr 488179854], length 228
20:32:44.325896 IP 155.138.140.26.vultr.com.ssh > 2.146.158.104.in-addr.arpa.53986: Flags [P.], seq 11624:11852, ack 1, win 501, options [nop,nop,TS val 1836000271 ecr 488179854], length 228
20:32:44.325970 IP 155.138.140.26.vultr.com.ssh > 2.146.158.104.in-addr.arpa.53986: Flags [P.], seq 11888:12116, ack 1, win 501, options [nop,nop,TS val 1836000271 ecr 488179854], length 228
20:32:44.326020 IP 155.138.140.26.vultr.com.ssh > 2.146.158.104.in-addr.arpa.53986: Flags [P.], seq 12152:12380, ack 1, win 501, options [nop,nop,TS val 1836000271 ecr 488179854], length 228
20:32:44.326072 IP 155.138.140.26.vultr.com.ssh > 2.146.158.104.in-addr.arpa.53986: Flags [P.], seq 12416:12644, ack 1, win 501, options [nop,nop,TS val 1836000271 ecr 488179854], length 228
20:32:44.326117 IP 155.138.140.26.vultr.com.ssh > 2.146.158.104.in-addr.arpa.53986: Flags [P.], seq 12680:12908, ack 1, win 501, options [nop,nop,TS val 1836000271 ecr 488179854], length 228
20:32:44.326165 IP 155.138.140.26.vultr.com.ssh > 2.146.158.104.in-addr.arpa.53986: Flags [P.], seq 12944:13172, ack 1, win 501, options [nop,nop,TS val 1836000271 ecr 488179854], length 228
20:32:44.326218 IP 155.138.140.26.vultr.com.ssh > 2.146.158.104.in-addr.arpa.53986: Flags [P.], seq 13208:13436, ack 1, win 501, options [nop,nop,TS val 1836000271 ecr 488179854], length 228
20:32:44.326281 IP 155.138.140.26.vultr.com.ssh > 2.146.158.104.in-addr.arpa.53986: Flags [P.], seq 13472:13700, ack 1, win 501, options [nop,nop,TS val 1836000271 ecr 488179854], length 228
20:32:44.326346 IP 155.138.140.26.vultr.com.ssh > 2.146.158.104.in-addr.arpa.53986: Flags [P.], seq 13736:13964, ack 1, win 501, options [nop,nop,TS val 1836000271 ecr 488179854], length 228
20:32:44.326412 IP 155.138.140.26.vultr.com.ssh > 2.146.158.104.in-addr.arpa.53986: Flags [P.], seq 14000:14228, ack 1, win 501, options [nop,nop,TS val 1836000271 ecr 488179854], length 228
20:32:44.326473 IP 155.138.140.26.vultr.com.ssh > 2.146.158.104.in-addr.arpa.53986: Flags [P.], seq 14264:14492, ack 1, win 501, options [nop,nop,TS val 1836000271 ecr 488179854], length 228
20:32:44.326531 IP 155.138.140.26.vultr.com.ssh > 2.146.158.104.in-addr.arpa.53986: Flags [P.], seq 14528:14756, ack 1, win 501, options [nop,nop,TS val 1836000272 ecr 488179854], length 228
20:32:44.326580 IP 155.138.140.26.vultr.com.ssh > 2.146.158.104.in-addr.arpa.53986: Flags [P.], seq 14792:15020, ack 1, win 501, options [nop,nop,TS val 1836000272 ecr 488179854], length 228
20:32:44.326629 IP 155.138.140.26.vultr.com.ssh > 2.146.158.104.in-addr.arpa.53986: Flags [P.], seq 15056:15284, ack 1, win 501, options [nop,nop,TS val 1836000272 ecr 488179854], length 228
20:32:44.326683 IP 155.138.140.26.vultr.com.ssh > 2.146.158.104.in-addr.arpa.53986: Flags [P.], seq 15320:15548, ack 1, win 501, options [nop,nop,TS val 1836000272 ecr 488179854], length 228
20:32:44.326736 IP 155.138.140.26.vultr.com.ssh > 2.146.158.104.in-addr.arpa.53986: Flags [P.], seq 15584:15812, ack 1, win 501, options [nop,nop,TS val 1836000272 ecr 488179854], length 228
20:32:44.326786 IP 155.138.140.26.vultr.com.ssh > 2.146.158.104.in-addr.arpa.53986: Flags [P.], seq 15848:16076, ack 1, win 501, options [nop,nop,TS val 1836000272 ecr 488179854], length 228
20:32:44.326836 IP 155.138.140.26.vultr.com.ssh > 2.146.158.104.in-addr.arpa.53986: Flags [P.], seq 16112:16340, ack 1, win 501, options [nop,nop,TS val 1836000272 ecr 488179854], length 228
20:32:44.326892 IP 155.138.140.26.vultr.com.ssh > 2.146.158.104.in-addr.arpa.53986: Flags [P.], seq 16376:16604, ack 1, win 501, options [nop,nop,TS val 1836000272 ecr 488179854], length 228
20:32:44.326946 IP 155.138.140.26.vultr.com.ssh > 2.146.158.104.in-addr.arpa.53986: Flags [P.], seq 16640:16868, ack 1, win 501, options [nop,nop,TS val 1836000272 ecr 488179854], length 228
20:32:44.327001 IP 155.138.140.26.vultr.com.ssh > 2.146.158.104.in-addr.arpa.53986: Flags [P.], seq 16904:17132, ack 1, win 501, options [nop,nop,TS val 1836000272 ecr 488179854], length 228
20:32:44.327066 IP 155.138.140.26.vultr.com.ssh > 2.146.158.104.in-addr.arpa.53986: Flags [P.], seq 17168:17396, ack 1, win 501, options [nop,nop,TS val 1836000272 ecr 488179854], length 228
20:32:44.327114 IP 155.138.140.26.vultr.com.ssh > 2.146.158.104.in-addr.arpa.53986: Flags [P.], seq 17432:17660, ack 1, win 501, options [nop,nop,TS val 1836000272 ecr 488179854], length 228
20:32:44.327168 IP 155.138.140.26.vultr.com.ssh > 2.146.158.104.in-addr.arpa.53986: Flags [P.], seq 17696:17924, ack 1, win 501, options [nop,nop,TS val 1836000272 ecr 488179854], length 228
20:32:44.327215 IP 155.138.140.26.vultr.com.ssh > 2.146.158.104.in-addr.arpa.53986: Flags [P.], seq 17960:18188, ack 1, win 501, options [nop,nop,TS val 1836000272 ecr 488179854], length 228
20:32:44.327268 IP 155.138.140.26.vultr.com.ssh > 2.146.158.104.in-addr.arpa.53986: Flags [P.], seq 18224:18452, ack 1, win 501, options [nop,nop,TS val 1836000272 ecr 488179854], length 228
20:32:44.327322 IP 155.138.140.26.vultr.com.ssh > 2.146.158.104.in-addr.arpa.53986: Flags [P.], seq 18488:18716, ack 1, win 501, options [nop,nop,TS val 1836000272 ecr 488179854], length 228
20:32:44.327372 IP 155.138.140.26.vultr.com.ssh > 2.146.158.104.in-addr.arpa.53986: Flags [P.], seq 18752:18980, ack 1, win 501, options [nop,nop,TS val 1836000272 ecr 488179854], length 228
20:32:44.327423 IP 155.138.140.26.vultr.com.ssh > 2.146.158.104.in-addr.arpa.53986: Flags [P.], seq 19016:19244, ack 1, win 501, options [nop,nop,TS val 1836000272 ecr 488179854], length 228
20:32:44.327477 IP 155.138.140.26.vultr.com.ssh > 2.146.158.104.in-addr.arpa.53986: Flags [P.], seq 19280:19508, ack 1, win 501, options [nop,nop,TS val 1836000272 ecr 488179854], length 228
20:32:44.327531 IP 155.138.140.26.vultr.com.ssh > 2.146.158.104.in-addr.arpa.53986: Flags [P.], seq 19544:19772, ack 1, win 501, options [nop,nop,TS val 1836000273 ecr 488179854], length 228
20:32:44.327585 IP 155.138.140.26.vultr.com.ssh > 2.146.158.104.in-addr.arpa.53986: Flags [P.], seq 19808:20036, ack 1, win 501, options [nop,nop,TS val 1836000273 ecr 488179854], length 228
20:32:44.327635 IP 155.138.140.26.vultr.com.ssh > 2.146.158.104.in-addr.arpa.53986: Flags [P.], seq 20072:20300, ack 1, win 501, options [nop,nop,TS val 1836000273 ecr 488179854], length 228
20:32:44.327688 IP 155.138.140.26.vultr.com.ssh > 2.146.158.104.in-addr.arpa.53986: Flags [P.], seq 20336:20564, ack 1, win 501, options [nop,nop,TS val 1836000273 ecr 488179854], length 228
20:32:44.327740 IP 155.138.140.26.vultr.com.ssh > 2.146.158.104.in-addr.arpa.53986: Flags [P.], seq 20600:20828, ack 1, win 501, options [nop,nop,TS val 1836000273 ecr 488179854], length 228
20:32:44.327788 IP 155.138.140.26.vultr.com.ssh > 2.146.158.104.in-addr.arpa.53986: Flags [P.], seq 20864:21092, ack 1, win 501, options [nop,nop,TS val 1836000273 ecr 488179854], length 228
20:32:44.327840 IP 155.138.140.26.vultr.com.ssh > 2.146.158.104.in-addr.arpa.53986: Flags [P.], seq 21128:21356, ack 1, win 501, options [nop,nop,TS val 1836000273 ecr 488179854], length 228
20:32:44.327894 IP 155.138.140.26.vultr.com.ssh > 2.146.158.104.in-addr.arpa.53986: Flags [P.], seq 21392:21620, ack 1, win 501, options [nop,nop,TS val 1836000273 ecr 488179854], length 228
20:32:44.327943 IP 155.138.140.26.vultr.com.ssh > 2.146.158.104.in-addr.arpa.53986: Flags [P.], seq 21656:21884, ack 1, win 501, options [nop,nop,TS val 1836000273 ecr 488179854], length 228
20:32:44.327996 IP 155.138.140.26.vultr.com.ssh > 2.146.158.104.in-addr.arpa.53986: Flags [P.], seq 21920:22148, ack 1, win 501, options [nop,nop,TS val 1836000273 ecr 488179854], length 228
20:32:44.328051 IP 155.138.140.26.vultr.com.ssh > 2.146.158.104.in-addr.arpa.53986: Flags [P.], seq 22184:22412, ack 1, win 501, options [nop,nop,TS val 1836000273 ecr 488179854], length 228
20:32:44.328103 IP 155.138.140.26.vultr.com.ssh > 2.146.158.104.in-addr.arpa.53986: Flags [P.], seq 22448:22676, ack 1, win 501, options [nop,nop,TS val 1836000273 ecr 488179854], length 228
20:32:44.328154 IP 155.138.140.26.vultr.com.ssh > 2.146.158.104.in-addr.arpa.53986: Flags [P.], seq 22712:22940, ack 1, win 501, options [nop,nop,TS val 1836000273 ecr 488179854], length 228
20:32:44.328206 IP 155.138.140.26.vultr.com.ssh > 2.146.158.104.in-addr.arpa.53986: Flags [P.], seq 22976:23204, ack 1, win 501, options [nop,nop,TS val 1836000273 ecr 488179854], length 228
20:32:44.328259 IP 155.138.140.26.vultr.com.ssh > 2.146.158.104.in-addr.arpa.53986: Flags [P.], seq 23240:23468, ack 1, win 501, options [nop,nop,TS val 1836000273 ecr 488179854], length 228
20:32:44.328309 IP 155.138.140.26.vultr.com.ssh > 2.146.158.104.in-addr.arpa.53986: Flags [P.], seq 23504:23732, ack 1, win 501, options [nop,nop,TS val 1836000273 ecr 488179854], length 228
20:32:44.328358 IP 155.138.140.26.vultr.com.ssh > 2.146.158.104.in-addr.arpa.53986: Flags [P.], seq 23768:23996, ack 1, win 501, options [nop,nop,TS val 1836000273 ecr 488179854], length 228
20:32:44.328411 IP 155.138.140.26.vultr.com.ssh > 2.146.158.104.in-addr.arpa.53986: Flags [P.], seq 24032:24260, ack 1, win 501, options [nop,nop,TS val 1836000273 ecr 488179854], length 228
20:32:44.328461 IP 155.138.140.26.vultr.com.ssh > 2.146.158.104.in-addr.arpa.53986: Flags [P.], seq 24296:24524, ack 1, win 501, options [nop,nop,TS val 1836000273 ecr 488179854], length 228
20:32:44.328512 IP 155.138.140.26.vultr.com.ssh > 2.146.158.104.in-addr.arpa.53986: Flags [P.], seq 24560:24788, ack 1, win 501, options [nop,nop,TS val 1836000274 ecr 488179854], length 228
20:32:44.328564 IP 155.138.140.26.vultr.com.ssh > 2.146.158.104.in-addr.arpa.53986: Flags [P.], seq 24824:25052, ack 1, win 501, options [nop,nop,TS val 1836000274 ecr 488179854], length 228
20:32:44.328611 IP 155.138.140.26.vultr.com.ssh > 2.146.158.104.in-addr.arpa.53986: Flags [P.], seq 25088:25316, ack 1, win 501, options [nop,nop,TS val 1836000274 ecr 488179854], length 228
20:32:44.328659 IP 155.138.140.26.vultr.com.ssh > 2.146.158.104.in-addr.arpa.53986: Flags [P.], seq 25352:25580, ack 1, win 501, options [nop,nop,TS val 1836000274 ecr 488179854], length 228
20:32:44.328712 IP 155.138.140.26.vultr.com.ssh > 2.146.158.104.in-addr.arpa.53986: Flags [P.], seq 25616:25844, ack 1, win 501, options [nop,nop,TS val 1836000274 ecr 488179854], length 228
20:32:44.328781 IP 155.138.140.26.vultr.com.ssh > 2.146.158.104.in-addr.arpa.53986: Flags [P.], seq 25880:26108, ack 1, win 501, options [nop,nop,TS val 1836000274 ecr 488179854], length 228
20:32:44.328844 IP 155.138.140.26.vultr.com.ssh > 2.146.158.104.in-addr.arpa.53986: Flags [P.], seq 26144:26372, ack 1, win 501, options [nop,nop,TS val 1836000274 ecr 488179854], length 228
20:32:44.328895 IP 155.138.140.26.vultr.com.ssh > 2.146.158.104.in-addr.arpa.53986: Flags [P.], seq 26408:26636, ack 1, win 501, options [nop,nop,TS val 1836000274 ecr 488179854], length 228
20:32:44.328945 IP 155.138.140.26.vultr.com.ssh > 2.146.158.104.in-addr.arpa.53986: Flags [P.], seq 26636:27248, ack 1, win 501, options [nop,nop,TS val 1836000274 ecr 488179854], length 612
20:32:44.328992 IP 155.138.140.26.vultr.com.ssh > 2.146.158.104.in-addr.arpa.53986: Flags [P.], seq 27248:28052, ack 1, win 501, options [nop,nop,TS val 1836000274 ecr 488179854], length 804
20:32:44.329037 IP 155.138.140.26.vultr.com.ssh > 2.146.158.104.in-addr.arpa.53986: Flags [P.], seq 28052:28856, ack 1, win 501, options [nop,nop,TS val 1836000274 ecr 488179854], length 804
20:32:44.329194 IP 155.138.140.26.vultr.com.ssh > 2.146.158.104.in-addr.arpa.53986: Flags [P.], seq 28856:30428, ack 1, win 501, options [nop,nop,TS val 1836000274 ecr 488179854], length 1572
20:32:44.329262 IP 155.138.140.26.vultr.com.ssh > 2.146.158.104.in-addr.arpa.53986: Flags [P.], seq 30428:31808, ack 1, win 501, options [nop,nop,TS val 1836000274 ecr 488179854], length 1380
20:32:44.329327 IP 155.138.140.26.vultr.com.ssh > 2.146.158.104.in-addr.arpa.53986: Flags [P.], seq 31808:32996, ack 1, win 501, options [nop,nop,TS val 1836000274 ecr 488179854], length 1188
20:32:44.329390 IP 155.138.140.26.vultr.com.ssh > 2.146.158.104.in-addr.arpa.53986: Flags [P.], seq 32996:34000, ack 1, win 501, options [nop,nop,TS val 1836000274 ecr 488179854], length 1004
20:32:44.329430 IP 155.138.140.26.vultr.com.ssh > 2.146.158.104.in-addr.arpa.53986: Flags [P.], seq 34000:34228, ack 1, win 501, options [nop,nop,TS val 1836000274 ecr 488179854], length 228
20:32:44.329466 IP 155.138.140.26.vultr.com.ssh > 2.146.158.104.in-addr.arpa.53986: Flags [P.], seq 34228:34456, ack 1, win 501, options [nop,nop,TS val 1836000274 ecr 488179854], length 228
20:32:44.329499 IP 155.138.140.26.vultr.com.ssh > 2.146.158.104.in-addr.arpa.53986: Flags [P.], seq 34456:34684, ack 1, win 501, options [nop,nop,TS val 1836000275 ecr 488179854], length 228
20:32:44.329538 IP 155.138.140.26.vultr.com.ssh > 2.146.158.104.in-addr.arpa.53986: Flags [P.], seq 34684:34912, ack 1, win 501, options [nop,nop,TS val 1836000275 ecr 488179854], length 228
20:32:44.329571 IP 155.138.140.26.vultr.com.ssh > 2.146.158.104.in-addr.arpa.53986: Flags [P.], seq 34912:35140, ack 1, win 501, options [nop,nop,TS val 1836000275 ecr 488179854], length 228
20:32:44.329607 IP 155.138.140.26.vultr.com.ssh > 2.146.158.104.in-addr.arpa.53986: Flags [P.], seq 35140:35368, ack 1, win 501, options [nop,nop,TS val 1836000275 ecr 488179854], length 228
20:32:44.329650 IP 155.138.140.26.vultr.com.ssh > 2.146.158.104.in-addr.arpa.53986: Flags [P.], seq 35368:35596, ack 1, win 501, options [nop,nop,TS val 1836000275 ecr 488179854], length 228
20:32:44.329683 IP 155.138.140.26.vultr.com.ssh > 2.146.158.104.in-addr.arpa.53986: Flags [P.], seq 35596:35824, ack 1, win 501, options [nop,nop,TS val 1836000275 ecr 488179854], length 228
20:32:44.329721 IP 155.138.140.26.vultr.com.ssh > 2.146.158.104.in-addr.arpa.53986: Flags [P.], seq 35824:36052, ack 1, win 501, options [nop,nop,TS val 1836000275 ecr 488179854], length 228
20:32:44.329756 IP 155.138.140.26.vultr.com.ssh > 2.146.158.104.in-addr.arpa.53986: Flags [P.], seq 36052:36280, ack 1, win 501, options [nop,nop,TS val 1836000275 ecr 488179854], length 228
20:32:44.329787 IP 155.138.140.26.vultr.com.ssh > 2.146.158.104.in-addr.arpa.53986: Flags [P.], seq 36280:36508, ack 1, win 501, options [nop,nop,TS val 1836000275 ecr 488179854], length 228
20:32:44.329823 IP 155.138.140.26.vultr.com.ssh > 2.146.158.104.in-addr.arpa.53986: Flags [P.], seq 36508:36736, ack 1, win 501, options [nop,nop,TS val 1836000275 ecr 488179854], length 228
20:32:44.329856 IP 155.138.140.26.vultr.com.ssh > 2.146.158.104.in-addr.arpa.53986: Flags [P.], seq 36736:36964, ack 1, win 501, options [nop,nop,TS val 1836000275 ecr 488179854], length 228
20:32:44.329890 IP 155.138.140.26.vultr.com.ssh > 2.146.158.104.in-addr.arpa.53986: Flags [P.], seq 36964:37192, ack 1, win 501, options [nop,nop,TS val 1836000275 ecr 488179854], length 228
20:32:44.329922 IP 155.138.140.26.vultr.com.ssh > 2.146.158.104.in-addr.arpa.53986: Flags [P.], seq 37192:37420, ack 1, win 501, options [nop,nop,TS val 1836000275 ecr 488179854], length 228
20:32:44.329954 IP 155.138.140.26.vultr.com.ssh > 2.146.158.104.in-addr.arpa.53986: Flags [P.], seq 37420:37648, ack 1, win 501, options [nop,nop,TS val 1836000275 ecr 488179854], length 228
20:32:44.329988 IP 155.138.140.26.vultr.com.ssh > 2.146.158.104.in-addr.arpa.53986: Flags [P.], seq 37648:37876, ack 1, win 501, options [nop,nop,TS val 1836000275 ecr 488179854], length 228
20:32:44.330024 IP 155.138.140.26.vultr.com.ssh > 2.146.158.104.in-addr.arpa.53986: Flags [P.], seq 37876:38104, ack 1, win 501, options [nop,nop,TS val 1836000275 ecr 488179854], length 228
20:32:44.330059 IP 155.138.140.26.vultr.com.ssh > 2.146.158.104.in-addr.arpa.53986: Flags [P.], seq 38104:38332, ack 1, win 501, options [nop,nop,TS val 1836000275 ecr 488179854], length 228
20:32:44.330096 IP 155.138.140.26.vultr.com.ssh > 2.146.158.104.in-addr.arpa.53986: Flags [P.], seq 38332:38560, ack 1, win 501, options [nop,nop,TS val 1836000275 ecr 488179854], length 228
20:32:44.330130 IP 155.138.140.26.vultr.com.ssh > 2.146.158.104.in-addr.arpa.53986: Flags [P.], seq 38560:38788, ack 1, win 501, options [nop,nop,TS val 1836000275 ecr 488179854], length 228
20:32:44.330163 IP 155.138.140.26.vultr.com.ssh > 2.146.158.104.in-addr.arpa.53986: Flags [P.], seq 38788:39016, ack 1, win 501, options [nop,nop,TS val 1836000275 ecr 488179854], length 228
20:32:44.330196 IP 155.138.140.26.vultr.com.ssh > 2.146.158.104.in-addr.arpa.53986: Flags [P.], seq 39016:39244, ack 1, win 501, options [nop,nop,TS val 1836000275 ecr 488179854], length 228
20:32:44.330234 IP 155.138.140.26.vultr.com.ssh > 2.146.158.104.in-addr.arpa.53986: Flags [P.], seq 39244:39472, ack 1, win 501, options [nop,nop,TS val 1836000275 ecr 488179854], length 228
20:32:44.330268 IP 155.138.140.26.vultr.com.ssh > 2.146.158.104.in-addr.arpa.53986: Flags [P.], seq 39472:39700, ack 1, win 501, options [nop,nop,TS val 1836000275 ecr 488179854], length 228
20:32:44.330301 IP 155.138.140.26.vultr.com.ssh > 2.146.158.104.in-addr.arpa.53986: Flags [P.], seq 39700:39928, ack 1, win 501, options [nop,nop,TS val 1836000275 ecr 488179854], length 228
20:32:44.330337 IP 155.138.140.26.vultr.com.ssh > 2.146.158.104.in-addr.arpa.53986: Flags [P.], seq 39928:40156, ack 1, win 501, options [nop,nop,TS val 1836000275 ecr 488179854], length 228
20:32:44.330371 IP 155.138.140.26.vultr.com.ssh > 2.146.158.104.in-addr.arpa.53986: Flags [P.], seq 40156:40384, ack 1, win 501, options [nop,nop,TS val 1836000275 ecr 488179854], length 228
20:32:44.330403 IP 155.138.140.26.vultr.com.ssh > 2.146.158.104.in-addr.arpa.53986: Flags [P.], seq 40384:40612, ack 1, win 501, options [nop,nop,TS val 1836000275 ecr 488179854], length 228
20:32:44.330437 IP 155.138.140.26.vultr.com.ssh > 2.146.158.104.in-addr.arpa.53986: Flags [P.], seq 40612:40840, ack 1, win 501, options [nop,nop,TS val 1836000275 ecr 488179854], length 228
20:32:44.330470 IP 155.138.140.26.vultr.com.ssh > 2.146.158.104.in-addr.arpa.53986: Flags [P.], seq 40840:41068, ack 1, win 501, options [nop,nop,TS val 1836000275 ecr 488179854], length 228
20:32:44.330502 IP 155.138.140.26.vultr.com.ssh > 2.146.158.104.in-addr.arpa.53986: Flags [P.], seq 41068:41296, ack 1, win 501, options [nop,nop,TS val 1836000276 ecr 488179854], length 228
20:32:44.330534 IP 155.138.140.26.vultr.com.ssh > 2.146.158.104.in-addr.arpa.53986: Flags [P.], seq 41296:41524, ack 1, win 501, options [nop,nop,TS val 1836000276 ecr 488179854], length 228
20:32:44.330572 IP 155.138.140.26.vultr.com.ssh > 2.146.158.104.in-addr.arpa.53986: Flags [P.], seq 41524:41752, ack 1, win 501, options [nop,nop,TS val 1836000276 ecr 488179854], length 228
20:32:44.330604 IP 155.138.140.26.vultr.com.ssh > 2.146.158.104.in-addr.arpa.53986: Flags [P.], seq 41752:41980, ack 1, win 501, options [nop,nop,TS val 1836000276 ecr 488179854], length 228
20:32:44.330636 IP 155.138.140.26.vultr.com.ssh > 2.146.158.104.in-addr.arpa.53986: Flags [P.], seq 41980:42208, ack 1, win 501, options [nop,nop,TS val 1836000276 ecr 488179854], length 228
20:32:44.330674 IP 155.138.140.26.vultr.com.ssh > 2.146.158.104.in-addr.arpa.53986: Flags [P.], seq 42208:42436, ack 1, win 501, options [nop,nop,TS val 1836000276 ecr 488179854], length 228
20:32:44.330708 IP 155.138.140.26.vultr.com.ssh > 2.146.158.104.in-addr.arpa.53986: Flags [P.], seq 42436:42664, ack 1, win 501, options [nop,nop,TS val 1836000276 ecr 488179854], length 228
20:32:44.330740 IP 155.138.140.26.vultr.com.ssh > 2.146.158.104.in-addr.arpa.53986: Flags [P.], seq 42664:42892, ack 1, win 501, options [nop,nop,TS val 1836000276 ecr 488179854], length 228
20:32:44.330776 IP 155.138.140.26.vultr.com.ssh > 2.146.158.104.in-addr.arpa.53986: Flags [P.], seq 42892:43120, ack 1, win 501, options [nop,nop,TS val 1836000276 ecr 488179854], length 228
20:32:44.330811 IP 155.138.140.26.vultr.com.ssh > 2.146.158.104.in-addr.arpa.53986: Flags [P.], seq 43120:43348, ack 1, win 501, options [nop,nop,TS val 1836000276 ecr 488179854], length 228
20:32:44.330843 IP 155.138.140.26.vultr.com.ssh > 2.146.158.104.in-addr.arpa.53986: Flags [P.], seq 43348:43576, ack 1, win 501, options [nop,nop,TS val 1836000276 ecr 488179854], length 228
20:32:44.330874 IP 155.138.140.26.vultr.com.ssh > 2.146.158.104.in-addr.arpa.53986: Flags [P.], seq 43576:43804, ack 1, win 501, options [nop,nop,TS val 1836000276 ecr 488179854], length 228
20:32:44.330906 IP 155.138.140.26.vultr.com.ssh > 2.146.158.104.in-addr.arpa.53986: Flags [P.], seq 43804:44032, ack 1, win 501, options [nop,nop,TS val 1836000276 ecr 488179854], length 228
20:32:44.330937 IP 155.138.140.26.vultr.com.ssh > 2.146.158.104.in-addr.arpa.53986: Flags [P.], seq 44032:44260, ack 1, win 501, options [nop,nop,TS val 1836000276 ecr 488179854], length 228
20:32:44.330969 IP 155.138.140.26.vultr.com.ssh > 2.146.158.104.in-addr.arpa.53986: Flags [P.], seq 44260:44488, ack 1, win 501, options [nop,nop,TS val 1836000276 ecr 488179854], length 228
20:32:44.331006 IP 155.138.140.26.vultr.com.ssh > 2.146.158.104.in-addr.arpa.53986: Flags [P.], seq 44488:44716, ack 1, win 501, options [nop,nop,TS val 1836000276 ecr 488179854], length 228
20:32:44.331039 IP 155.138.140.26.vultr.com.ssh > 2.146.158.104.in-addr.arpa.53986: Flags [P.], seq 44716:44944, ack 1, win 501, options [nop,nop,TS val 1836000276 ecr 488179854], length 228
20:32:44.331072 IP 155.138.140.26.vultr.com.ssh > 2.146.158.104.in-addr.arpa.53986: Flags [P.], seq 44944:45172, ack 1, win 501, options [nop,nop,TS val 1836000276 ecr 488179854], length 228
20:32:44.331109 IP 155.138.140.26.vultr.com.ssh > 2.146.158.104.in-addr.arpa.53986: Flags [P.], seq 45172:45400, ack 1, win 501, options [nop,nop,TS val 1836000276 ecr 488179854], length 228
20:32:44.331143 IP 155.138.140.26.vultr.com.ssh > 2.146.158.104.in-addr.arpa.53986: Flags [P.], seq 45400:45628, ack 1, win 501, options [nop,nop,TS val 1836000276 ecr 488179854], length 228
20:32:44.331174 IP 155.138.140.26.vultr.com.ssh > 2.146.158.104.in-addr.arpa.53986: Flags [P.], seq 45628:45856, ack 1, win 501, options [nop,nop,TS val 1836000276 ecr 488179854], length 228
20:32:44.331206 IP 155.138.140.26.vultr.com.ssh > 2.146.158.104.in-addr.arpa.53986: Flags [P.], seq 45856:46084, ack 1, win 501, options [nop,nop,TS val 1836000276 ecr 488179854], length 228
20:32:44.331240 IP 155.138.140.26.vultr.com.ssh > 2.146.158.104.in-addr.arpa.53986: Flags [P.], seq 46084:46312, ack 1, win 501, options [nop,nop,TS val 1836000276 ecr 488179854], length 228
20:32:44.331272 IP 155.138.140.26.vultr.com.ssh > 2.146.158.104.in-addr.arpa.53986: Flags [P.], seq 46312:46540, ack 1, win 501, options [nop,nop,TS val 1836000276 ecr 488179854], length 228
20:32:44.331308 IP 155.138.140.26.vultr.com.ssh > 2.146.158.104.in-addr.arpa.53986: Flags [P.], seq 46540:46768, ack 1, win 501, options [nop,nop,TS val 1836000276 ecr 488179854], length 228
20:32:44.331343 IP 155.138.140.26.vultr.com.ssh > 2.146.158.104.in-addr.arpa.53986: Flags [P.], seq 46768:46996, ack 1, win 501, options [nop,nop,TS val 1836000276 ecr 488179854], length 228
20:32:44.331376 IP 155.138.140.26.vultr.com.ssh > 2.146.158.104.in-addr.arpa.53986: Flags [P.], seq 46996:47224, ack 1, win 501, options [nop,nop,TS val 1836000276 ecr 488179854], length 228
20:32:44.331407 IP 155.138.140.26.vultr.com.ssh > 2.146.158.104.in-addr.arpa.53986: Flags [P.], seq 47224:47452, ack 1, win 501, options [nop,nop,TS val 1836000276 ecr 488179854], length 228
20:32:44.331439 IP 155.138.140.26.vultr.com.ssh > 2.146.158.104.in-addr.arpa.53986: Flags [P.], seq 47452:47680, ack 1, win 501, options [nop,nop,TS val 1836000276 ecr 488179854], length 228
20:32:44.331472 IP 155.138.140.26.vultr.com.ssh > 2.146.158.104.in-addr.arpa.53986: Flags [P.], seq 47680:47908, ack 1, win 501, options [nop,nop,TS val 1836000276 ecr 488179854], length 228
20:32:44.331504 IP 155.138.140.26.vultr.com.ssh > 2.146.158.104.in-addr.arpa.53986: Flags [P.], seq 47908:48136, ack 1, win 501, options [nop,nop,TS val 1836000277 ecr 488179854], length 228
20:32:44.331542 IP 155.138.140.26.vultr.com.ssh > 2.146.158.104.in-addr.arpa.53986: Flags [P.], seq 48136:48364, ack 1, win 501, options [nop,nop,TS val 1836000277 ecr 488179854], length 228
20:32:44.331574 IP 155.138.140.26.vultr.com.ssh > 2.146.158.104.in-addr.arpa.53986: Flags [P.], seq 48364:48592, ack 1, win 501, options [nop,nop,TS val 1836000277 ecr 488179854], length 228
20:32:44.331607 IP 155.138.140.26.vultr.com.ssh > 2.146.158.104.in-addr.arpa.53986: Flags [P.], seq 48592:48820, ack 1, win 501, options [nop,nop,TS val 1836000277 ecr 488179854], length 228
20:32:44.331644 IP 155.138.140.26.vultr.com.ssh > 2.146.158.104.in-addr.arpa.53986: Flags [P.], seq 48820:49048, ack 1, win 501, options [nop,nop,TS val 1836000277 ecr 488179854], length 228
20:32:44.331678 IP 155.138.140.26.vultr.com.ssh > 2.146.158.104.in-addr.arpa.53986: Flags [P.], seq 49048:49276, ack 1, win 501, options [nop,nop,TS val 1836000277 ecr 488179854], length 228
20:32:44.331710 IP 155.138.140.26.vultr.com.ssh > 2.146.158.104.in-addr.arpa.53986: Flags [P.], seq 49276:49504, ack 1, win 501, options [nop,nop,TS val 1836000277 ecr 488179854], length 228
20:32:44.331742 IP 155.138.140.26.vultr.com.ssh > 2.146.158.104.in-addr.arpa.53986: Flags [P.], seq 49504:49732, ack 1, win 501, options [nop,nop,TS val 1836000277 ecr 488179854], length 228
20:32:44.331778 IP 155.138.140.26.vultr.com.ssh > 2.146.158.104.in-addr.arpa.53986: Flags [P.], seq 49732:49960, ack 1, win 501, options [nop,nop,TS val 1836000277 ecr 488179854], length 228
20:32:44.331810 IP 155.138.140.26.vultr.com.ssh > 2.146.158.104.in-addr.arpa.53986: Flags [P.], seq 49960:50188, ack 1, win 501, options [nop,nop,TS val 1836000277 ecr 488179854], length 228
