root@comp3134:~# tcpdump -i enp1s0 src 155.138.140.26
tcpdump: verbose output suppressed, use -v or -vv for full protocol decode
listening on enp1s0, link-type EN10MB (Ethernet), capture size 262144 bytes
20:34:28.837791 IP 155.138.140.26.vultr.com.ssh > 2.146.158.104.in-addr.arpa.53986: Flags [P.], seq 3821224157:3821224265, ack 3713459812, win 501, options [nop,nop,TS val 1836104783 ecr 488284367], length 108
20:34:28.837836 IP 155.138.140.26.vultr.com.ssh > 2.146.158.104.in-addr.arpa.53986: Flags [P.], seq 108:260, ack 1, win 501, options [nop,nop,TS val 1836104783 ecr 488284367], length 152
20:34:28.837869 IP 155.138.140.26.vultr.com.ssh > 2.146.158.104.in-addr.arpa.53986: Flags [P.], seq 260:296, ack 1, win 501, options [nop,nop,TS val 1836104783 ecr 488284367], length 36
20:34:28.838382 IP 155.138.140.26.vultr.com.ssh > 2.146.158.104.in-addr.arpa.53986: Flags [P.], seq 296:540, ack 1, win 501, options [nop,nop,TS val 1836104783 ecr 488284367], length 244
20:34:28.838409 IP 155.138.140.26.vultr.com.ssh > 2.146.158.104.in-addr.arpa.53986: Flags [P.], seq 540:576, ack 1, win 501, options [nop,nop,TS val 1836104783 ecr 488284367], length 36
20:34:28.838440 IP 155.138.140.26.vultr.com.ssh > 2.146.158.104.in-addr.arpa.53986: Flags [P.], seq 576:796, ack 1, win 501, options [nop,nop,TS val 1836104783 ecr 488284367], length 220
20:34:28.838463 IP 155.138.140.26.vultr.com.ssh > 2.146.158.104.in-addr.arpa.53986: Flags [P.], seq 796:832, ack 1, win 501, options [nop,nop,TS val 1836104783 ecr 488284367], length 36
20:34:28.838493 IP 155.138.140.26.vultr.com.ssh > 2.146.158.104.in-addr.arpa.53986: Flags [P.], seq 832:1052, ack 1, win 501, options [nop,nop,TS val 1836104784 ecr 488284367], length 220
20:34:28.838514 IP 155.138.140.26.vultr.com.ssh > 2.146.158.104.in-addr.arpa.53986: Flags [P.], seq 1052:1088, ack 1, win 501, options [nop,nop,TS val 1836104784 ecr 488284367], length 36
20:34:28.838546 IP 155.138.140.26.vultr.com.ssh > 2.146.158.104.in-addr.arpa.53986: Flags [P.], seq 1088:1308, ack 1, win 501, options [nop,nop,TS val 1836104784 ecr 488284367], length 220
20:34:28.838579 IP 155.138.140.26.vultr.com.ssh > 2.146.158.104.in-addr.arpa.53986: Flags [P.], seq 1308:1564, ack 1, win 501, options [nop,nop,TS val 1836104784 ecr 488284367], length 256
20:34:28.838613 IP 155.138.140.26.vultr.com.ssh > 2.146.158.104.in-addr.arpa.53986: Flags [P.], seq 1564:1820, ack 1, win 501, options [nop,nop,TS val 1836104784 ecr 488284367], length 256
20:34:28.838633 IP 155.138.140.26.vultr.com.ssh > 2.146.158.104.in-addr.arpa.53986: Flags [P.], seq 1820:1856, ack 1, win 501, options [nop,nop,TS val 1836104784 ecr 488284367], length 36
20:34:28.838659 IP 155.138.140.26.vultr.com.ssh > 2.146.158.104.in-addr.arpa.53986: Flags [P.], seq 1856:2076, ack 1, win 501, options [nop,nop,TS val 1836104784 ecr 488284367], length 220
20:34:28.838698 IP 155.138.140.26.vultr.com.ssh > 2.146.158.104.in-addr.arpa.53986: Flags [P.], seq 2076:2340, ack 1, win 501, options [nop,nop,TS val 1836104784 ecr 488284367], length 264
20:34:28.838730 IP 155.138.140.26.vultr.com.ssh > 2.146.158.104.in-addr.arpa.53986: Flags [P.], seq 2340:2640, ack 1, win 501, options [nop,nop,TS val 1836104784 ecr 488284367], length 300
20:34:28.838767 IP 155.138.140.26.vultr.com.ssh > 2.146.158.104.in-addr.arpa.53986: Flags [P.], seq 2640:2904, ack 1, win 501, options [nop,nop,TS val 1836104784 ecr 488284367], length 264
20:34:28.838784 IP 155.138.140.26.vultr.com.ssh > 2.146.158.104.in-addr.arpa.53986: Flags [P.], seq 2904:3132, ack 1, win 501, options [nop,nop,TS val 1836104784 ecr 488284367], length 228
20:34:28.838812 IP 155.138.140.26.vultr.com.ssh > 2.146.158.104.in-addr.arpa.53986: Flags [P.], seq 3132:3168, ack 1, win 501, options [nop,nop,TS val 1836104784 ecr 488284367], length 36
20:34:28.838839 IP 155.138.140.26.vultr.com.ssh > 2.146.158.104.in-addr.arpa.53986: Flags [P.], seq 3168:3396, ack 1, win 501, options [nop,nop,TS val 1836104784 ecr 488284367], length 228
20:34:28.838862 IP 155.138.140.26.vultr.com.ssh > 2.146.158.104.in-addr.arpa.53986: Flags [P.], seq 3396:3432, ack 1, win 501, options [nop,nop,TS val 1836104784 ecr 488284367], length 36
20:34:28.838892 IP 155.138.140.26.vultr.com.ssh > 2.146.158.104.in-addr.arpa.53986: Flags [P.], seq 3432:3660, ack 1, win 501, options [nop,nop,TS val 1836104784 ecr 488284367], length 228
20:34:28.838915 IP 155.138.140.26.vultr.com.ssh > 2.146.158.104.in-addr.arpa.53986: Flags [P.], seq 3660:3696, ack 1, win 501, options [nop,nop,TS val 1836104784 ecr 488284367], length 36
20:34:28.838948 IP 155.138.140.26.vultr.com.ssh > 2.146.158.104.in-addr.arpa.53986: Flags [P.], seq 3696:3924, ack 1, win 501, options [nop,nop,TS val 1836104784 ecr 488284367], length 228
20:34:28.838970 IP 155.138.140.26.vultr.com.ssh > 2.146.158.104.in-addr.arpa.53986: Flags [P.], seq 3924:3960, ack 1, win 501, options [nop,nop,TS val 1836104784 ecr 488284367], length 36
20:34:28.838997 IP 155.138.140.26.vultr.com.ssh > 2.146.158.104.in-addr.arpa.53986: Flags [P.], seq 3960:4188, ack 1, win 501, options [nop,nop,TS val 1836104784 ecr 488284367], length 228
20:34:28.839019 IP 155.138.140.26.vultr.com.ssh > 2.146.158.104.in-addr.arpa.53986: Flags [P.], seq 4188:4224, ack 1, win 501, options [nop,nop,TS val 1836104784 ecr 488284367], length 36
20:34:28.839049 IP 155.138.140.26.vultr.com.ssh > 2.146.158.104.in-addr.arpa.53986: Flags [P.], seq 4224:4452, ack 1, win 501, options [nop,nop,TS val 1836104784 ecr 488284367], length 228
20:34:28.839069 IP 155.138.140.26.vultr.com.ssh > 2.146.158.104.in-addr.arpa.53986: Flags [P.], seq 4452:4488, ack 1, win 501, options [nop,nop,TS val 1836104784 ecr 488284367], length 36
20:34:28.839100 IP 155.138.140.26.vultr.com.ssh > 2.146.158.104.in-addr.arpa.53986: Flags [P.], seq 4488:4716, ack 1, win 501, options [nop,nop,TS val 1836104784 ecr 488284367], length 228
20:34:28.839131 IP 155.138.140.26.vultr.com.ssh > 2.146.158.104.in-addr.arpa.53986: Flags [P.], seq 4716:4752, ack 1, win 501, options [nop,nop,TS val 1836104784 ecr 488284367], length 36
20:34:28.839169 IP 155.138.140.26.vultr.com.ssh > 2.146.158.104.in-addr.arpa.53986: Flags [P.], seq 4752:4980, ack 1, win 501, options [nop,nop,TS val 1836104784 ecr 488284367], length 228
20:34:28.839196 IP 155.138.140.26.vultr.com.ssh > 2.146.158.104.in-addr.arpa.53986: Flags [P.], seq 4980:5016, ack 1, win 501, options [nop,nop,TS val 1836104784 ecr 488284367], length 36
20:34:28.839226 IP 155.138.140.26.vultr.com.ssh > 2.146.158.104.in-addr.arpa.53986: Flags [P.], seq 5016:5244, ack 1, win 501, options [nop,nop,TS val 1836104784 ecr 488284367], length 228
20:34:28.839252 IP 155.138.140.26.vultr.com.ssh > 2.146.158.104.in-addr.arpa.53986: Flags [P.], seq 5244:5280, ack 1, win 501, options [nop,nop,TS val 1836104784 ecr 488284367], length 36
20:34:28.839284 IP 155.138.140.26.vultr.com.ssh > 2.146.158.104.in-addr.arpa.53986: Flags [P.], seq 5280:5508, ack 1, win 501, options [nop,nop,TS val 1836104784 ecr 488284367], length 228
20:34:28.839307 IP 155.138.140.26.vultr.com.ssh > 2.146.158.104.in-addr.arpa.53986: Flags [P.], seq 5508:5544, ack 1, win 501, options [nop,nop,TS val 1836104784 ecr 488284367], length 36
20:34:28.839342 IP 155.138.140.26.vultr.com.ssh > 2.146.158.104.in-addr.arpa.53986: Flags [P.], seq 5544:5772, ack 1, win 501, options [nop,nop,TS val 1836104784 ecr 488284367], length 228
20:34:28.839372 IP 155.138.140.26.vultr.com.ssh > 2.146.158.104.in-addr.arpa.53986: Flags [P.], seq 5772:5808, ack 1, win 501, options [nop,nop,TS val 1836104784 ecr 488284367], length 36
20:34:28.839405 IP 155.138.140.26.vultr.com.ssh > 2.146.158.104.in-addr.arpa.53986: Flags [P.], seq 5808:6036, ack 1, win 501, options [nop,nop,TS val 1836104784 ecr 488284367], length 228
20:34:28.839427 IP 155.138.140.26.vultr.com.ssh > 2.146.158.104.in-addr.arpa.53986: Flags [P.], seq 6036:6072, ack 1, win 501, options [nop,nop,TS val 1836104784 ecr 488284367], length 36
20:34:28.839458 IP 155.138.140.26.vultr.com.ssh > 2.146.158.104.in-addr.arpa.53986: Flags [P.], seq 6072:6300, ack 1, win 501, options [nop,nop,TS val 1836104784 ecr 488284367], length 228
20:34:28.839482 IP 155.138.140.26.vultr.com.ssh > 2.146.158.104.in-addr.arpa.53986: Flags [P.], seq 6300:6336, ack 1, win 501, options [nop,nop,TS val 1836104784 ecr 488284367], length 36
20:34:28.839509 IP 155.138.140.26.vultr.com.ssh > 2.146.158.104.in-addr.arpa.53986: Flags [P.], seq 6336:6564, ack 1, win 501, options [nop,nop,TS val 1836104785 ecr 488284367], length 228
20:34:28.839533 IP 155.138.140.26.vultr.com.ssh > 2.146.158.104.in-addr.arpa.53986: Flags [P.], seq 6564:6600, ack 1, win 501, options [nop,nop,TS val 1836104785 ecr 488284367], length 36
20:34:28.839571 IP 155.138.140.26.vultr.com.ssh > 2.146.158.104.in-addr.arpa.53986: Flags [P.], seq 6600:6828, ack 1, win 501, options [nop,nop,TS val 1836104785 ecr 488284367], length 228
20:34:28.839596 IP 155.138.140.26.vultr.com.ssh > 2.146.158.104.in-addr.arpa.53986: Flags [P.], seq 6828:6864, ack 1, win 501, options [nop,nop,TS val 1836104785 ecr 488284367], length 36
20:34:28.839625 IP 155.138.140.26.vultr.com.ssh > 2.146.158.104.in-addr.arpa.53986: Flags [P.], seq 6864:7092, ack 1, win 501, options [nop,nop,TS val 1836104785 ecr 488284367], length 228
20:34:28.839650 IP 155.138.140.26.vultr.com.ssh > 2.146.158.104.in-addr.arpa.53986: Flags [P.], seq 7092:7128, ack 1, win 501, options [nop,nop,TS val 1836104785 ecr 488284367], length 36
20:34:28.839674 IP 155.138.140.26.vultr.com.ssh > 2.146.158.104.in-addr.arpa.53986: Flags [P.], seq 7128:7356, ack 1, win 501, options [nop,nop,TS val 1836104785 ecr 488284367], length 228
20:34:28.839699 IP 155.138.140.26.vultr.com.ssh > 2.146.158.104.in-addr.arpa.53986: Flags [P.], seq 7356:7392, ack 1, win 501, options [nop,nop,TS val 1836104785 ecr 488284367], length 36
20:34:28.839729 IP 155.138.140.26.vultr.com.ssh > 2.146.158.104.in-addr.arpa.53986: Flags [P.], seq 7392:7620, ack 1, win 501, options [nop,nop,TS val 1836104785 ecr 488284367], length 228
20:34:28.839750 IP 155.138.140.26.vultr.com.ssh > 2.146.158.104.in-addr.arpa.53986: Flags [P.], seq 7620:7656, ack 1, win 501, options [nop,nop,TS val 1836104785 ecr 488284367], length 36
20:34:28.839782 IP 155.138.140.26.vultr.com.ssh > 2.146.158.104.in-addr.arpa.53986: Flags [P.], seq 7656:7884, ack 1, win 501, options [nop,nop,TS val 1836104785 ecr 488284367], length 228
20:34:28.839809 IP 155.138.140.26.vultr.com.ssh > 2.146.158.104.in-addr.arpa.53986: Flags [P.], seq 7884:7920, ack 1, win 501, options [nop,nop,TS val 1836104785 ecr 488284367], length 36
20:34:28.839838 IP 155.138.140.26.vultr.com.ssh > 2.146.158.104.in-addr.arpa.53986: Flags [P.], seq 7920:8148, ack 1, win 501, options [nop,nop,TS val 1836104785 ecr 488284367], length 228
20:34:28.839860 IP 155.138.140.26.vultr.com.ssh > 2.146.158.104.in-addr.arpa.53986: Flags [P.], seq 8148:8184, ack 1, win 501, options [nop,nop,TS val 1836104785 ecr 488284367], length 36
20:34:28.839890 IP 155.138.140.26.vultr.com.ssh > 2.146.158.104.in-addr.arpa.53986: Flags [P.], seq 8184:8412, ack 1, win 501, options [nop,nop,TS val 1836104785 ecr 488284367], length 228
20:34:28.839910 IP 155.138.140.26.vultr.com.ssh > 2.146.158.104.in-addr.arpa.53986: Flags [P.], seq 8412:8448, ack 1, win 501, options [nop,nop,TS val 1836104785 ecr 488284367], length 36
20:34:28.839942 IP 155.138.140.26.vultr.com.ssh > 2.146.158.104.in-addr.arpa.53986: Flags [P.], seq 8448:8676, ack 1, win 501, options [nop,nop,TS val 1836104785 ecr 488284367], length 228
20:34:28.839963 IP 155.138.140.26.vultr.com.ssh > 2.146.158.104.in-addr.arpa.53986: Flags [P.], seq 8676:8712, ack 1, win 501, options [nop,nop,TS val 1836104785 ecr 488284367], length 36
20:34:28.839990 IP 155.138.140.26.vultr.com.ssh > 2.146.158.104.in-addr.arpa.53986: Flags [P.], seq 8712:8940, ack 1, win 501, options [nop,nop,TS val 1836104785 ecr 488284367], length 228
20:34:28.840013 IP 155.138.140.26.vultr.com.ssh > 2.146.158.104.in-addr.arpa.53986: Flags [P.], seq 8940:8976, ack 1, win 501, options [nop,nop,TS val 1836104785 ecr 488284367], length 36
20:34:28.840043 IP 155.138.140.26.vultr.com.ssh > 2.146.158.104.in-addr.arpa.53986: Flags [P.], seq 8976:9204, ack 1, win 501, options [nop,nop,TS val 1836104785 ecr 488284367], length 228
20:34:28.840063 IP 155.138.140.26.vultr.com.ssh > 2.146.158.104.in-addr.arpa.53986: Flags [P.], seq 9204:9240, ack 1, win 501, options [nop,nop,TS val 1836104785 ecr 488284367], length 36
20:34:28.840093 IP 155.138.140.26.vultr.com.ssh > 2.146.158.104.in-addr.arpa.53986: Flags [P.], seq 9240:9468, ack 1, win 501, options [nop,nop,TS val 1836104785 ecr 488284367], length 228
20:34:28.840141 IP 155.138.140.26.vultr.com.ssh > 2.146.158.104.in-addr.arpa.53986: Flags [P.], seq 9504:9732, ack 1, win 501, options [nop,nop,TS val 1836104785 ecr 488284367], length 228
20:34:28.840196 IP 155.138.140.26.vultr.com.ssh > 2.146.158.104.in-addr.arpa.53986: Flags [P.], seq 9768:9996, ack 1, win 501, options [nop,nop,TS val 1836104785 ecr 488284367], length 228
20:34:28.840250 IP 155.138.140.26.vultr.com.ssh > 2.146.158.104.in-addr.arpa.53986: Flags [P.], seq 10032:10260, ack 1, win 501, options [nop,nop,TS val 1836104785 ecr 488284367], length 228
20:34:28.840311 IP 155.138.140.26.vultr.com.ssh > 2.146.158.104.in-addr.arpa.53986: Flags [P.], seq 10296:10524, ack 1, win 501, options [nop,nop,TS val 1836104785 ecr 488284367], length 228
20:34:28.840379 IP 155.138.140.26.vultr.com.ssh > 2.146.158.104.in-addr.arpa.53986: Flags [P.], seq 10560:10788, ack 1, win 501, options [nop,nop,TS val 1836104785 ecr 488284367], length 228
20:34:28.840431 IP 155.138.140.26.vultr.com.ssh > 2.146.158.104.in-addr.arpa.53986: Flags [P.], seq 10824:11052, ack 1, win 501, options [nop,nop,TS val 1836104785 ecr 488284367], length 228
20:34:28.840479 IP 155.138.140.26.vultr.com.ssh > 2.146.158.104.in-addr.arpa.53986: Flags [P.], seq 11088:11316, ack 1, win 501, options [nop,nop,TS val 1836104785 ecr 488284367], length 228
20:34:28.840530 IP 155.138.140.26.vultr.com.ssh > 2.146.158.104.in-addr.arpa.53986: Flags [P.], seq 11352:11580, ack 1, win 501, options [nop,nop,TS val 1836104786 ecr 488284367], length 228
20:34:28.840581 IP 155.138.140.26.vultr.com.ssh > 2.146.158.104.in-addr.arpa.53986: Flags [P.], seq 11616:11844, ack 1, win 501, options [nop,nop,TS val 1836104786 ecr 488284367], length 228
20:34:28.840630 IP 155.138.140.26.vultr.com.ssh > 2.146.158.104.in-addr.arpa.53986: Flags [P.], seq 11880:12108, ack 1, win 501, options [nop,nop,TS val 1836104786 ecr 488284367], length 228
20:34:28.840678 IP 155.138.140.26.vultr.com.ssh > 2.146.158.104.in-addr.arpa.53986: Flags [P.], seq 12144:12372, ack 1, win 501, options [nop,nop,TS val 1836104786 ecr 488284367], length 228
20:34:28.840729 IP 155.138.140.26.vultr.com.ssh > 2.146.158.104.in-addr.arpa.53986: Flags [P.], seq 12408:12636, ack 1, win 501, options [nop,nop,TS val 1836104786 ecr 488284367], length 228
20:34:28.840789 IP 155.138.140.26.vultr.com.ssh > 2.146.158.104.in-addr.arpa.53986: Flags [P.], seq 12672:12900, ack 1, win 501, options [nop,nop,TS val 1836104786 ecr 488284367], length 228
20:34:28.840892 IP 155.138.140.26.vultr.com.ssh > 2.146.158.104.in-addr.arpa.53986: Flags [P.], seq 12936:13164, ack 1, win 501, options [nop,nop,TS val 1836104786 ecr 488284367], length 228
20:34:28.840940 IP 155.138.140.26.vultr.com.ssh > 2.146.158.104.in-addr.arpa.53986: Flags [P.], seq 13200:13428, ack 1, win 501, options [nop,nop,TS val 1836104786 ecr 488284367], length 228
20:34:28.840994 IP 155.138.140.26.vultr.com.ssh > 2.146.158.104.in-addr.arpa.53986: Flags [P.], seq 13464:13692, ack 1, win 501, options [nop,nop,TS val 1836104786 ecr 488284367], length 228
20:34:28.841044 IP 155.138.140.26.vultr.com.ssh > 2.146.158.104.in-addr.arpa.53986: Flags [P.], seq 13728:13956, ack 1, win 501, options [nop,nop,TS val 1836104786 ecr 488284367], length 228
20:34:28.841114 IP 155.138.140.26.vultr.com.ssh > 2.146.158.104.in-addr.arpa.53986: Flags [P.], seq 13992:14220, ack 1, win 501, options [nop,nop,TS val 1836104786 ecr 488284367], length 228
20:34:28.841161 IP 155.138.140.26.vultr.com.ssh > 2.146.158.104.in-addr.arpa.53986: Flags [P.], seq 14256:14484, ack 1, win 501, options [nop,nop,TS val 1836104786 ecr 488284367], length 228
20:34:28.841214 IP 155.138.140.26.vultr.com.ssh > 2.146.158.104.in-addr.arpa.53986: Flags [P.], seq 14520:14748, ack 1, win 501, options [nop,nop,TS val 1836104786 ecr 488284367], length 228
20:34:28.841267 IP 155.138.140.26.vultr.com.ssh > 2.146.158.104.in-addr.arpa.53986: Flags [P.], seq 14784:15012, ack 1, win 501, options [nop,nop,TS val 1836104786 ecr 488284367], length 228
20:34:28.841327 IP 155.138.140.26.vultr.com.ssh > 2.146.158.104.in-addr.arpa.53986: Flags [P.], seq 15048:15276, ack 1, win 501, options [nop,nop,TS val 1836104786 ecr 488284367], length 228
20:34:28.841387 IP 155.138.140.26.vultr.com.ssh > 2.146.158.104.in-addr.arpa.53986: Flags [P.], seq 15312:15540, ack 1, win 501, options [nop,nop,TS val 1836104786 ecr 488284367], length 228
20:34:28.841458 IP 155.138.140.26.vultr.com.ssh > 2.146.158.104.in-addr.arpa.53986: Flags [P.], seq 15576:15804, ack 1, win 501, options [nop,nop,TS val 1836104786 ecr 488284367], length 228
20:34:28.841505 IP 155.138.140.26.vultr.com.ssh > 2.146.158.104.in-addr.arpa.53986: Flags [P.], seq 15840:16068, ack 1, win 501, options [nop,nop,TS val 1836104787 ecr 488284367], length 228
20:34:28.841569 IP 155.138.140.26.vultr.com.ssh > 2.146.158.104.in-addr.arpa.53986: Flags [P.], seq 16104:16332, ack 1, win 501, options [nop,nop,TS val 1836104787 ecr 488284367], length 228
20:34:28.841624 IP 155.138.140.26.vultr.com.ssh > 2.146.158.104.in-addr.arpa.53986: Flags [P.], seq 16368:16596, ack 1, win 501, options [nop,nop,TS val 1836104787 ecr 488284367], length 228
20:34:28.841671 IP 155.138.140.26.vultr.com.ssh > 2.146.158.104.in-addr.arpa.53986: Flags [P.], seq 16632:16860, ack 1, win 501, options [nop,nop,TS val 1836104787 ecr 488284367], length 228
20:34:28.841724 IP 155.138.140.26.vultr.com.ssh > 2.146.158.104.in-addr.arpa.53986: Flags [P.], seq 16896:17124, ack 1, win 501, options [nop,nop,TS val 1836104787 ecr 488284367], length 228
20:34:28.841777 IP 155.138.140.26.vultr.com.ssh > 2.146.158.104.in-addr.arpa.53986: Flags [P.], seq 17160:17388, ack 1, win 501, options [nop,nop,TS val 1836104787 ecr 488284367], length 228
20:34:28.841833 IP 155.138.140.26.vultr.com.ssh > 2.146.158.104.in-addr.arpa.53986: Flags [P.], seq 17424:17652, ack 1, win 501, options [nop,nop,TS val 1836104787 ecr 488284367], length 228
20:34:28.841887 IP 155.138.140.26.vultr.com.ssh > 2.146.158.104.in-addr.arpa.53986: Flags [P.], seq 17688:17916, ack 1, win 501, options [nop,nop,TS val 1836104787 ecr 488284367], length 228
20:34:28.841938 IP 155.138.140.26.vultr.com.ssh > 2.146.158.104.in-addr.arpa.53986: Flags [P.], seq 17952:18180, ack 1, win 501, options [nop,nop,TS val 1836104787 ecr 488284367], length 228
20:34:28.841991 IP 155.138.140.26.vultr.com.ssh > 2.146.158.104.in-addr.arpa.53986: Flags [P.], seq 18216:18444, ack 1, win 501, options [nop,nop,TS val 1836104787 ecr 488284367], length 228
20:34:28.842041 IP 155.138.140.26.vultr.com.ssh > 2.146.158.104.in-addr.arpa.53986: Flags [P.], seq 18480:18708, ack 1, win 501, options [nop,nop,TS val 1836104787 ecr 488284367], length 228
20:34:28.842089 IP 155.138.140.26.vultr.com.ssh > 2.146.158.104.in-addr.arpa.53986: Flags [P.], seq 18744:18972, ack 1, win 501, options [nop,nop,TS val 1836104787 ecr 488284367], length 228
20:34:28.842138 IP 155.138.140.26.vultr.com.ssh > 2.146.158.104.in-addr.arpa.53986: Flags [P.], seq 19008:19236, ack 1, win 501, options [nop,nop,TS val 1836104787 ecr 488284367], length 228
20:34:28.842186 IP 155.138.140.26.vultr.com.ssh > 2.146.158.104.in-addr.arpa.53986: Flags [P.], seq 19272:19500, ack 1, win 501, options [nop,nop,TS val 1836104787 ecr 488284367], length 228
20:34:28.842230 IP 155.138.140.26.vultr.com.ssh > 2.146.158.104.in-addr.arpa.53986: Flags [P.], seq 19536:19764, ack 1, win 501, options [nop,nop,TS val 1836104787 ecr 488284367], length 228
20:34:28.842281 IP 155.138.140.26.vultr.com.ssh > 2.146.158.104.in-addr.arpa.53986: Flags [P.], seq 19800:20028, ack 1, win 501, options [nop,nop,TS val 1836104787 ecr 488284367], length 228
20:34:28.842345 IP 155.138.140.26.vultr.com.ssh > 2.146.158.104.in-addr.arpa.53986: Flags [P.], seq 20064:20292, ack 1, win 501, options [nop,nop,TS val 1836104787 ecr 488284367], length 228
20:34:28.842402 IP 155.138.140.26.vultr.com.ssh > 2.146.158.104.in-addr.arpa.53986: Flags [P.], seq 20328:20556, ack 1, win 501, options [nop,nop,TS val 1836104787 ecr 488284367], length 228
20:34:28.842455 IP 155.138.140.26.vultr.com.ssh > 2.146.158.104.in-addr.arpa.53986: Flags [P.], seq 20592:20820, ack 1, win 501, options [nop,nop,TS val 1836104787 ecr 488284367], length 228
20:34:28.842491 IP 155.138.140.26.vultr.com.ssh > 2.146.158.104.in-addr.arpa.53986: Flags [P.], seq 20820:21240, ack 1, win 501, options [nop,nop,TS val 1836104788 ecr 488284367], length 420
20:34:28.842537 IP 155.138.140.26.vultr.com.ssh > 2.146.158.104.in-addr.arpa.53986: Flags [P.], seq 21240:21852, ack 1, win 501, options [nop,nop,TS val 1836104788 ecr 488284367], length 612
20:34:28.842589 IP 155.138.140.26.vultr.com.ssh > 2.146.158.104.in-addr.arpa.53986: Flags [P.], seq 21852:22848, ack 1, win 501, options [nop,nop,TS val 1836104788 ecr 488284367], length 996
20:34:28.842633 IP 155.138.140.26.vultr.com.ssh > 2.146.158.104.in-addr.arpa.53986: Flags [P.], seq 22848:23652, ack 1, win 501, options [nop,nop,TS val 1836104788 ecr 488284367], length 804
20:34:28.842684 IP 155.138.140.26.vultr.com.ssh > 2.146.158.104.in-addr.arpa.53986: Flags [P.], seq 23652:24456, ack 1, win 501, options [nop,nop,TS val 1836104788 ecr 488284367], length 804
20:34:28.842735 IP 155.138.140.26.vultr.com.ssh > 2.146.158.104.in-addr.arpa.53986: Flags [P.], seq 24456:25452, ack 1, win 501, options [nop,nop,TS val 1836104788 ecr 488284367], length 996
20:34:28.842775 IP 155.138.140.26.vultr.com.ssh > 2.146.158.104.in-addr.arpa.53986: Flags [P.], seq 25452:26064, ack 1, win 501, options [nop,nop,TS val 1836104788 ecr 488284367], length 612
20:34:28.842816 IP 155.138.140.26.vultr.com.ssh > 2.146.158.104.in-addr.arpa.53986: Flags [P.], seq 26064:26484, ack 1, win 501, options [nop,nop,TS val 1836104788 ecr 488284367], length 420
20:34:28.842872 IP 155.138.140.26.vultr.com.ssh > 2.146.158.104.in-addr.arpa.53986: Flags [P.], seq 26484:27288, ack 1, win 501, options [nop,nop,TS val 1836104788 ecr 488284367], length 804
20:34:28.842919 IP 155.138.140.26.vultr.com.ssh > 2.146.158.104.in-addr.arpa.53986: Flags [P.], seq 27288:28092, ack 1, win 501, options [nop,nop,TS val 1836104788 ecr 488284367], length 804
20:34:28.842964 IP 155.138.140.26.vultr.com.ssh > 2.146.158.104.in-addr.arpa.53986: Flags [P.], seq 28092:28704, ack 1, win 501, options [nop,nop,TS val 1836104788 ecr 488284367], length 612
20:34:28.843043 IP 155.138.140.26.vultr.com.ssh > 2.146.158.104.in-addr.arpa.53986: Flags [P.], seq 28704:29316, ack 1, win 501, options [nop,nop,TS val 1836104788 ecr 488284367], length 612
20:34:28.843102 IP 155.138.140.26.vultr.com.ssh > 2.146.158.104.in-addr.arpa.53986: Flags [P.], seq 29316:29544, ack 1, win 501, options [nop,nop,TS val 1836104788 ecr 488284367], length 228
20:34:28.843141 IP 155.138.140.26.vultr.com.ssh > 2.146.158.104.in-addr.arpa.53986: Flags [P.], seq 29544:29772, ack 1, win 501, options [nop,nop,TS val 1836104788 ecr 488284367], length 228
20:34:28.843173 IP 155.138.140.26.vultr.com.ssh > 2.146.158.104.in-addr.arpa.53986: Flags [P.], seq 29772:30000, ack 1, win 501, options [nop,nop,TS val 1836104788 ecr 488284367], length 228
20:34:28.843204 IP 155.138.140.26.vultr.com.ssh > 2.146.158.104.in-addr.arpa.53986: Flags [P.], seq 30000:30228, ack 1, win 501, options [nop,nop,TS val 1836104788 ecr 488284367], length 228
20:34:28.843250 IP 155.138.140.26.vultr.com.ssh > 2.146.158.104.in-addr.arpa.53986: Flags [P.], seq 30228:30456, ack 1, win 501, options [nop,nop,TS val 1836104788 ecr 488284367], length 228
20:34:28.843285 IP 155.138.140.26.vultr.com.ssh > 2.146.158.104.in-addr.arpa.53986: Flags [P.], seq 30456:30684, ack 1, win 501, options [nop,nop,TS val 1836104788 ecr 488284367], length 228
20:34:28.843327 IP 155.138.140.26.vultr.com.ssh > 2.146.158.104.in-addr.arpa.53986: Flags [P.], seq 30684:30912, ack 1, win 501, options [nop,nop,TS val 1836104788 ecr 488284367], length 228
20:34:28.843370 IP 155.138.140.26.vultr.com.ssh > 2.146.158.104.in-addr.arpa.53986: Flags [P.], seq 30912:31140, ack 1, win 501, options [nop,nop,TS val 1836104788 ecr 488284367], length 228
20:34:28.843410 IP 155.138.140.26.vultr.com.ssh > 2.146.158.104.in-addr.arpa.53986: Flags [P.], seq 31140:31368, ack 1, win 501, options [nop,nop,TS val 1836104788 ecr 488284367], length 228
20:34:28.843446 IP 155.138.140.26.vultr.com.ssh > 2.146.158.104.in-addr.arpa.53986: Flags [P.], seq 31368:31596, ack 1, win 501, options [nop,nop,TS val 1836104788 ecr 488284367], length 228
20:34:28.843491 IP 155.138.140.26.vultr.com.ssh > 2.146.158.104.in-addr.arpa.53986: Flags [P.], seq 31596:31824, ack 1, win 501, options [nop,nop,TS val 1836104789 ecr 488284367], length 228
20:34:28.843581 IP 155.138.140.26.vultr.com.ssh > 2.146.158.104.in-addr.arpa.53986: Flags [P.], seq 31824:32052, ack 1, win 501, options [nop,nop,TS val 1836104789 ecr 488284367], length 228
20:34:28.843628 IP 155.138.140.26.vultr.com.ssh > 2.146.158.104.in-addr.arpa.53986: Flags [P.], seq 32052:32280, ack 1, win 501, options [nop,nop,TS val 1836104789 ecr 488284367], length 228
20:34:28.843681 IP 155.138.140.26.vultr.com.ssh > 2.146.158.104.in-addr.arpa.53986: Flags [P.], seq 32280:32508, ack 1, win 501, options [nop,nop,TS val 1836104789 ecr 488284367], length 228
20:34:28.843728 IP 155.138.140.26.vultr.com.ssh > 2.146.158.104.in-addr.arpa.53986: Flags [P.], seq 32508:32736, ack 1, win 501, options [nop,nop,TS val 1836104789 ecr 488284367], length 228
20:34:28.843762 IP 155.138.140.26.vultr.com.ssh > 2.146.158.104.in-addr.arpa.53986: Flags [P.], seq 32736:32964, ack 1, win 501, options [nop,nop,TS val 1836104789 ecr 488284367], length 228
20:34:28.843795 IP 155.138.140.26.vultr.com.ssh > 2.146.158.104.in-addr.arpa.53986: Flags [P.], seq 32964:33192, ack 1, win 501, options [nop,nop,TS val 1836104789 ecr 488284367], length 228
20:34:28.843831 IP 155.138.140.26.vultr.com.ssh > 2.146.158.104.in-addr.arpa.53986: Flags [P.], seq 33192:33420, ack 1, win 501, options [nop,nop,TS val 1836104789 ecr 488284367], length 228
20:34:28.843872 IP 155.138.140.26.vultr.com.ssh > 2.146.158.104.in-addr.arpa.53986: Flags [P.], seq 33420:33648, ack 1, win 501, options [nop,nop,TS val 1836104789 ecr 488284367], length 228
20:34:28.843906 IP 155.138.140.26.vultr.com.ssh > 2.146.158.104.in-addr.arpa.53986: Flags [P.], seq 33648:33876, ack 1, win 501, options [nop,nop,TS val 1836104789 ecr 488284367], length 228
20:34:28.843937 IP 155.138.140.26.vultr.com.ssh > 2.146.158.104.in-addr.arpa.53986: Flags [P.], seq 33876:34104, ack 1, win 501, options [nop,nop,TS val 1836104789 ecr 488284367], length 228
20:34:28.843969 IP 155.138.140.26.vultr.com.ssh > 2.146.158.104.in-addr.arpa.53986: Flags [P.], seq 34104:34332, ack 1, win 501, options [nop,nop,TS val 1836104789 ecr 488284367], length 228
20:34:28.844000 IP 155.138.140.26.vultr.com.ssh > 2.146.158.104.in-addr.arpa.53986: Flags [P.], seq 34332:34560, ack 1, win 501, options [nop,nop,TS val 1836104789 ecr 488284367], length 228
20:34:28.844031 IP 155.138.140.26.vultr.com.ssh > 2.146.158.104.in-addr.arpa.53986: Flags [P.], seq 34560:34788, ack 1, win 501, options [nop,nop,TS val 1836104789 ecr 488284367], length 228
20:34:28.844069 IP 155.138.140.26.vultr.com.ssh > 2.146.158.104.in-addr.arpa.53986: Flags [P.], seq 34788:35016, ack 1, win 501, options [nop,nop,TS val 1836104789 ecr 488284367], length 228
20:34:28.844101 IP 155.138.140.26.vultr.com.ssh > 2.146.158.104.in-addr.arpa.53986: Flags [P.], seq 35016:35244, ack 1, win 501, options [nop,nop,TS val 1836104789 ecr 488284367], length 228
20:34:28.844132 IP 155.138.140.26.vultr.com.ssh > 2.146.158.104.in-addr.arpa.53986: Flags [P.], seq 35244:35472, ack 1, win 501, options [nop,nop,TS val 1836104789 ecr 488284367], length 228
20:34:28.844167 IP 155.138.140.26.vultr.com.ssh > 2.146.158.104.in-addr.arpa.53986: Flags [P.], seq 35472:35700, ack 1, win 501, options [nop,nop,TS val 1836104789 ecr 488284367], length 228
20:34:28.844201 IP 155.138.140.26.vultr.com.ssh > 2.146.158.104.in-addr.arpa.53986: Flags [P.], seq 35700:35928, ack 1, win 501, options [nop,nop,TS val 1836104789 ecr 488284367], length 228
20:34:28.844232 IP 155.138.140.26.vultr.com.ssh > 2.146.158.104.in-addr.arpa.53986: Flags [P.], seq 35928:36156, ack 1, win 501, options [nop,nop,TS val 1836104789 ecr 488284367], length 228
20:34:28.844263 IP 155.138.140.26.vultr.com.ssh > 2.146.158.104.in-addr.arpa.53986: Flags [P.], seq 36156:36384, ack 1, win 501, options [nop,nop,TS val 1836104789 ecr 488284367], length 228
20:34:28.844293 IP 155.138.140.26.vultr.com.ssh > 2.146.158.104.in-addr.arpa.53986: Flags [P.], seq 36384:36612, ack 1, win 501, options [nop,nop,TS val 1836104789 ecr 488284367], length 228
20:34:28.844334 IP 155.138.140.26.vultr.com.ssh > 2.146.158.104.in-addr.arpa.53986: Flags [P.], seq 36612:36840, ack 1, win 501, options [nop,nop,TS val 1836104789 ecr 488284367], length 228
20:34:28.844372 IP 155.138.140.26.vultr.com.ssh > 2.146.158.104.in-addr.arpa.53986: Flags [P.], seq 36840:37068, ack 1, win 501, options [nop,nop,TS val 1836104789 ecr 488284367], length 228
20:34:28.844407 IP 155.138.140.26.vultr.com.ssh > 2.146.158.104.in-addr.arpa.53986: Flags [P.], seq 37068:37296, ack 1, win 501, options [nop,nop,TS val 1836104789 ecr 488284367], length 228
20:34:28.844438 IP 155.138.140.26.vultr.com.ssh > 2.146.158.104.in-addr.arpa.53986: Flags [P.], seq 37296:37524, ack 1, win 501, options [nop,nop,TS val 1836104789 ecr 488284367], length 228
20:34:28.844472 IP 155.138.140.26.vultr.com.ssh > 2.146.158.104.in-addr.arpa.53986: Flags [P.], seq 37524:37752, ack 1, win 501, options [nop,nop,TS val 1836104789 ecr 488284367], length 228
20:34:28.844507 IP 155.138.140.26.vultr.com.ssh > 2.146.158.104.in-addr.arpa.53986: Flags [P.], seq 37752:37980, ack 1, win 501, options [nop,nop,TS val 1836104790 ecr 488284367], length 228
20:34:28.844538 IP 155.138.140.26.vultr.com.ssh > 2.146.158.104.in-addr.arpa.53986: Flags [P.], seq 37980:38208, ack 1, win 501, options [nop,nop,TS val 1836104790 ecr 488284367], length 228
20:34:28.844574 IP 155.138.140.26.vultr.com.ssh > 2.146.158.104.in-addr.arpa.53986: Flags [P.], seq 38208:38436, ack 1, win 501, options [nop,nop,TS val 1836104790 ecr 488284367], length 228
20:34:28.844608 IP 155.138.140.26.vultr.com.ssh > 2.146.158.104.in-addr.arpa.53986: Flags [P.], seq 38436:38664, ack 1, win 501, options [nop,nop,TS val 1836104790 ecr 488284367], length 228
20:34:28.844639 IP 155.138.140.26.vultr.com.ssh > 2.146.158.104.in-addr.arpa.53986: Flags [P.], seq 38664:38892, ack 1, win 501, options [nop,nop,TS val 1836104790 ecr 488284367], length 228
20:34:28.844673 IP 155.138.140.26.vultr.com.ssh > 2.146.158.104.in-addr.arpa.53986: Flags [P.], seq 38892:39120, ack 1, win 501, options [nop,nop,TS val 1836104790 ecr 488284367], length 228
20:34:28.844707 IP 155.138.140.26.vultr.com.ssh > 2.146.158.104.in-addr.arpa.53986: Flags [P.], seq 39120:39348, ack 1, win 501, options [nop,nop,TS val 1836104790 ecr 488284367], length 228
20:34:28.844737 IP 155.138.140.26.vultr.com.ssh > 2.146.158.104.in-addr.arpa.53986: Flags [P.], seq 39348:39576, ack 1, win 501, options [nop,nop,TS val 1836104790 ecr 488284367], length 228
20:34:28.844813 IP 155.138.140.26.vultr.com.ssh > 2.146.158.104.in-addr.arpa.53986: Flags [P.], seq 39576:39804, ack 1, win 501, options [nop,nop,TS val 1836104790 ecr 488284367], length 228
20:34:28.844851 IP 155.138.140.26.vultr.com.ssh > 2.146.158.104.in-addr.arpa.53986: Flags [P.], seq 39804:40032, ack 1, win 501, options [nop,nop,TS val 1836104790 ecr 488284367], length 228
20:34:28.844893 IP 155.138.140.26.vultr.com.ssh > 2.146.158.104.in-addr.arpa.53986: Flags [P.], seq 40032:40260, ack 1, win 501, options [nop,nop,TS val 1836104790 ecr 488284367], length 228
20:34:28.844929 IP 155.138.140.26.vultr.com.ssh > 2.146.158.104.in-addr.arpa.53986: Flags [P.], seq 40260:40488, ack 1, win 501, options [nop,nop,TS val 1836104790 ecr 488284367], length 228
20:34:28.844965 IP 155.138.140.26.vultr.com.ssh > 2.146.158.104.in-addr.arpa.53986: Flags [P.], seq 40488:40716, ack 1, win 501, options [nop,nop,TS val 1836104790 ecr 488284367], length 228
20:34:28.844998 IP 155.138.140.26.vultr.com.ssh > 2.146.158.104.in-addr.arpa.53986: Flags [P.], seq 40716:40944, ack 1, win 501, options [nop,nop,TS val 1836104790 ecr 488284367], length 228
20:34:28.845029 IP 155.138.140.26.vultr.com.ssh > 2.146.158.104.in-addr.arpa.53986: Flags [P.], seq 40944:41172, ack 1, win 501, options [nop,nop,TS val 1836104790 ecr 488284367], length 228
20:34:28.845060 IP 155.138.140.26.vultr.com.ssh > 2.146.158.104.in-addr.arpa.53986: Flags [P.], seq 41172:41400, ack 1, win 501, options [nop,nop,TS val 1836104790 ecr 488284367], length 228
20:34:28.845139 IP 155.138.140.26.vultr.com.ssh > 2.146.158.104.in-addr.arpa.53986: Flags [P.], seq 41400:41628, ack 1, win 501, options [nop,nop,TS val 1836104790 ecr 488284367], length 228
20:34:28.845172 IP 155.138.140.26.vultr.com.ssh > 2.146.158.104.in-addr.arpa.53986: Flags [P.], seq 41628:41856, ack 1, win 501, options [nop,nop,TS val 1836104790 ecr 488284367], length 228
20:34:28.845211 IP 155.138.140.26.vultr.com.ssh > 2.146.158.104.in-addr.arpa.53986: Flags [P.], seq 41856:42084, ack 1, win 501, options [nop,nop,TS val 1836104790 ecr 488284367], length 228
20:34:28.845251 IP 155.138.140.26.vultr.com.ssh > 2.146.158.104.in-addr.arpa.53986: Flags [P.], seq 42084:42312, ack 1, win 501, options [nop,nop,TS val 1836104790 ecr 488284367], length 228
20:34:28.845287 IP 155.138.140.26.vultr.com.ssh > 2.146.158.104.in-addr.arpa.53986: Flags [P.], seq 42312:42540, ack 1, win 501, options [nop,nop,TS val 1836104790 ecr 488284367], length 228
20:34:28.845348 IP 155.138.140.26.vultr.com.ssh > 2.146.158.104.in-addr.arpa.53986: Flags [P.], seq 42540:42768, ack 1, win 501, options [nop,nop,TS val 1836104790 ecr 488284367], length 228
20:34:28.845389 IP 155.138.140.26.vultr.com.ssh > 2.146.158.104.in-addr.arpa.53986: Flags [P.], seq 42768:42996, ack 1, win 501, options [nop,nop,TS val 1836104790 ecr 488284367], length 228
20:34:28.845420 IP 155.138.140.26.vultr.com.ssh > 2.146.158.104.in-addr.arpa.53986: Flags [P.], seq 42996:43224, ack 1, win 501, options [nop,nop,TS val 1836104790 ecr 488284367], length 228
20:34:28.845462 IP 155.138.140.26.vultr.com.ssh > 2.146.158.104.in-addr.arpa.53986: Flags [P.], seq 43224:43452, ack 1, win 501, options [nop,nop,TS val 1836104790 ecr 488284367], length 228
20:34:28.845497 IP 155.138.140.26.vultr.com.ssh > 2.146.158.104.in-addr.arpa.53986: Flags [P.], seq 43452:43680, ack 1, win 501, options [nop,nop,TS val 1836104791 ecr 488284367], length 228
20:34:28.845529 IP 155.138.140.26.vultr.com.ssh > 2.146.158.104.in-addr.arpa.53986: Flags [P.], seq 43680:43908, ack 1, win 501, options [nop,nop,TS val 1836104791 ecr 488284367], length 228
20:34:28.845565 IP 155.138.140.26.vultr.com.ssh > 2.146.158.104.in-addr.arpa.53986: Flags [P.], seq 43908:44136, ack 1, win 501, options [nop,nop,TS val 1836104791 ecr 488284367], length 228
20:34:28.845599 IP 155.138.140.26.vultr.com.ssh > 2.146.158.104.in-addr.arpa.53986: Flags [P.], seq 44136:44364, ack 1, win 501, options [nop,nop,TS val 1836104791 ecr 488284367], length 228
20:34:28.845630 IP 155.138.140.26.vultr.com.ssh > 2.146.158.104.in-addr.arpa.53986: Flags [P.], seq 44364:44592, ack 1, win 501, options [nop,nop,TS val 1836104791 ecr 488284367], length 228
20:34:28.845666 IP 155.138.140.26.vultr.com.ssh > 2.146.158.104.in-addr.arpa.53986: Flags [P.], seq 44592:44820, ack 1, win 501, options [nop,nop,TS val 1836104791 ecr 488284367], length 228
20:34:28.845698 IP 155.138.140.26.vultr.com.ssh > 2.146.158.104.in-addr.arpa.53986: Flags [P.], seq 44820:45048, ack 1, win 501, options [nop,nop,TS val 1836104791 ecr 488284367], length 228
20:34:28.845730 IP 155.138.140.26.vultr.com.ssh > 2.146.158.104.in-addr.arpa.53986: Flags [P.], seq 45048:45276, ack 1, win 501, options [nop,nop,TS val 1836104791 ecr 488284367], length 228
20:34:28.845766 IP 155.138.140.26.vultr.com.ssh > 2.146.158.104.in-addr.arpa.53986: Flags [P.], seq 45276:45504, ack 1, win 501, options [nop,nop,TS val 1836104791 ecr 488284367], length 228
20:34:28.845804 IP 155.138.140.26.vultr.com.ssh > 2.146.158.104.in-addr.arpa.53986: Flags [P.], seq 45504:45732, ack 1, win 501, options [nop,nop,TS val 1836104791 ecr 488284367], length 228
20:34:28.845836 IP 155.138.140.26.vultr.com.ssh > 2.146.158.104.in-addr.arpa.53986: Flags [P.], seq 45732:45960, ack 1, win 501, options [nop,nop,TS val 1836104791 ecr 488284367], length 228
20:34:28.845876 IP 155.138.140.26.vultr.com.ssh > 2.146.158.104.in-addr.arpa.53986: Flags [P.], seq 45960:46188, ack 1, win 501, options [nop,nop,TS val 1836104791 ecr 488284367], length 228
20:34:28.845916 IP 155.138.140.26.vultr.com.ssh > 2.146.158.104.in-addr.arpa.53986: Flags [P.], seq 46188:46416, ack 1, win 501, options [nop,nop,TS val 1836104791 ecr 488284367], length 228
20:34:28.845950 IP 155.138.140.26.vultr.com.ssh > 2.146.158.104.in-addr.arpa.53986: Flags [P.], seq 46416:46644, ack 1, win 501, options [nop,nop,TS val 1836104791 ecr 488284367], length 228
20:34:28.845985 IP 155.138.140.26.vultr.com.ssh > 2.146.158.104.in-addr.arpa.53986: Flags [P.], seq 46644:46872, ack 1, win 501, options [nop,nop,TS val 1836104791 ecr 488284367], length 228
20:34:28.846017 IP 155.138.140.26.vultr.com.ssh > 2.146.158.104.in-addr.arpa.53986: Flags [P.], seq 46872:47100, ack 1, win 501, options [nop,nop,TS val 1836104791 ecr 488284367], length 228
20:34:28.846052 IP 155.138.140.26.vultr.com.ssh > 2.146.158.104.in-addr.arpa.53986: Flags [P.], seq 47100:47328, ack 1, win 501, options [nop,nop,TS val 1836104791 ecr 488284367], length 228
20:34:28.846085 IP 155.138.140.26.vultr.com.ssh > 2.146.158.104.in-addr.arpa.53986: Flags [P.], seq 47328:47556, ack 1, win 501, options [nop,nop,TS val 1836104791 ecr 488284367], length 228
20:34:28.846118 IP 155.138.140.26.vultr.com.ssh > 2.146.158.104.in-addr.arpa.53986: Flags [P.], seq 47556:47784, ack 1, win 501, options [nop,nop,TS val 1836104791 ecr 488284367], length 228
20:34:28.846155 IP 155.138.140.26.vultr.com.ssh > 2.146.158.104.in-addr.arpa.53986: Flags [P.], seq 47784:48012, ack 1, win 501, options [nop,nop,TS val 1836104791 ecr 488284367], length 228
20:34:28.846186 IP 155.138.140.26.vultr.com.ssh > 2.146.158.104.in-addr.arpa.53986: Flags [P.], seq 48012:48240, ack 1, win 501, options [nop,nop,TS val 1836104791 ecr 488284367], length 228
20:34:28.846220 IP 155.138.140.26.vultr.com.ssh > 2.146.158.104.in-addr.arpa.53986: Flags [P.], seq 48240:48468, ack 1, win 501, options [nop,nop,TS val 1836104791 ecr 488284367], length 228
20:34:28.846254 IP 155.138.140.26.vultr.com.ssh > 2.146.158.104.in-addr.arpa.53986: Flags [P.], seq 48468:48696, ack 1, win 501, options [nop,nop,TS val 1836104791 ecr 488284367], length 228
20:34:28.846286 IP 155.138.140.26.vultr.com.ssh > 2.146.158.104.in-addr.arpa.53986: Flags [P.], seq 48696:48924, ack 1, win 501, options [nop,nop,TS val 1836104791 ecr 488284367], length 228
20:34:28.846320 IP 155.138.140.26.vultr.com.ssh > 2.146.158.104.in-addr.arpa.53986: Flags [P.], seq 48924:49152, ack 1, win 501, options [nop,nop,TS val 1836104791 ecr 488284367], length 228
20:34:28.846354 IP 155.138.140.26.vultr.com.ssh > 2.146.158.104.in-addr.arpa.53986: Flags [P.], seq 49152:49380, ack 1, win 501, options [nop,nop,TS val 1836104791 ecr 488284367], length 228
