root@comp3134:~# tcpdump -i enp1s0 tcp
tcpdump: verbose output suppressed, use -v or -vv for full protocol decode
listening on enp1s0, link-type EN10MB (Ethernet), capture size 262144 bytes
20:32:15.058880 IP 155.138.140.26.vultr.com.ssh > 2.146.158.104.in-addr.arpa.53986: Flags [P.], seq 3809881437:3809881545, ack 3713447368, win 501, options [nop,nop,TS val 1835971004 ecr 488150586], length 108
20:32:15.058942 IP 155.138.140.26.vultr.com.ssh > 2.146.158.104.in-addr.arpa.53986: Flags [P.], seq 108:144, ack 1, win 501, options [nop,nop,TS val 1835971004 ecr 488150586], length 36
20:32:15.058975 IP 155.138.140.26.vultr.com.ssh > 2.146.158.104.in-addr.arpa.53986: Flags [P.], seq 144:260, ack 1, win 501, options [nop,nop,TS val 1835971004 ecr 488150586], length 116
20:32:15.059012 IP 155.138.140.26.vultr.com.ssh > 2.146.158.104.in-addr.arpa.53986: Flags [P.], seq 260:296, ack 1, win 501, options [nop,nop,TS val 1835971004 ecr 488150586], length 36
20:32:15.059633 IP 155.138.140.26.vultr.com.ssh > 2.146.158.104.in-addr.arpa.53986: Flags [P.], seq 296:540, ack 1, win 501, options [nop,nop,TS val 1835971005 ecr 488150586], length 244
20:32:15.059673 IP 155.138.140.26.vultr.com.ssh > 2.146.158.104.in-addr.arpa.53986: Flags [P.], seq 540:576, ack 1, win 501, options [nop,nop,TS val 1835971005 ecr 488150586], length 36
20:32:15.059718 IP 155.138.140.26.vultr.com.ssh > 2.146.158.104.in-addr.arpa.53986: Flags [P.], seq 576:796, ack 1, win 501, options [nop,nop,TS val 1835971005 ecr 488150586], length 220
20:32:15.059756 IP 155.138.140.26.vultr.com.ssh > 2.146.158.104.in-addr.arpa.53986: Flags [P.], seq 796:832, ack 1, win 501, options [nop,nop,TS val 1835971005 ecr 488150586], length 36
20:32:15.059799 IP 155.138.140.26.vultr.com.ssh > 2.146.158.104.in-addr.arpa.53986: Flags [P.], seq 832:1052, ack 1, win 501, options [nop,nop,TS val 1835971005 ecr 488150586], length 220
20:32:15.059828 IP 155.138.140.26.vultr.com.ssh > 2.146.158.104.in-addr.arpa.53986: Flags [P.], seq 1052:1088, ack 1, win 501, options [nop,nop,TS val 1835971005 ecr 488150586], length 36
20:32:15.059872 IP 155.138.140.26.vultr.com.ssh > 2.146.158.104.in-addr.arpa.53986: Flags [P.], seq 1088:1308, ack 1, win 501, options [nop,nop,TS val 1835971005 ecr 488150586], length 220
20:32:15.059905 IP 155.138.140.26.vultr.com.ssh > 2.146.158.104.in-addr.arpa.53986: Flags [P.], seq 1308:1344, ack 1, win 501, options [nop,nop,TS val 1835971005 ecr 488150586], length 36
20:32:15.059941 IP 155.138.140.26.vultr.com.ssh > 2.146.158.104.in-addr.arpa.53986: Flags [P.], seq 1344:1564, ack 1, win 501, options [nop,nop,TS val 1835971005 ecr 488150586], length 220
20:32:15.059966 IP 155.138.140.26.vultr.com.ssh > 2.146.158.104.in-addr.arpa.53986: Flags [P.], seq 1564:1600, ack 1, win 501, options [nop,nop,TS val 1835971005 ecr 488150586], length 36
20:32:15.060000 IP 155.138.140.26.vultr.com.ssh > 2.146.158.104.in-addr.arpa.53986: Flags [P.], seq 1600:1820, ack 1, win 501, options [nop,nop,TS val 1835971005 ecr 488150586], length 220
20:32:15.060023 IP 155.138.140.26.vultr.com.ssh > 2.146.158.104.in-addr.arpa.53986: Flags [P.], seq 1820:1856, ack 1, win 501, options [nop,nop,TS val 1835971005 ecr 488150586], length 36
20:32:15.060058 IP 155.138.140.26.vultr.com.ssh > 2.146.158.104.in-addr.arpa.53986: Flags [P.], seq 1856:2076, ack 1, win 501, options [nop,nop,TS val 1835971005 ecr 488150586], length 220
20:32:15.060087 IP 155.138.140.26.vultr.com.ssh > 2.146.158.104.in-addr.arpa.53986: Flags [P.], seq 2076:2112, ack 1, win 501, options [nop,nop,TS val 1835971005 ecr 488150586], length 36
20:32:15.060117 IP 155.138.140.26.vultr.com.ssh > 2.146.158.104.in-addr.arpa.53986: Flags [P.], seq 2112:2332, ack 1, win 501, options [nop,nop,TS val 1835971005 ecr 488150586], length 220
20:32:15.060138 IP 155.138.140.26.vultr.com.ssh > 2.146.158.104.in-addr.arpa.53986: Flags [P.], seq 2332:2368, ack 1, win 501, options [nop,nop,TS val 1835971005 ecr 488150586], length 36
20:32:15.060172 IP 155.138.140.26.vultr.com.ssh > 2.146.158.104.in-addr.arpa.53986: Flags [P.], seq 2368:2596, ack 1, win 501, options [nop,nop,TS val 1835971005 ecr 488150586], length 228
20:32:15.060193 IP 155.138.140.26.vultr.com.ssh > 2.146.158.104.in-addr.arpa.53986: Flags [P.], seq 2596:2632, ack 1, win 501, options [nop,nop,TS val 1835971005 ecr 488150586], length 36
20:32:15.060223 IP 155.138.140.26.vultr.com.ssh > 2.146.158.104.in-addr.arpa.53986: Flags [P.], seq 2632:2860, ack 1, win 501, options [nop,nop,TS val 1835971005 ecr 488150586], length 228
20:32:15.060247 IP 155.138.140.26.vultr.com.ssh > 2.146.158.104.in-addr.arpa.53986: Flags [P.], seq 2860:2896, ack 1, win 501, options [nop,nop,TS val 1835971005 ecr 488150586], length 36
20:32:15.060283 IP 155.138.140.26.vultr.com.ssh > 2.146.158.104.in-addr.arpa.53986: Flags [P.], seq 2896:3124, ack 1, win 501, options [nop,nop,TS val 1835971005 ecr 488150586], length 228
20:32:15.060309 IP 155.138.140.26.vultr.com.ssh > 2.146.158.104.in-addr.arpa.53986: Flags [P.], seq 3124:3160, ack 1, win 501, options [nop,nop,TS val 1835971005 ecr 488150586], length 36
20:32:15.060341 IP 155.138.140.26.vultr.com.ssh > 2.146.158.104.in-addr.arpa.53986: Flags [P.], seq 3160:3388, ack 1, win 501, options [nop,nop,TS val 1835971005 ecr 488150586], length 228
20:32:15.060361 IP 155.138.140.26.vultr.com.ssh > 2.146.158.104.in-addr.arpa.53986: Flags [P.], seq 3388:3424, ack 1, win 501, options [nop,nop,TS val 1835971005 ecr 488150586], length 36
20:32:15.060396 IP 155.138.140.26.vultr.com.ssh > 2.146.158.104.in-addr.arpa.53986: Flags [P.], seq 3424:3652, ack 1, win 501, options [nop,nop,TS val 1835971005 ecr 488150586], length 228
20:32:15.060417 IP 155.138.140.26.vultr.com.ssh > 2.146.158.104.in-addr.arpa.53986: Flags [P.], seq 3652:3688, ack 1, win 501, options [nop,nop,TS val 1835971005 ecr 488150586], length 36
20:32:15.060446 IP 155.138.140.26.vultr.com.ssh > 2.146.158.104.in-addr.arpa.53986: Flags [P.], seq 3688:3916, ack 1, win 501, options [nop,nop,TS val 1835971005 ecr 488150586], length 228
20:32:15.060470 IP 155.138.140.26.vultr.com.ssh > 2.146.158.104.in-addr.arpa.53986: Flags [P.], seq 3916:3952, ack 1, win 501, options [nop,nop,TS val 1835971005 ecr 488150586], length 36
20:32:15.060499 IP 155.138.140.26.vultr.com.ssh > 2.146.158.104.in-addr.arpa.53986: Flags [P.], seq 3952:4180, ack 1, win 501, options [nop,nop,TS val 1835971006 ecr 488150586], length 228
20:32:15.060521 IP 155.138.140.26.vultr.com.ssh > 2.146.158.104.in-addr.arpa.53986: Flags [P.], seq 4180:4216, ack 1, win 501, options [nop,nop,TS val 1835971006 ecr 488150586], length 36
20:32:15.060553 IP 155.138.140.26.vultr.com.ssh > 2.146.158.104.in-addr.arpa.53986: Flags [P.], seq 4216:4444, ack 1, win 501, options [nop,nop,TS val 1835971006 ecr 488150586], length 228
20:32:15.060580 IP 155.138.140.26.vultr.com.ssh > 2.146.158.104.in-addr.arpa.53986: Flags [P.], seq 4444:4480, ack 1, win 501, options [nop,nop,TS val 1835971006 ecr 488150586], length 36
20:32:15.060620 IP 155.138.140.26.vultr.com.ssh > 2.146.158.104.in-addr.arpa.53986: Flags [P.], seq 4480:4708, ack 1, win 501, options [nop,nop,TS val 1835971006 ecr 488150586], length 228
20:32:15.060651 IP 155.138.140.26.vultr.com.ssh > 2.146.158.104.in-addr.arpa.53986: Flags [P.], seq 4708:4744, ack 1, win 501, options [nop,nop,TS val 1835971006 ecr 488150586], length 36
20:32:15.060687 IP 155.138.140.26.vultr.com.ssh > 2.146.158.104.in-addr.arpa.53986: Flags [P.], seq 4744:4972, ack 1, win 501, options [nop,nop,TS val 1835971006 ecr 488150586], length 228
20:32:15.060711 IP 155.138.140.26.vultr.com.ssh > 2.146.158.104.in-addr.arpa.53986: Flags [P.], seq 4972:5008, ack 1, win 501, options [nop,nop,TS val 1835971006 ecr 488150586], length 36
20:32:15.060740 IP 155.138.140.26.vultr.com.ssh > 2.146.158.104.in-addr.arpa.53986: Flags [P.], seq 5008:5236, ack 1, win 501, options [nop,nop,TS val 1835971006 ecr 488150586], length 228
20:32:15.060771 IP 155.138.140.26.vultr.com.ssh > 2.146.158.104.in-addr.arpa.53986: Flags [P.], seq 5236:5272, ack 1, win 501, options [nop,nop,TS val 1835971006 ecr 488150586], length 36
20:32:15.060828 IP 155.138.140.26.vultr.com.ssh > 2.146.158.104.in-addr.arpa.53986: Flags [P.], seq 5272:5500, ack 1, win 501, options [nop,nop,TS val 1835971006 ecr 488150586], length 228
20:32:15.060851 IP 155.138.140.26.vultr.com.ssh > 2.146.158.104.in-addr.arpa.53986: Flags [P.], seq 5500:5536, ack 1, win 501, options [nop,nop,TS val 1835971006 ecr 488150586], length 36
20:32:15.060885 IP 155.138.140.26.vultr.com.ssh > 2.146.158.104.in-addr.arpa.53986: Flags [P.], seq 5536:5764, ack 1, win 501, options [nop,nop,TS val 1835971006 ecr 488150586], length 228
20:32:15.060905 IP 155.138.140.26.vultr.com.ssh > 2.146.158.104.in-addr.arpa.53986: Flags [P.], seq 5764:5800, ack 1, win 501, options [nop,nop,TS val 1835971006 ecr 488150586], length 36
20:32:15.060938 IP 155.138.140.26.vultr.com.ssh > 2.146.158.104.in-addr.arpa.53986: Flags [P.], seq 5800:6028, ack 1, win 501, options [nop,nop,TS val 1835971006 ecr 488150586], length 228
20:32:15.060961 IP 155.138.140.26.vultr.com.ssh > 2.146.158.104.in-addr.arpa.53986: Flags [P.], seq 6028:6064, ack 1, win 501, options [nop,nop,TS val 1835971006 ecr 488150586], length 36
20:32:15.060990 IP 155.138.140.26.vultr.com.ssh > 2.146.158.104.in-addr.arpa.53986: Flags [P.], seq 6064:6292, ack 1, win 501, options [nop,nop,TS val 1835971006 ecr 488150586], length 228
20:32:15.061016 IP 155.138.140.26.vultr.com.ssh > 2.146.158.104.in-addr.arpa.53986: Flags [P.], seq 6292:6328, ack 1, win 501, options [nop,nop,TS val 1835971006 ecr 488150586], length 36
20:32:15.061045 IP 155.138.140.26.vultr.com.ssh > 2.146.158.104.in-addr.arpa.53986: Flags [P.], seq 6328:6556, ack 1, win 501, options [nop,nop,TS val 1835971006 ecr 488150586], length 228
20:32:15.061092 IP 155.138.140.26.vultr.com.ssh > 2.146.158.104.in-addr.arpa.53986: Flags [P.], seq 6556:6592, ack 1, win 501, options [nop,nop,TS val 1835971006 ecr 488150586], length 36
20:32:15.061130 IP 155.138.140.26.vultr.com.ssh > 2.146.158.104.in-addr.arpa.53986: Flags [P.], seq 6592:6820, ack 1, win 501, options [nop,nop,TS val 1835971006 ecr 488150586], length 228
20:32:15.061154 IP 155.138.140.26.vultr.com.ssh > 2.146.158.104.in-addr.arpa.53986: Flags [P.], seq 6820:6856, ack 1, win 501, options [nop,nop,TS val 1835971006 ecr 488150586], length 36
20:32:15.061188 IP 155.138.140.26.vultr.com.ssh > 2.146.158.104.in-addr.arpa.53986: Flags [P.], seq 6856:7084, ack 1, win 501, options [nop,nop,TS val 1835971006 ecr 488150586], length 228
20:32:15.061209 IP 155.138.140.26.vultr.com.ssh > 2.146.158.104.in-addr.arpa.53986: Flags [P.], seq 7084:7120, ack 1, win 501, options [nop,nop,TS val 1835971006 ecr 488150586], length 36
20:32:15.061239 IP 155.138.140.26.vultr.com.ssh > 2.146.158.104.in-addr.arpa.53986: Flags [P.], seq 7120:7348, ack 1, win 501, options [nop,nop,TS val 1835971006 ecr 488150586], length 228
20:32:15.061263 IP 155.138.140.26.vultr.com.ssh > 2.146.158.104.in-addr.arpa.53986: Flags [P.], seq 7348:7384, ack 1, win 501, options [nop,nop,TS val 1835971006 ecr 488150586], length 36
20:32:15.061291 IP 155.138.140.26.vultr.com.ssh > 2.146.158.104.in-addr.arpa.53986: Flags [P.], seq 7384:7612, ack 1, win 501, options [nop,nop,TS val 1835971006 ecr 488150586], length 228
20:32:15.061348 IP 155.138.140.26.vultr.com.ssh > 2.146.158.104.in-addr.arpa.53986: Flags [P.], seq 7648:7876, ack 1, win 501, options [nop,nop,TS val 1835971006 ecr 488150586], length 228
20:32:15.061403 IP 155.138.140.26.vultr.com.ssh > 2.146.158.104.in-addr.arpa.53986: Flags [P.], seq 7912:8140, ack 1, win 501, options [nop,nop,TS val 1835971006 ecr 488150586], length 228
20:32:15.061466 IP 155.138.140.26.vultr.com.ssh > 2.146.158.104.in-addr.arpa.53986: Flags [P.], seq 8176:8404, ack 1, win 501, options [nop,nop,TS val 1835971006 ecr 488150586], length 228
20:32:15.061529 IP 155.138.140.26.vultr.com.ssh > 2.146.158.104.in-addr.arpa.53986: Flags [P.], seq 8440:8668, ack 1, win 501, options [nop,nop,TS val 1835971007 ecr 488150586], length 228
20:32:15.061590 IP 155.138.140.26.vultr.com.ssh > 2.146.158.104.in-addr.arpa.53986: Flags [P.], seq 8704:8932, ack 1, win 501, options [nop,nop,TS val 1835971007 ecr 488150586], length 228
20:32:15.061635 IP 155.138.140.26.vultr.com.ssh > 2.146.158.104.in-addr.arpa.53986: Flags [P.], seq 8932:8968, ack 1, win 501, options [nop,nop,TS val 1835971007 ecr 488150586], length 36
20:32:15.061701 IP 155.138.140.26.vultr.com.ssh > 2.146.158.104.in-addr.arpa.53986: Flags [P.], seq 9232:9460, ack 1, win 501, options [nop,nop,TS val 1835971007 ecr 488150586], length 228
20:32:15.061758 IP 155.138.140.26.vultr.com.ssh > 2.146.158.104.in-addr.arpa.53986: Flags [P.], seq 9496:9724, ack 1, win 501, options [nop,nop,TS val 1835971007 ecr 488150586], length 228
20:32:15.061812 IP 155.138.140.26.vultr.com.ssh > 2.146.158.104.in-addr.arpa.53986: Flags [P.], seq 9760:9988, ack 1, win 501, options [nop,nop,TS val 1835971007 ecr 488150586], length 228
20:32:15.061868 IP 155.138.140.26.vultr.com.ssh > 2.146.158.104.in-addr.arpa.53986: Flags [P.], seq 10024:10252, ack 1, win 501, options [nop,nop,TS val 1835971007 ecr 488150586], length 228
20:32:15.061919 IP 155.138.140.26.vultr.com.ssh > 2.146.158.104.in-addr.arpa.53986: Flags [P.], seq 10288:10516, ack 1, win 501, options [nop,nop,TS val 1835971007 ecr 488150586], length 228
20:32:15.061978 IP 155.138.140.26.vultr.com.ssh > 2.146.158.104.in-addr.arpa.53986: Flags [P.], seq 10552:10780, ack 1, win 501, options [nop,nop,TS val 1835971007 ecr 488150586], length 228
20:32:15.062032 IP 155.138.140.26.vultr.com.ssh > 2.146.158.104.in-addr.arpa.53986: Flags [P.], seq 10816:11044, ack 1, win 501, options [nop,nop,TS val 1835971007 ecr 488150586], length 228
20:32:15.062094 IP 155.138.140.26.vultr.com.ssh > 2.146.158.104.in-addr.arpa.53986: Flags [P.], seq 11080:11308, ack 1, win 501, options [nop,nop,TS val 1835971007 ecr 488150586], length 228
20:32:15.062156 IP 155.138.140.26.vultr.com.ssh > 2.146.158.104.in-addr.arpa.53986: Flags [P.], seq 11344:11572, ack 1, win 501, options [nop,nop,TS val 1835971007 ecr 488150586], length 228
20:32:15.062215 IP 155.138.140.26.vultr.com.ssh > 2.146.158.104.in-addr.arpa.53986: Flags [P.], seq 11608:11836, ack 1, win 501, options [nop,nop,TS val 1835971007 ecr 488150586], length 228
20:32:15.062251 IP 155.138.140.26.vultr.com.ssh > 2.146.158.104.in-addr.arpa.53986: Flags [P.], seq 11836:11872, ack 1, win 501, options [nop,nop,TS val 1835971007 ecr 488150586], length 36
20:32:15.062286 IP 155.138.140.26.vultr.com.ssh > 2.146.158.104.in-addr.arpa.53986: Flags [P.], seq 12100:12136, ack 1, win 501, options [nop,nop,TS val 1835971007 ecr 488150586], length 36
20:32:15.062365 IP 155.138.140.26.vultr.com.ssh > 2.146.158.104.in-addr.arpa.53986: Flags [P.], seq 12400:12628, ack 1, win 501, options [nop,nop,TS val 1835971007 ecr 488150586], length 228
20:32:15.062425 IP 155.138.140.26.vultr.com.ssh > 2.146.158.104.in-addr.arpa.53986: Flags [P.], seq 12664:12892, ack 1, win 501, options [nop,nop,TS val 1835971007 ecr 488150586], length 228
20:32:15.062489 IP 155.138.140.26.vultr.com.ssh > 2.146.158.104.in-addr.arpa.53986: Flags [P.], seq 12928:13156, ack 1, win 501, options [nop,nop,TS val 1835971008 ecr 488150586], length 228
20:32:15.062551 IP 155.138.140.26.vultr.com.ssh > 2.146.158.104.in-addr.arpa.53986: Flags [P.], seq 13192:13420, ack 1, win 501, options [nop,nop,TS val 1835971008 ecr 488150586], length 228
20:32:15.062611 IP 155.138.140.26.vultr.com.ssh > 2.146.158.104.in-addr.arpa.53986: Flags [P.], seq 13456:13684, ack 1, win 501, options [nop,nop,TS val 1835971008 ecr 488150586], length 228
20:32:15.062693 IP 155.138.140.26.vultr.com.ssh > 2.146.158.104.in-addr.arpa.53986: Flags [P.], seq 13720:13948, ack 1, win 501, options [nop,nop,TS val 1835971008 ecr 488150586], length 228
20:32:15.062754 IP 155.138.140.26.vultr.com.ssh > 2.146.158.104.in-addr.arpa.53986: Flags [P.], seq 13984:14212, ack 1, win 501, options [nop,nop,TS val 1835971008 ecr 488150586], length 228
20:32:15.062807 IP 155.138.140.26.vultr.com.ssh > 2.146.158.104.in-addr.arpa.53986: Flags [P.], seq 14248:14476, ack 1, win 501, options [nop,nop,TS val 1835971008 ecr 488150586], length 228
20:32:15.062862 IP 155.138.140.26.vultr.com.ssh > 2.146.158.104.in-addr.arpa.53986: Flags [P.], seq 14512:14740, ack 1, win 501, options [nop,nop,TS val 1835971008 ecr 488150586], length 228
20:32:15.062925 IP 155.138.140.26.vultr.com.ssh > 2.146.158.104.in-addr.arpa.53986: Flags [P.], seq 14776:15004, ack 1, win 501, options [nop,nop,TS val 1835971008 ecr 488150586], length 228
20:32:15.062974 IP 155.138.140.26.vultr.com.ssh > 2.146.158.104.in-addr.arpa.53986: Flags [P.], seq 15040:15268, ack 1, win 501, options [nop,nop,TS val 1835971008 ecr 488150586], length 228
20:32:15.063034 IP 155.138.140.26.vultr.com.ssh > 2.146.158.104.in-addr.arpa.53986: Flags [P.], seq 15304:15532, ack 1, win 501, options [nop,nop,TS val 1835971008 ecr 488150586], length 228
20:32:15.063103 IP 155.138.140.26.vultr.com.ssh > 2.146.158.104.in-addr.arpa.53986: Flags [P.], seq 15568:15796, ack 1, win 501, options [nop,nop,TS val 1835971008 ecr 488150586], length 228
20:32:15.063142 IP 155.138.140.26.vultr.com.ssh > 2.146.158.104.in-addr.arpa.53986: Flags [P.], seq 15796:15832, ack 1, win 501, options [nop,nop,TS val 1835971008 ecr 488150586], length 36
20:32:15.063218 IP 155.138.140.26.vultr.com.ssh > 2.146.158.104.in-addr.arpa.53986: Flags [P.], seq 16096:16324, ack 1, win 501, options [nop,nop,TS val 1835971008 ecr 488150586], length 228
20:32:15.063275 IP 155.138.140.26.vultr.com.ssh > 2.146.158.104.in-addr.arpa.53986: Flags [P.], seq 16360:16588, ack 1, win 501, options [nop,nop,TS val 1835971008 ecr 488150586], length 228
20:32:15.063328 IP 155.138.140.26.vultr.com.ssh > 2.146.158.104.in-addr.arpa.53986: Flags [P.], seq 16624:16852, ack 1, win 501, options [nop,nop,TS val 1835971008 ecr 488150586], length 228
20:32:15.063385 IP 155.138.140.26.vultr.com.ssh > 2.146.158.104.in-addr.arpa.53986: Flags [P.], seq 16888:17116, ack 1, win 501, options [nop,nop,TS val 1835971008 ecr 488150586], length 228
20:32:15.063438 IP 155.138.140.26.vultr.com.ssh > 2.146.158.104.in-addr.arpa.53986: Flags [P.], seq 17152:17380, ack 1, win 501, options [nop,nop,TS val 1835971008 ecr 488150586], length 228
20:32:15.063500 IP 155.138.140.26.vultr.com.ssh > 2.146.158.104.in-addr.arpa.53986: Flags [P.], seq 17416:17644, ack 1, win 501, options [nop,nop,TS val 1835971009 ecr 488150586], length 228
20:32:15.063562 IP 155.138.140.26.vultr.com.ssh > 2.146.158.104.in-addr.arpa.53986: Flags [P.], seq 17680:17908, ack 1, win 501, options [nop,nop,TS val 1835971009 ecr 488150586], length 228
20:32:15.063618 IP 155.138.140.26.vultr.com.ssh > 2.146.158.104.in-addr.arpa.53986: Flags [P.], seq 17944:18172, ack 1, win 501, options [nop,nop,TS val 1835971009 ecr 488150586], length 228
20:32:15.063671 IP 155.138.140.26.vultr.com.ssh > 2.146.158.104.in-addr.arpa.53986: Flags [P.], seq 18208:18436, ack 1, win 501, options [nop,nop,TS val 1835971009 ecr 488150586], length 228
20:32:15.063724 IP 155.138.140.26.vultr.com.ssh > 2.146.158.104.in-addr.arpa.53986: Flags [P.], seq 18472:18700, ack 1, win 501, options [nop,nop,TS val 1835971009 ecr 488150586], length 228
20:32:15.063787 IP 155.138.140.26.vultr.com.ssh > 2.146.158.104.in-addr.arpa.53986: Flags [P.], seq 18736:18964, ack 1, win 501, options [nop,nop,TS val 1835971009 ecr 488150586], length 228
20:32:15.063853 IP 155.138.140.26.vultr.com.ssh > 2.146.158.104.in-addr.arpa.53986: Flags [P.], seq 19000:19228, ack 1, win 501, options [nop,nop,TS val 1835971009 ecr 488150586], length 228
20:32:15.063886 IP 155.138.140.26.vultr.com.ssh > 2.146.158.104.in-addr.arpa.53986: Flags [P.], seq 19228:19264, ack 1, win 501, options [nop,nop,TS val 1835971009 ecr 488150586], length 36
20:32:15.063981 IP 155.138.140.26.vultr.com.ssh > 2.146.158.104.in-addr.arpa.53986: Flags [P.], seq 19528:19756, ack 1, win 501, options [nop,nop,TS val 1835971009 ecr 488150586], length 228
20:32:15.064037 IP 155.138.140.26.vultr.com.ssh > 2.146.158.104.in-addr.arpa.53986: Flags [P.], seq 19792:20020, ack 1, win 501, options [nop,nop,TS val 1835971009 ecr 488150586], length 228
20:32:15.064085 IP 155.138.140.26.vultr.com.ssh > 2.146.158.104.in-addr.arpa.53986: Flags [P.], seq 20056:20284, ack 1, win 501, options [nop,nop,TS val 1835971009 ecr 488150586], length 228
20:32:15.064149 IP 155.138.140.26.vultr.com.ssh > 2.146.158.104.in-addr.arpa.53986: Flags [P.], seq 20320:20548, ack 1, win 501, options [nop,nop,TS val 1835971009 ecr 488150586], length 228
20:32:15.064212 IP 155.138.140.26.vultr.com.ssh > 2.146.158.104.in-addr.arpa.53986: Flags [P.], seq 20584:20812, ack 1, win 501, options [nop,nop,TS val 1835971009 ecr 488150586], length 228
20:32:15.064266 IP 155.138.140.26.vultr.com.ssh > 2.146.158.104.in-addr.arpa.53986: Flags [P.], seq 20848:21076, ack 1, win 501, options [nop,nop,TS val 1835971009 ecr 488150586], length 228
20:32:15.064324 IP 155.138.140.26.vultr.com.ssh > 2.146.158.104.in-addr.arpa.53986: Flags [P.], seq 21112:21340, ack 1, win 501, options [nop,nop,TS val 1835971009 ecr 488150586], length 228
20:32:15.064392 IP 155.138.140.26.vultr.com.ssh > 2.146.158.104.in-addr.arpa.53986: Flags [P.], seq 21376:21604, ack 1, win 501, options [nop,nop,TS val 1835971009 ecr 488150586], length 228
20:32:15.064442 IP 155.138.140.26.vultr.com.ssh > 2.146.158.104.in-addr.arpa.53986: Flags [P.], seq 21640:21868, ack 1, win 501, options [nop,nop,TS val 1835971009 ecr 488150586], length 228
20:32:15.064470 IP 155.138.140.26.vultr.com.ssh > 2.146.158.104.in-addr.arpa.53986: Flags [P.], seq 21868:21904, ack 1, win 501, options [nop,nop,TS val 1835971009 ecr 488150586], length 36
20:32:15.064521 IP 155.138.140.26.vultr.com.ssh > 2.146.158.104.in-addr.arpa.53986: Flags [P.], seq 22132:22168, ack 1, win 501, options [nop,nop,TS val 1835971010 ecr 488150586], length 36
20:32:15.064620 IP 155.138.140.26.vultr.com.ssh > 2.146.158.104.in-addr.arpa.53986: Flags [P.], seq 22432:22660, ack 1, win 501, options [nop,nop,TS val 1835971010 ecr 488150586], length 228
20:32:15.064671 IP 155.138.140.26.vultr.com.ssh > 2.146.158.104.in-addr.arpa.53986: Flags [P.], seq 22696:22924, ack 1, win 501, options [nop,nop,TS val 1835971010 ecr 488150586], length 228
20:32:15.064737 IP 155.138.140.26.vultr.com.ssh > 2.146.158.104.in-addr.arpa.53986: Flags [P.], seq 22960:23188, ack 1, win 501, options [nop,nop,TS val 1835971010 ecr 488150586], length 228
20:32:15.064835 IP 155.138.140.26.vultr.com.ssh > 2.146.158.104.in-addr.arpa.53986: Flags [P.], seq 23224:23452, ack 1, win 501, options [nop,nop,TS val 1835971010 ecr 488150586], length 228
20:32:15.064872 IP 155.138.140.26.vultr.com.ssh > 2.146.158.104.in-addr.arpa.53986: Flags [P.], seq 23452:23488, ack 1, win 501, options [nop,nop,TS val 1835971010 ecr 488150586], length 36
20:32:15.064948 IP 155.138.140.26.vultr.com.ssh > 2.146.158.104.in-addr.arpa.53986: Flags [P.], seq 23752:23980, ack 1, win 501, options [nop,nop,TS val 1835971010 ecr 488150586], length 228
20:32:15.065018 IP 155.138.140.26.vultr.com.ssh > 2.146.158.104.in-addr.arpa.53986: Flags [P.], seq 24016:24244, ack 1, win 501, options [nop,nop,TS val 1835971010 ecr 488150586], length 228
20:32:15.065173 IP 155.138.140.26.vultr.com.ssh > 2.146.158.104.in-addr.arpa.53986: Flags [P.], seq 24280:24508, ack 1, win 501, options [nop,nop,TS val 1835971010 ecr 488150586], length 228
20:32:15.065252 IP 155.138.140.26.vultr.com.ssh > 2.146.158.104.in-addr.arpa.53986: Flags [P.], seq 24544:24772, ack 1, win 501, options [nop,nop,TS val 1835971010 ecr 488150586], length 228
20:32:15.065324 IP 155.138.140.26.vultr.com.ssh > 2.146.158.104.in-addr.arpa.53986: Flags [P.], seq 24808:25036, ack 1, win 501, options [nop,nop,TS val 1835971010 ecr 488150586], length 228
20:32:15.065362 IP 155.138.140.26.vultr.com.ssh > 2.146.158.104.in-addr.arpa.53986: Flags [P.], seq 25036:25072, ack 1, win 501, options [nop,nop,TS val 1835971010 ecr 488150586], length 36
20:32:15.065448 IP 155.138.140.26.vultr.com.ssh > 2.146.158.104.in-addr.arpa.53986: Flags [P.], seq 25336:25564, ack 1, win 501, options [nop,nop,TS val 1835971010 ecr 488150586], length 228
20:32:15.065506 IP 155.138.140.26.vultr.com.ssh > 2.146.158.104.in-addr.arpa.53986: Flags [P.], seq 25600:25828, ack 1, win 501, options [nop,nop,TS val 1835971011 ecr 488150586], length 228
20:32:15.065567 IP 155.138.140.26.vultr.com.ssh > 2.146.158.104.in-addr.arpa.53986: Flags [P.], seq 25864:26092, ack 1, win 501, options [nop,nop,TS val 1835971011 ecr 488150586], length 228
20:32:15.065624 IP 155.138.140.26.vultr.com.ssh > 2.146.158.104.in-addr.arpa.53986: Flags [P.], seq 26128:26356, ack 1, win 501, options [nop,nop,TS val 1835971011 ecr 488150586], length 228
20:32:15.065679 IP 155.138.140.26.vultr.com.ssh > 2.146.158.104.in-addr.arpa.53986: Flags [P.], seq 26392:26620, ack 1, win 501, options [nop,nop,TS val 1835971011 ecr 488150586], length 228
20:32:15.065731 IP 155.138.140.26.vultr.com.ssh > 2.146.158.104.in-addr.arpa.53986: Flags [P.], seq 26656:26884, ack 1, win 501, options [nop,nop,TS val 1835971011 ecr 488150586], length 228
20:32:15.065788 IP 155.138.140.26.vultr.com.ssh > 2.146.158.104.in-addr.arpa.53986: Flags [P.], seq 26920:27148, ack 1, win 501, options [nop,nop,TS val 1835971011 ecr 488150586], length 228
20:32:15.065862 IP 155.138.140.26.vultr.com.ssh > 2.146.158.104.in-addr.arpa.53986: Flags [P.], seq 27184:27604, ack 1, win 501, options [nop,nop,TS val 1835971011 ecr 488150586], length 420
20:32:15.065923 IP 155.138.140.26.vultr.com.ssh > 2.146.158.104.in-addr.arpa.53986: Flags [P.], seq 27604:28792, ack 1, win 501, options [nop,nop,TS val 1835971011 ecr 488150586], length 1188
20:32:15.065973 IP 155.138.140.26.vultr.com.ssh > 2.146.158.104.in-addr.arpa.53986: Flags [P.], seq 28792:29596, ack 1, win 501, options [nop,nop,TS val 1835971011 ecr 488150586], length 804
20:32:15.066021 IP 155.138.140.26.vultr.com.ssh > 2.146.158.104.in-addr.arpa.53986: Flags [P.], seq 29596:30400, ack 1, win 501, options [nop,nop,TS val 1835971011 ecr 488150586], length 804
20:32:15.066068 IP 155.138.140.26.vultr.com.ssh > 2.146.158.104.in-addr.arpa.53986: Flags [P.], seq 30400:31204, ack 1, win 501, options [nop,nop,TS val 1835971011 ecr 488150586], length 804
20:32:15.066122 IP 155.138.140.26.vultr.com.ssh > 2.146.158.104.in-addr.arpa.53986: Flags [P.], seq 31204:32008, ack 1, win 501, options [nop,nop,TS val 1835971011 ecr 488150586], length 804
20:32:15.066178 IP 155.138.140.26.vultr.com.ssh > 2.146.158.104.in-addr.arpa.53986: Flags [P.], seq 32008:32620, ack 1, win 501, options [nop,nop,TS val 1835971011 ecr 488150586], length 612
20:32:15.066229 IP 155.138.140.26.vultr.com.ssh > 2.146.158.104.in-addr.arpa.53986: Flags [P.], seq 32620:33424, ack 1, win 501, options [nop,nop,TS val 1835971011 ecr 488150586], length 804
20:32:15.066289 IP 155.138.140.26.vultr.com.ssh > 2.146.158.104.in-addr.arpa.53986: Flags [P.], seq 33424:34420, ack 1, win 501, options [nop,nop,TS val 1835971011 ecr 488150586], length 996
20:32:15.066344 IP 155.138.140.26.vultr.com.ssh > 2.146.158.104.in-addr.arpa.53986: Flags [P.], seq 34420:35032, ack 1, win 501, options [nop,nop,TS val 1835971011 ecr 488150586], length 612
20:32:15.066406 IP 155.138.140.26.vultr.com.ssh > 2.146.158.104.in-addr.arpa.53986: Flags [P.], seq 35032:35452, ack 1, win 501, options [nop,nop,TS val 1835971011 ecr 488150586], length 420
20:32:15.066445 IP 155.138.140.26.vultr.com.ssh > 2.146.158.104.in-addr.arpa.53986: Flags [P.], seq 35452:35680, ack 1, win 501, options [nop,nop,TS val 1835971011 ecr 488150586], length 228
20:32:15.066480 IP 155.138.140.26.vultr.com.ssh > 2.146.158.104.in-addr.arpa.53986: Flags [P.], seq 35680:35908, ack 1, win 501, options [nop,nop,TS val 1835971011 ecr 488150586], length 228
20:32:15.066518 IP 155.138.140.26.vultr.com.ssh > 2.146.158.104.in-addr.arpa.53986: Flags [P.], seq 35908:36136, ack 1, win 501, options [nop,nop,TS val 1835971012 ecr 488150586], length 228
20:32:15.066564 IP 155.138.140.26.vultr.com.ssh > 2.146.158.104.in-addr.arpa.53986: Flags [P.], seq 36136:36364, ack 1, win 501, options [nop,nop,TS val 1835971012 ecr 488150586], length 228
20:32:15.066611 IP 155.138.140.26.vultr.com.ssh > 2.146.158.104.in-addr.arpa.53986: Flags [P.], seq 36364:36592, ack 1, win 501, options [nop,nop,TS val 1835971012 ecr 488150586], length 228
20:32:15.066654 IP 155.138.140.26.vultr.com.ssh > 2.146.158.104.in-addr.arpa.53986: Flags [P.], seq 36592:36820, ack 1, win 501, options [nop,nop,TS val 1835971012 ecr 488150586], length 228
20:32:15.066698 IP 155.138.140.26.vultr.com.ssh > 2.146.158.104.in-addr.arpa.53986: Flags [P.], seq 36820:37048, ack 1, win 501, options [nop,nop,TS val 1835971012 ecr 488150586], length 228
20:32:15.066743 IP 155.138.140.26.vultr.com.ssh > 2.146.158.104.in-addr.arpa.53986: Flags [P.], seq 37048:37276, ack 1, win 501, options [nop,nop,TS val 1835971012 ecr 488150586], length 228
20:32:15.066779 IP 155.138.140.26.vultr.com.ssh > 2.146.158.104.in-addr.arpa.53986: Flags [P.], seq 37276:37504, ack 1, win 501, options [nop,nop,TS val 1835971012 ecr 488150586], length 228
20:32:15.066813 IP 155.138.140.26.vultr.com.ssh > 2.146.158.104.in-addr.arpa.53986: Flags [P.], seq 37504:37732, ack 1, win 501, options [nop,nop,TS val 1835971012 ecr 488150586], length 228
20:32:15.066846 IP 155.138.140.26.vultr.com.ssh > 2.146.158.104.in-addr.arpa.53986: Flags [P.], seq 37732:37960, ack 1, win 501, options [nop,nop,TS val 1835971012 ecr 488150586], length 228
20:32:15.066886 IP 155.138.140.26.vultr.com.ssh > 2.146.158.104.in-addr.arpa.53986: Flags [P.], seq 37960:38188, ack 1, win 501, options [nop,nop,TS val 1835971012 ecr 488150586], length 228
20:32:15.066922 IP 155.138.140.26.vultr.com.ssh > 2.146.158.104.in-addr.arpa.53986: Flags [P.], seq 38188:38416, ack 1, win 501, options [nop,nop,TS val 1835971012 ecr 488150586], length 228
20:32:15.066960 IP 155.138.140.26.vultr.com.ssh > 2.146.158.104.in-addr.arpa.53986: Flags [P.], seq 38416:38644, ack 1, win 501, options [nop,nop,TS val 1835971012 ecr 488150586], length 228
20:32:15.066995 IP 155.138.140.26.vultr.com.ssh > 2.146.158.104.in-addr.arpa.53986: Flags [P.], seq 38644:38872, ack 1, win 501, options [nop,nop,TS val 1835971012 ecr 488150586], length 228
20:32:15.067030 IP 155.138.140.26.vultr.com.ssh > 2.146.158.104.in-addr.arpa.53986: Flags [P.], seq 38872:39100, ack 1, win 501, options [nop,nop,TS val 1835971012 ecr 488150586], length 228
20:32:15.067068 IP 155.138.140.26.vultr.com.ssh > 2.146.158.104.in-addr.arpa.53986: Flags [P.], seq 39100:39328, ack 1, win 501, options [nop,nop,TS val 1835971012 ecr 488150586], length 228
20:32:15.067105 IP 155.138.140.26.vultr.com.ssh > 2.146.158.104.in-addr.arpa.53986: Flags [P.], seq 39328:39556, ack 1, win 501, options [nop,nop,TS val 1835971012 ecr 488150586], length 228
20:32:15.067138 IP 155.138.140.26.vultr.com.ssh > 2.146.158.104.in-addr.arpa.53986: Flags [P.], seq 39556:39784, ack 1, win 501, options [nop,nop,TS val 1835971012 ecr 488150586], length 228
20:32:15.067187 IP 155.138.140.26.vultr.com.ssh > 2.146.158.104.in-addr.arpa.53986: Flags [P.], seq 39784:40012, ack 1, win 501, options [nop,nop,TS val 1835971012 ecr 488150586], length 228
20:32:15.067232 IP 155.138.140.26.vultr.com.ssh > 2.146.158.104.in-addr.arpa.53986: Flags [P.], seq 40012:40240, ack 1, win 501, options [nop,nop,TS val 1835971012 ecr 488150586], length 228
20:32:15.067274 IP 155.138.140.26.vultr.com.ssh > 2.146.158.104.in-addr.arpa.53986: Flags [P.], seq 40240:40468, ack 1, win 501, options [nop,nop,TS val 1835971012 ecr 488150586], length 228
20:32:15.067314 IP 155.138.140.26.vultr.com.ssh > 2.146.158.104.in-addr.arpa.53986: Flags [P.], seq 40468:40696, ack 1, win 501, options [nop,nop,TS val 1835971012 ecr 488150586], length 228
20:32:15.067362 IP 155.138.140.26.vultr.com.ssh > 2.146.158.104.in-addr.arpa.53986: Flags [P.], seq 40696:40924, ack 1, win 501, options [nop,nop,TS val 1835971012 ecr 488150586], length 228
20:32:15.067403 IP 155.138.140.26.vultr.com.ssh > 2.146.158.104.in-addr.arpa.53986: Flags [P.], seq 40924:41152, ack 1, win 501, options [nop,nop,TS val 1835971012 ecr 488150586], length 228
20:32:15.067443 IP 155.138.140.26.vultr.com.ssh > 2.146.158.104.in-addr.arpa.53986: Flags [P.], seq 41152:41380, ack 1, win 501, options [nop,nop,TS val 1835971012 ecr 488150586], length 228
20:32:15.067480 IP 155.138.140.26.vultr.com.ssh > 2.146.158.104.in-addr.arpa.53986: Flags [P.], seq 41380:41608, ack 1, win 501, options [nop,nop,TS val 1835971012 ecr 488150586], length 228
20:32:15.067515 IP 155.138.140.26.vultr.com.ssh > 2.146.158.104.in-addr.arpa.53986: Flags [P.], seq 41608:41836, ack 1, win 501, options [nop,nop,TS val 1835971013 ecr 488150586], length 228
20:32:15.067558 IP 155.138.140.26.vultr.com.ssh > 2.146.158.104.in-addr.arpa.53986: Flags [P.], seq 41836:42064, ack 1, win 501, options [nop,nop,TS val 1835971013 ecr 488150586], length 228
20:32:15.067599 IP 155.138.140.26.vultr.com.ssh > 2.146.158.104.in-addr.arpa.53986: Flags [P.], seq 42064:42292, ack 1, win 501, options [nop,nop,TS val 1835971013 ecr 488150586], length 228
20:32:15.067633 IP 155.138.140.26.vultr.com.ssh > 2.146.158.104.in-addr.arpa.53986: Flags [P.], seq 42292:42520, ack 1, win 501, options [nop,nop,TS val 1835971013 ecr 488150586], length 228
20:32:15.067672 IP 155.138.140.26.vultr.com.ssh > 2.146.158.104.in-addr.arpa.53986: Flags [P.], seq 42520:42748, ack 1, win 501, options [nop,nop,TS val 1835971013 ecr 488150586], length 228
20:32:15.067708 IP 155.138.140.26.vultr.com.ssh > 2.146.158.104.in-addr.arpa.53986: Flags [P.], seq 42748:42976, ack 1, win 501, options [nop,nop,TS val 1835971013 ecr 488150586], length 228
20:32:15.067741 IP 155.138.140.26.vultr.com.ssh > 2.146.158.104.in-addr.arpa.53986: Flags [P.], seq 42976:43204, ack 1, win 501, options [nop,nop,TS val 1835971013 ecr 488150586], length 228
20:32:15.067775 IP 155.138.140.26.vultr.com.ssh > 2.146.158.104.in-addr.arpa.53986: Flags [P.], seq 43204:43432, ack 1, win 501, options [nop,nop,TS val 1835971013 ecr 488150586], length 228
20:32:15.067810 IP 155.138.140.26.vultr.com.ssh > 2.146.158.104.in-addr.arpa.53986: Flags [P.], seq 43432:43660, ack 1, win 501, options [nop,nop,TS val 1835971013 ecr 488150586], length 228
20:32:15.067844 IP 155.138.140.26.vultr.com.ssh > 2.146.158.104.in-addr.arpa.53986: Flags [P.], seq 43660:43888, ack 1, win 501, options [nop,nop,TS val 1835971013 ecr 488150586], length 228
20:32:15.067884 IP 155.138.140.26.vultr.com.ssh > 2.146.158.104.in-addr.arpa.53986: Flags [P.], seq 43888:44116, ack 1, win 501, options [nop,nop,TS val 1835971013 ecr 488150586], length 228
20:32:15.067918 IP 155.138.140.26.vultr.com.ssh > 2.146.158.104.in-addr.arpa.53986: Flags [P.], seq 44116:44344, ack 1, win 501, options [nop,nop,TS val 1835971013 ecr 488150586], length 228
20:32:15.067952 IP 155.138.140.26.vultr.com.ssh > 2.146.158.104.in-addr.arpa.53986: Flags [P.], seq 44344:44572, ack 1, win 501, options [nop,nop,TS val 1835971013 ecr 488150586], length 228
20:32:15.067992 IP 155.138.140.26.vultr.com.ssh > 2.146.158.104.in-addr.arpa.53986: Flags [P.], seq 44572:44800, ack 1, win 501, options [nop,nop,TS val 1835971013 ecr 488150586], length 228
20:32:15.068027 IP 155.138.140.26.vultr.com.ssh > 2.146.158.104.in-addr.arpa.53986: Flags [P.], seq 44800:45028, ack 1, win 501, options [nop,nop,TS val 1835971013 ecr 488150586], length 228
20:32:15.068065 IP 155.138.140.26.vultr.com.ssh > 2.146.158.104.in-addr.arpa.53986: Flags [P.], seq 45028:45256, ack 1, win 501, options [nop,nop,TS val 1835971013 ecr 488150586], length 228
20:32:15.068103 IP 155.138.140.26.vultr.com.ssh > 2.146.158.104.in-addr.arpa.53986: Flags [P.], seq 45256:45484, ack 1, win 501, options [nop,nop,TS val 1835971013 ecr 488150586], length 228
20:32:15.068138 IP 155.138.140.26.vultr.com.ssh > 2.146.158.104.in-addr.arpa.53986: Flags [P.], seq 45484:45712, ack 1, win 501, options [nop,nop,TS val 1835971013 ecr 488150586], length 228
20:32:15.068149 IP 2.146.158.104.in-addr.arpa.53986 > 155.138.140.26.vultr.com.ssh: Flags [.], ack 17944, win 15147, options [nop,nop,TS val 488150609 ecr 1835971009], length 0
20:32:15.068262 IP 155.138.140.26.vultr.com.ssh > 2.146.158.104.in-addr.arpa.53986: Flags [P.], seq 45712:46116, ack 1, win 501, options [nop,nop,TS val 1835971013 ecr 488150609], length 404
20:32:15.068308 IP 155.138.140.26.vultr.com.ssh > 2.146.158.104.in-addr.arpa.53986: Flags [P.], seq 46116:46344, ack 1, win 501, options [nop,nop,TS val 1835971013 ecr 488150609], length 228
20:32:15.068355 IP 155.138.140.26.vultr.com.ssh > 2.146.158.104.in-addr.arpa.53986: Flags [P.], seq 46344:46572, ack 1, win 501, options [nop,nop,TS val 1835971013 ecr 488150609], length 228
20:32:15.068403 IP 155.138.140.26.vultr.com.ssh > 2.146.158.104.in-addr.arpa.53986: Flags [P.], seq 46572:46800, ack 1, win 501, options [nop,nop,TS val 1835971013 ecr 488150609], length 228
20:32:15.068439 IP 155.138.140.26.vultr.com.ssh > 2.146.158.104.in-addr.arpa.53986: Flags [P.], seq 46800:47028, ack 1, win 501, options [nop,nop,TS val 1835971013 ecr 488150609], length 228
20:32:15.068477 IP 155.138.140.26.vultr.com.ssh > 2.146.158.104.in-addr.arpa.53986: Flags [P.], seq 47028:47256, ack 1, win 501, options [nop,nop,TS val 1835971013 ecr 488150609], length 228
20:32:15.068514 IP 155.138.140.26.vultr.com.ssh > 2.146.158.104.in-addr.arpa.53986: Flags [P.], seq 47256:47484, ack 1, win 501, options [nop,nop,TS val 1835971014 ecr 488150609], length 228
20:32:15.068559 IP 155.138.140.26.vultr.com.ssh > 2.146.158.104.in-addr.arpa.53986: Flags [P.], seq 47484:47712, ack 1, win 501, options [nop,nop,TS val 1835971014 ecr 488150609], length 228
20:32:15.068605 IP 155.138.140.26.vultr.com.ssh > 2.146.158.104.in-addr.arpa.53986: Flags [P.], seq 47712:47940, ack 1, win 501, options [nop,nop,TS val 1835971014 ecr 488150609], length 228
20:32:15.068647 IP 155.138.140.26.vultr.com.ssh > 2.146.158.104.in-addr.arpa.53986: Flags [P.], seq 47940:48168, ack 1, win 501, options [nop,nop,TS val 1835971014 ecr 488150609], length 228
20:32:15.068694 IP 155.138.140.26.vultr.com.ssh > 2.146.158.104.in-addr.arpa.53986: Flags [P.], seq 48168:48396, ack 1, win 501, options [nop,nop,TS val 1835971014 ecr 488150609], length 228
20:32:15.068731 IP 155.138.140.26.vultr.com.ssh > 2.146.158.104.in-addr.arpa.53986: Flags [P.], seq 48396:48624, ack 1, win 501, options [nop,nop,TS val 1835971014 ecr 488150609], length 228
20:32:15.068781 IP 155.138.140.26.vultr.com.ssh > 2.146.158.104.in-addr.arpa.53986: Flags [P.], seq 48624:48852, ack 1, win 501, options [nop,nop,TS val 1835971014 ecr 488150609], length 228
20:32:15.068828 IP 155.138.140.26.vultr.com.ssh > 2.146.158.104.in-addr.arpa.53986: Flags [P.], seq 48852:49080, ack 1, win 501, options [nop,nop,TS val 1835971014 ecr 488150609], length 228
20:32:15.068863 IP 155.138.140.26.vultr.com.ssh > 2.146.158.104.in-addr.arpa.53986: Flags [P.], seq 49080:49308, ack 1, win 501, options [nop,nop,TS val 1835971014 ecr 488150609], length 228
20:32:15.068908 IP 155.138.140.26.vultr.com.ssh > 2.146.158.104.in-addr.arpa.53986: Flags [P.], seq 49308:49536, ack 1, win 501, options [nop,nop,TS val 1835971014 ecr 488150609], length 228
20:32:15.068951 IP 155.138.140.26.vultr.com.ssh > 2.146.158.104.in-addr.arpa.53986: Flags [P.], seq 49536:49764, ack 1, win 501, options [nop,nop,TS val 1835971014 ecr 488150609], length 228
20:32:15.068997 IP 155.138.140.26.vultr.com.ssh > 2.146.158.104.in-addr.arpa.53986: Flags [P.], seq 49764:49992, ack 1, win 501, options [nop,nop,TS val 1835971014 ecr 488150609], length 228
20:32:15.069040 IP 155.138.140.26.vultr.com.ssh > 2.146.158.104.in-addr.arpa.53986: Flags [P.], seq 49992:50220, ack 1, win 501, options [nop,nop,TS val 1835971014 ecr 488150609], length 228
